sentences,EF,INF,ADR,DI,Finding,annotation,review_id,sentence_id
А также барбовал провоцирует нарушения женского здоровья.,0,0,1,0,0,ADR[3],2404812,6
И вообще пропало желание спать.,0,0,1,0,0,ADR[9],76765,7
"Поэтому если у вас есть возможность проводить профилактику и укреплять витаминами иммунитет, то не нужно жалеть никаких денег для этого, потому что если заболеет ребёнок, то после лечения можно усугубить здоровье с другой стороны и поразить другие органы, которые до этого были здоровые.",0,0,0,1,0,DI[5],6430802,34
"Около недели принимал препарат и бросил, началась бессонница и тахикардия, мне он не подошел.",0,1,1,0,0,INF[9]|ADR[7],618094,5
"Несмотря на наличие в названии препарата созвучия кор, в показаниях к нему звучат не только сердечные заболевания.",0,0,0,1,0,DI[1],2718482,1
"Что я только не делала, и молоко пила с медом и травки заваривала.",0,0,0,0,0,NEUTRAL,108315,2
"Смысл такого лечения даже не хочу обсуждать, мое мнение о препарате отрицательное, отзыв оставляю отрицательным, нет эффекта.",0,1,0,0,0,INF[2],655105,8
"Но, если более сильный стресс, то они не справятся с ним.",0,1,0,1,0,INF[6]|DI[7],2738039,14
"Моему ребенку 3 года, почти не говорит, в активном словарном запасе около 20 слов всего, неусидчивый, внимание рассеянное.",0,0,0,1,0,DI[5],2407197,1
Однако... есть один большой минус для меня при его приеме!,0,0,0,0,0,NEUTRAL,1031967,4
"Я согласна с тем, что на разных людей одинаковые средства действуют по-разному.",0,0,0,0,0,NEUTRAL,591900,2
Если вам и Ацикловир помогает.,1,0,0,0,0,EF[4],609507,21
"И если уж кому то хочеться поправить здоровье, можно сделать это более экономно.",0,0,0,0,0,NEUTRAL,2541923,10
"Я пила уже их два года назад, было тоже самое только пепарат назывался гроприносин, после него появился герпес на губах через 2 дня.",0,0,1,0,0,ADR[4],1158967,4
"Мы не вчитываясь в состав, но тоже доверяя рекламе в период весенней непогоды, пропили два курса.",0,0,0,0,0,NEUTRAL,822720,2
"И температура стала расти к утру достигла 40,6!!!",0,0,1,0,0,ADR[3],2309597,6
"Так вот, начали давать его и маленькому, но на голове снова появилась ""родовая грязь"", я особо не обратила на это внимания, потому что ребенок почти каждый день пробовал что-то новое.",0,0,1,0,0,ADR[4],3048058,6
А так препарат очень хороший и что немаловажно не очень дорогой.,1,0,0,0,0,EF[3],609507,17
Но оказалось это обычной аллергией на антигриппин.,0,0,1,0,0,ADR[5],2515768,8
Курс мы проходили летом и к осеннему обострению были готовы и к моему удивлению дочка не заболела.,1,0,0,0,0,EF[2],5801796,8
По назначению невролога из-за жалоб на отсутствие речи у ребенка (нам 3 года) начали принимать Когитум.,0,0,0,1,0,DI[1],2424525,1
Но не буду исключать и действия капель.,0,0,0,0,0,NEUTRAL,2465822,11
"Как я знала, это были первые признаки простуды, если не принять меры, завтра я не смогу встать с постели.",0,0,0,1,0,DI[5],24065,2
Деньги выкинутые на ветер.,0,0,0,0,0,NEUTRAL,240878,7
Общее впечатление : Не очень.,0,0,0,0,0,NEUTRAL,632718,3
Спасибо за внимание.,0,0,0,0,0,NEUTRAL,2516885,11
Мне тоже препарат не подошел Время использования: 5,0,0,0,0,0,NEUTRAL,207209,2
"Один раз пользовалась ими в период лактации в проффилактических целях, и, к счастью, также все обошлось.",1,0,0,1,0,EF[2]|DI[4],1089645,4
А вот последующие прививки пришлось помучаться.,0,0,0,0,0,NEUTRAL,3043104,6
"Таблеточки не приносят никакого неудобства, их просто нужно проглотить) Раньше совсем таблетки не пила, а тут подхватила вирус гриппа и разболелась.",0,0,0,1,0,DI[2],5967832,2
"После недели приема, я стал меньше нервничать, и мои руки стали заживать.",1,0,0,1,0,EF[2]|DI[8],792635,7
"К сожалению, но в нашем случае дочке это средство не помогло.",0,1,0,0,0,INF[2],2555494,8
"Мне кажется, что он самый бесполезный из опробованных нами противовирусных препаратов (виферон, кипферон, эргоферон).",0,1,0,0,0,INF[2],2418485,7
Только тогда от приема препарата будет толк с высокой степенью вероятности.,0,0,0,0,0,NEUTRAL,2706079,4
"Начала пить с первых симптомов заболевания строго по инструкции, но толку ни какого!!!",0,1,0,0,0,INF[1],942554,1
"Вызвали скорую (нашей женщинце врачу я не доверяю, училась она видать и попутно расплачивалась за оценки коровами, она у нас буряточка скота многооо много)))положили нас с обструктивным бронхитом средней тяжести, выписались, спустя недельку засвистели, свист был звонкий при плаче, лечились неделю антигистаминными, дышали берадуалом, не помогли, значи не алергозный бронхит, неделю лечились бисептолом суспензией, атхаркивающими дышали физ раствором, нифига, так мы и лечились лечились а потом опять загримели с обструкцией+острый ринофарниг, вот и нам уже 5 мес.",0,0,0,1,0,DI[1],4893288,5
"Прочитала что могут быть боли в мышцах, мол побочное действие!",0,0,0,0,0,NEUTRAL,668099,13
"Трем коллегам и подруги ингавирин помогал, но вот у девушки одного из коллег тоже вызвал аллергическую реакция, но она раньше меня догадалась, что это из-за ингавирина.",0,0,1,0,0,ADR[6],3129222,9
"Не советую ни кому его принимать, лучше пользоваться проверенными средствами.",0,0,0,0,0,NEUTRAL,811884,8
Будьте здоровы:),0,0,0,0,0,NEUTRAL,2450361,11
Поэтому в этом случае положительного эффекта я не наблюдал.,0,1,0,0,0,INF[6],591673,7
Никакой пользы они не принесут.,0,1,0,0,0,INF[7],817386,15
"Общее впечатление : главное начать пользоваться на ранней стадии, эффект есть RATING 4 NOTE",0,0,0,0,0,NEUTRAL,832817,13
"У меня двое детей и оба заболели стоматитом (заразились друг от друга), наш педиатр изначально поставил диагноз ""ангина"", и пока мы неделю лечили ангину наш стоматит разошёлся по всему рту.",0,0,0,1,0,DI[4],877244,2
"Успокаивает очень хорошо, никаких головных болей, как у меня были от других средств, пропила в течение месяца, эффект очень ощутимый, стала менее раздражительной, более спокойной.",1,0,0,1,1,EF[8]|DI[2]|Finding[10],264987,8
Начал помогать быстро.,1,0,0,0,0,EF[1],594103,1
"Он сказал, что ничего серьезного, однако наблюдается (в некоторой степени) истощение нервной системы и нужно немного поберечь нервы.",0,0,0,1,0,DI[4],2662915,3
На развитие речи результата так никакого и не было и нет (уже прошло 3 месяца после приема).,0,1,0,0,0,INF[5],2424525,7
Пила таблетки Сондокс на протяжении трех дней за полчаса до сна.,0,0,0,0,0,NEUTRAL,2502253,4
"Я большой противник всех ... феронов, т. к. они подавляют иммунитет.",0,0,0,0,1,Finding[5],884467,1
В каких дозировках его пить написано на упаковке.,0,0,0,0,0,NEUTRAL,2546667,7
"Потом начались головокружения, сильные боли, рвотные позывы и температура подскочила почти до 40градусов!",0,0,1,0,0,ADR[1],310056,3
"Я принимала в связи с постоянными стрессами на работе, что у меня приводит к бессоннице, тревожности.",0,0,0,1,0,DI[1],2534526,4
"Помогает от гриппа, насморка, боли в горле, кашле.",1,0,0,1,0,EF[4]|DI[6],271761,6
Запах эвкалипта(о котором я могу говорить бесконечно )и лаванды(которая успокаивет) очень нравится детям.,0,0,1,0,0,ADR[3],2428518,7
"Через какое то время, где то месяца через 2-3, ребенку надо было делать прививку, и часто болеющим детям прописываю свечи Виферона для укрепления иммунитета, и что бы прививочный период прошел хорошо.",0,0,0,1,0,DI[8],1068061,8
"До назначения препарата, я говорила неврологу что давление бывает поднимается до 130/90 но не часто, иногда принимала от давления препараты не постоянно.",0,0,0,0,1,Finding[1],2656049,5
"А вот муж, на 5 день заболел и заразил меня.",0,1,0,0,0,INF[5],588478,8
"Лежу в зале, с температурой, головной болью, болью в горле и кашлем.",0,0,0,1,0,DI[4],2659756,10
"Преследует меня проблема герпеса, особенно в холодное время года.",0,0,0,1,0,DI[2],2537356,1
Надо брызгать по одному пшику в каждый носовой проход.,0,0,0,0,0,NEUTRAL,589250,3
"На приеме у врача мне было даже неловко, когда меня, как ребенка, спросили, чему я удивляюсь (у меня зудело все ниже пояса), будто у меня никогда не было молочницы.",0,0,1,0,0,ADR[2],1086939,3
"Мне его так преподнесли, что думал реально крутой крем, рассказала мне, что куча людей его берут и всем помогает.",0,0,0,0,0,NEUTRAL,588785,2
"Стоматолог сказала, что применение интерферона при стоматите обязательно, т. к. стоматит появляется на фоне сниженного иммунитета, а данный препарат как раз направлен на его укрепление и восстановление.",0,0,0,1,0,DI[1],877244,4
"Добрый день, начали у меня проблемы со сном, около месяца мучилась не могла долго заснуть, если с трудом засыпала то проснувшись часа в 3-4 ночи уже не засыпала., решила сходить к врачу, порекомендовал вот это лекарство, в аптеке строго потребовали рецепт, прочитав нотацию, там столько было написано побочных явлений, как и в любом другом препарате, Ну вот при наступление ночи, выпила я свою назначенную дозу препарата, и уснула, впервые за месяц я уснула в течение как мне показалось 10-18 минут.",1,0,0,1,0,EF[1]|DI[2],594839,1
"После использования мази, появлялся неприятный привкус во рту.",0,0,0,0,0,NEUTRAL,610650,10
Последний раз покупала за 35 грн.,0,0,0,0,0,NEUTRAL,2705356,4
"Правда, осталась еще маленькая ранка, но зато губу не раздуло, не разнесло, дальше герпес не пошел.",1,0,0,1,1,EF[1]|DI[8]|Finding[2],832817,8
"Достаточно бессовестно с их стороны заявлять, что он что-то там лечит.",0,0,0,0,0,NEUTRAL,2428403,2
Общее впечатление : Вызывают у меня головную боль.,0,0,1,0,0,ADR[5],87095,5
"У нас ребенок очень часто болеет, и наступил момент когда мы начали гнойной ангиной болеть 2 раза в 3 месяца!",0,0,0,1,0,DI[1],953794,1
"Как и все препараты такого типа, вылечить простуду и уж тем более грипп, Лемсип не может, но снять симптомы этих заболеваний и вернуть к нормальной жизни вполне способен.",0,0,0,1,0,DI[1],2379731,1
"Недавно мне поставили диагноз невроз и я поняла все"" прелести"" заболевания нервной системы-это кошмар.",0,0,0,1,0,DI[1],2491250,2
"Не буду конкретизировать этот препарат для всех, так как у меня были нервные срывы, и я принимала препараты намного сильнее.",0,0,0,0,1,Finding[7],2671902,5
Принимала изопринозин по назначению гинеколога от вируса папиломы.,0,0,0,1,0,DI[1],2015980,1
"Меня охватывал панический страх и ужас, думала, что схожу с ума.",0,0,1,0,0,ADR[4],2522012,7
"С одной стороны да, это опасная болезнь, которая не лечиться, но с другой вакцинация может её вызвать если ребёнок к этому чувствителен!",0,0,0,0,0,NEUTRAL,2692315,1
"""Назаваль ПЛЮС"" - это хорошо разрекламированный способ защиты от ОРВИ, барьерный.",0,0,0,1,0,DI[5],2408295,1
"Примерно через 2 недели после курса лечения стал пытаться разговаривать, но все равно именно говорить у малыша не получается, больше мычит.",1,0,0,1,0,EF[2]|DI[4],609740,3
"Хотя я и могу делать сама себе укольчики, но все же купила Циклоферон в таблетках - он дешевле, да и попа целее будет)).",0,0,0,0,0,NEUTRAL,607716,6
"В первый раз, как заболел ОРВИ: Побежал в аптеку, приобрёл упаковку.",0,0,0,1,0,DI[2],834566,2
Действительно помогает нормализовать сон.,1,0,0,1,0,EF[6]|DI[3],2385125,7
Всем доброго времени суток) В период нашего массового семейного простывания порекомендовала знакомая терапевт купить капли Тонзилгон.,0,0,0,1,0,DI[2],2465822,1
"Купил данный препарат, чтобы повторно лечится от простуды.",0,0,0,1,0,DI[4],2510045,1
"Но честно признаться, я не вижу ни каких результатов.",0,1,0,0,0,INF[2],2461123,9
"Эффект ощущаем, но сказать, что эффект именно от мексикора не могу.",1,0,0,0,0,EF[3],2718482,10
"Делаем профилактику в течении трех лет всей семьей, но в последнее время он не помогает.",0,1,0,1,0,INF[2]|DI[1],2553831,2
"Далее, в течении дней трех болело все тело- не могла до себя докаснуться ладонью.",0,0,1,0,0,ADR[4],2196209,5
"Может быть препарат действительно помогает, но я этого не поняла.",0,1,0,0,0,INF[3],273783,10
"После первого раза подумала, совпадение, но когда это продолжалось по несколько раз и мы обходились лишь ""соплями"" или легким недомоганием 2-3 дня, то Афлубин стал для меня лучшим помощником в борьбе с простудой.",1,0,0,1,0,EF[1]|DI[4],2398170,4
"Возможно он был нам назначен для того, что бы рука в дальнейшем не потеряла свою функциональность.",0,0,0,0,0,NEUTRAL,2543301,4
"Я очень боюсь сквозняков, в результате которых у меня очень часто появляется простуда на губах и глазах.",0,0,0,1,0,DI[5],2412180,1
И таблеток в упаковке вполне хватает на курс приема.,0,0,0,0,0,NEUTRAL,2716232,5
В результае вылечили ребенку сильную заложенность носа синупретом и пришлось антибиотик давать т. к. насморк оказался бактериальный.,1,0,0,1,0,EF[3]|DI[1],2527424,3
"Так вот, эту сыпь я лечила в течении пяти дней, но она так и не исчезла, пока я не СХОДИЛА в ПАРИЛКУ и не ПРОПАРИЛАСЬ в бане !!!",0,0,1,0,0,ADR[5],2818054,5
И уже на следующий день у меня все прошло.,1,0,0,0,0,EF[6],832817,7
"Головокружение вернулось и оно стало сильнее чем было, головная боль появилась, давление на месте не стояло.",0,1,0,1,0,INF[1]|DI[2],2551330,7
"Болею много, часто и подолгу простудными заболеваниями.",0,0,0,1,0,DI[5],899066,1
"Кроме того, во время его приёма, постоянно во рту был привкус йода, очень неприятно.",0,0,1,0,0,ADR[1],2445928,9
Рецыдив появился в начале и в конце месяца (это 2разы уже при приёме).,0,1,0,0,0,INF[4],2734640,5
Время использования: Давно,0,0,0,0,0,NEUTRAL,2665872,11
"Решила принять ещё одну для профилактики и услышала своё сердце, пульс участился, какое-то беспокойство.",0,0,1,1,0,ADR[3]|DI[1],1789376,5
"Защищает головной мозг при повреждении, вызываемом интоксикацией, электрошоком и кислородным голоданием.",0,0,0,0,1,Finding[6],811769,4
Она не помогает.,0,1,0,0,0,INF[1],2723162,8
Эту валерьянку я начал пить когда был студентом.,0,0,0,0,0,NEUTRAL,2822501,1
Из побочек только сыпь и диарея.,0,0,1,0,0,ADR[3],814053,6
"Спустя 2 часа появилась отрыжка, голова не проходила, но животу стало намного легче.",0,0,1,0,0,ADR[6],2438387,8
Знаете это пожалуй самое недорогое и эффективное средство лечения цистита.,0,0,0,1,0,DI[6],873342,1
К тому же еще и иммунитет повышают.,1,0,0,1,0,EF[3]|DI[1],883078,5
"Один плюс можно давать детям с самого рождения, не навредят, а мамам спокойнее « вроде что то дают для защиты».",0,0,0,0,0,NEUTRAL,578508,6
"Познакомиться с данным препаратом пришлось практически сразу после рождения ребёнка, поскольку небольшие неврологические проблемы были на лицо.",0,0,0,1,0,DI[1],7166276,1
"Так вот, я продавала 2 курса ""Ликопида"" в июле месяце и мой ребенок не болел всю осень и зиму.",1,0,0,0,0,EF[2],255563,9
"Осенью, в самый разгар эпидемии ОРВИ и гриппа, я забеременела вторым ребёнком, как известно, беременность сильно снижает иммунитет, это необходимо для развития нормальной беременности, но к сожалению так же способствует развитию всяких инфекционных заболеваний, что уже не безопасно при беременности, особенно на ранних её сроках.",0,0,0,0,1,Finding[2],1213978,2
"После трех дней приема у ребенка ужасно разболелось горло, затем ухо, затем другое ухо, поднялась температура.",0,0,1,0,0,ADR[2],2883218,4
Второй раз у дочки резко поднялась температура.,0,0,0,1,0,DI[1],2407176,8
Хорошо так же пить на ночь - нормализует сон.,1,0,1,0,0,EF[12]|ADR[9],264987,10
"В состав порошка входит ""убойная"" доза витамина С, который является главным в борьбе с простудой и гриппом.",0,0,0,1,0,DI[4],950351,5
"День промаялся, к вечеру ещё хуже - давление поднялось, голова не своя -вызвал неотложку .",0,0,1,0,0,ADR[4],2855204,3
"Она сказала, что давала их дочке и теперь они болеют гораздо реже, даже когда в детском саду эпидемия простуды.",0,0,0,1,0,DI[1],2869916,2
"Целый день хожу как старенькая бабушка, хромая, волочу ногу за собой!",0,0,1,0,0,ADR[2],668099,11
"Хочу отметить, что когда начала их принимать появились головные боли, уж не знаю связано это или нет, но через пару дней прошли.",0,0,1,0,0,ADR[1],2522205,5
Это только реклама и эффекивность его не доказана!!,0,0,0,0,0,NEUTRAL,2015980,4
"Мы использовали препарат в ампулах, разводили его водой и переливали во флакончик с пульвилизатором (купила в аптеке за 29р.).",0,0,0,0,0,NEUTRAL,877244,5
"Он улучшает память, повышает физическую и умственную способность.",1,0,0,0,0,EF[1],2397861,3
Общее впечатление : облегчает симптомы на ранней стадии заболевания RATING 4 NOTE,1,0,0,0,0,EF[3],894297,9
Да и не помогает оно ничего.,0,1,0,0,0,INF[1],644737,8
