sentences,EF,INF,ADR,DI,Finding,annotation,review_id,sentence_id
"Насчет профилактики не могу сказать ничего, так как никогда заранее не пил лекарство.",0,0,0,0,1,Finding[3],2457936,12
Аллергии пока нет.,0,0,0,0,1,Finding[2],2698684,15
"Но стоит он в два раза дороже, чем анаферон - 350 рублей.",0,0,0,0,0,NEUTRAL,2541096,8
"Сейчас, когда ребенок подрос, иногда даю ему таблеточку для успокоения, обычно тоже вечером, для засыпания.",0,0,0,1,0,DI[7],822352,5
"Насморк, температура, слабость, несколько штук в день и полежать под одеялом укрывшись и простуды как не бывало.",0,0,0,1,0,DI[4],273111,4
"Потом все таки озноб, боли в горле и носовых пазухах возвращаются.",0,1,0,1,0,INF[4]|DI[2],2410173,7
И знаете он мне помог и причем существенно.,1,0,0,0,0,EF[2],885375,8
То есть когда препарат со временем перестает оказывать эффективное действие на организм.,0,0,0,0,0,NEUTRAL,875711,4
Таблетки циклоферон быстро борются с инфекциями.,0,0,0,0,0,NEUTRAL,5967832,1
У моих деток после начала приема этого препарата появилась тяжелой формы медикаментозная аллергия.,0,0,1,0,0,ADR[3],2886803,3
Время использования: 1 день,0,0,0,0,0,NEUTRAL,1058674,8
В течении вечера я постоянно мазала им и на утро уже красноты было меньше.,1,0,0,1,0,EF[3]|DI[4],2490571,11
"А тут увесился соплями в отчем доме, когда к родителям ездил.",0,0,0,1,0,DI[3],2388099,3
"Температура сохраняется, сопли ручьем, горло режет ножами, голова раскалывается.",0,1,0,1,0,INF[2]|DI[3],942554,3
"Не хотелось никуда ходить, краситься и даже одеваться.",0,0,1,0,0,ADR[5],76765,9
Насморк не прошел.,0,1,0,1,0,INF[8]|DI[3],2698684,12
После отмены таблеток все прошло через неделю.,0,0,0,0,0,NEUTRAL,747352,9
"У ребенка после первого приема покраснели брови, а после второго высыпало все тело, ребенку три месяца, ужасно перепугалась, скорее всего и зуд тела был, потому что совершенно спокойный ребенок капризничал весь день.",0,0,1,0,0,ADR[1],1313970,1
"Препарат только на один раз, организму он поможет, но дальше смысла нет деньги палить впустую.",0,1,0,0,0,INF[1],641485,6
Отличное средство при борьбе с герпесом.,1,0,0,1,0,EF[5]|DI[4],832817,11
Перед употреблением раствор требуется размешать.,0,0,0,0,0,NEUTRAL,2507228,9
"Во время легкой простуды терапевт порекомендовал мне именно эти свечи, так как они безопасные и легко устраняют признаки простуды.",0,0,0,1,0,DI[1],1089645,2
Еще одним «побочным» эффектом могу назвать цену.,0,0,0,0,0,NEUTRAL,814053,7
У него много противопоказаний.,0,0,0,0,0,NEUTRAL,2693866,4
Через пару дней горло становится значительно лучше.,1,0,0,0,0,EF[6],2522797,7
Принимала по инструкции и уже в конце рабочего дня почувствовала себя хорошо.,1,0,0,0,0,EF[3],24065,6
"Красивая упаковка, тубус, все удобно открывать, крем довольно приятный, но вот результата от него нет.",0,1,0,0,0,INF[6],588785,4
"Не знаю, может быть, это было просто самовнушение, что я пила профилактический препарат, а может, действительно, ""Эхинацея"" сработала.",0,0,0,1,0,DI[3],2443835,6
"Помню момент, когда у нас в стране была эпидемия гриппа и все так боялись.",0,0,0,1,0,DI[6],882269,7
"Стало не то, что лучше и спокойней, а наоборот все бесило.",0,1,0,1,1,INF[4]|DI[2]|Finding[8],76765,5
"Они маленькие, очень легко ставятся и всего один или два раза в день.",0,0,0,0,0,NEUTRAL,650293,8
"Считаю, что данный препарат необходим детям с серьёзными заболеваниями.",0,0,0,0,0,NEUTRAL,9008199,9
"Я советую, его пропить тем, кто часто болеет гриппом и простудой.",0,0,0,1,0,DI[8],655424,10
"Обычно я лечилась либо народной медициной (полоскания содой, ромашкой, чай с мёдом и т.",0,0,0,1,0,DI[6],6425181,4
"Так вот этот не то что ей не помог, еще и усугубил ситуацию за счет экстракта той самой мяты, которая тоже является аллергеном.",0,1,0,0,1,INF[2]|Finding[6],2408295,7
"При первых симптомах простуды, а именно проявилось на губах, сразу пошел в аптеку за лекарствами, аптекарша с огромным стремлением и уверенностью сразу предложила мне крем для наружного применения Фенистил Пенцивир.",0,0,0,1,0,DI[2],588785,1
Обе попытки выпоить ребенку суспензию заканчивались тем что малыша вырвало и запах был именно парацетамола.,0,0,1,0,0,ADR[2],2550136,7
Этот препарат очень любят невропатологи назначать при задержке развития у ребенка.,0,0,0,1,0,DI[4],886355,1
Выпив одну таблетку сон долго не заставляет себя ждать.,1,0,0,1,0,EF[1]|DI[4],2516885,7
"Он очень эффективен на самых ранних стадиях герпеса на губах, когда ещё только - только появляется дискомфорт и зуд на губе.",1,0,0,1,0,EF[3]|DI[4],942403,3
"Так как в семье имеется ребенок, часто бывают и простудные заболевания.",0,0,0,1,0,DI[3],273111,1
"К удивлению у моего кума были проблеммы с ЦНС и он лечился тоже кавинтоном, очень помог ему.",1,0,0,1,0,EF[8]|DI[2],618094,7
"Вчера выпила, ночью проснулась чтобы покормить ребенка и понимаю что просто не могу встать.",0,0,1,0,0,ADR[3],668099,8
За первый день выпил 7 таблеток.,0,0,0,0,0,NEUTRAL,2659756,2
"Невролог назначил ребенку 3.7 лет пропить энцефабол, 1ч.",0,0,0,0,0,NEUTRAL,1111461,1
"Так вот, прошло уже 3 недели, а сдвигов я так и не увидела.",0,1,0,0,0,INF[1],938978,10
Температура спала спустя часа 2 а на след.,1,0,0,1,0,EF[13]|DI[11],4893288,14
Назначен был курс уколов психиатром ребенку из-за моих жалоб на отсутствие речи у ребенка (3 года).,0,0,0,1,0,DI[3],2424557,2
Злоупотреблять один препарат нет смысла и не будет эффекта.,0,0,0,0,0,NEUTRAL,2510045,6
"Так же и я, для нормализации сна, как успокоительное средство попробовала по применять Новую валерьянку.",0,0,0,1,0,DI[4],2385125,2
Когда поивляетса температура принимать их бесполезно.,0,1,0,1,0,INF[3]|DI[2],3396668,8
и температура была несколько разэ и мы прекратили его пить.,0,0,1,0,0,ADR[3],1111461,5
"Кроме того, во время и после его применения у ребенка резко снизился аппетит.",0,0,1,0,0,ADR[3],2555494,10
"Поле зрения расширилось – боковым зрением стал лучше видеть, четкость возвращается.",1,0,0,1,0,EF[1]|DI[6],2436921,4
"Как то слегла с простудой, температурой и насморком в постель.",0,0,0,1,0,DI[1],874652,2
"Выпила вторую таблетку, как прописано через сутки-На меня сразу напали все болезни мира-Глаза изнутри выдавливало, кашель сорвал всё горло, я себя буквально по частям отрывала от дивана, что бы подняться, лицо отекло, слабость ужасная.",0,0,1,0,0,ADR[1],828556,4
После первого же применения у ребенка развился обильный ринит.,0,0,1,0,0,ADR[1],267729,2
"Нашла решение в донормиле, выпиваешь - засыпаешь!",1,0,0,0,0,EF[3],108315,4
"Раньше я никогда не принимала успокаивающие, только что разве на ночь, когда не могла заснуть.",0,0,0,1,0,DI[3],2491250,1
"Анаферон покупала пару раз, когда у дочки появлялись первые симптомы ОРВИ.",0,0,0,1,0,DI[3],2418485,1
Моему сыну кагоцел давали в качестве лекарства от какого-то простудного вируса в детском спортивном лагере.,0,0,1,0,0,ADR[1],2460904,1
Утром стало намного легче.,1,0,0,0,0,EF[1],7433765,22
Пользовались в период эпидемии гриппа и межсезонных простуд.,0,0,0,1,0,DI[1],2428518,4
"Надо сказать, что к вечеру уже заметно полегчало и я воодушевленно стала принимать Кагоцел дальше.",0,0,0,0,0,NEUTRAL,2673128,5
Для профилактики принимать в гораздо меньшей дозировке.,0,0,0,1,0,DI[2],580741,5
"По сравнению с другими средствами, облегчение от которых наступает через полчаса-час, после употребления ""Лемсип"" только стало полегче горлу, температура не снизилась, озноб не прошел, слабость не уменьшилась даже после употребления через некоторое время второго пакетика.",0,1,0,1,0,INF[4]|DI[1],632718,2
"Перечитала много медицинской литературы и выяснилось, что если у человека в крови есть вирус Герпеса (а он у нас есть), то большинство иммуномодуляторов просто бессильны.",0,0,0,1,0,DI[3],255563,7
Наступила опять весна и вновь эти простудные заболевания начали действовать с новой силой.,0,0,0,1,0,DI[4],885375,1
Не значительно снять чувство тревоги.,1,0,0,1,0,EF[2]|DI[4],2738039,13
"Про болели целый год, на второй год опять тоже самое, поняли нужно иммунустимулирующая терапия.",0,0,0,0,0,NEUTRAL,2546207,2
"Из своего опыта хотел бы порекомендовать начать лечиться им уже тогда, когда только чувствуете, что начинает болеть горло.",0,0,0,1,0,DI[5],2522797,10
"Прижигать зеленкой следует только с той целью, чтобы определить дату последних высыпаний - лечебного эффекта она не имеет.",0,0,0,1,0,DI[2],2450448,5
"С гостями, танцами, подарками и поздравлениями, как и хотела)).",0,0,0,0,0,NEUTRAL,6425181,25
"Больше не пользуемся, видимо нам он не подходит.",0,1,0,0,0,INF[2],1730783,11
3. успокаивает.,1,0,0,1,0,EF[1]|DI[2],2385125,8
"Но, если заболеть посерьезнее, лично я как-то сомневаюсь в действенном лечении этим препаратом.",0,0,0,0,0,NEUTRAL,1089645,10
"Мазал все как написано в инструкции, а на следующий день ранка которая была, стала еще в два раза больше, а помимо появилась еще и вторая.",0,0,1,0,0,ADR[3],588785,5
"Ни разу ни мне, ни моей семье флюколд конкретно не помог снять первые симптомы гриппа или простуды.",0,1,0,1,0,INF[1]|DI[2],2395998,4
Хорошее средство!,1,0,0,0,0,EF[1],2689273,8
"У меня препарат не вызывает сонливости и это хорошо, значит его можно выпить на работе в какие-то особенно напряженные моменты.",0,0,0,0,1,Finding[5],110018,4
"Может включалось мое подсознание, может самовнушение, но валериана помогала мне справляться эмоциями.",1,0,0,1,0,EF[6]|DI[1],2513399,8
"Оксолиновая мазь, на мой взгляд, - одно из самых прекрасных противовирусных средств, как при профилактике, так и при лечении ОРВИ.",0,0,0,1,0,DI[2],910656,1
Данный препарат мы используем в качестве профилактики.,0,0,0,1,0,DI[1],883013,2
"Препарат подходит для быстрого снятия симптомов и облегчения существования, но для выздоровления не годится.",1,1,0,0,0,INF[1]|EF[4],2657172,5
"Первый укол, перенес нормально, вечером ребенка как подменили... Дикий крик, кидание игрушками, слезы.",0,0,1,0,0,ADR[1],2597892,3
"Может в других ситуациях лекарство работает, но мне не помогло и советовать его я никому не могу.",0,1,0,0,0,INF[1],2733948,10
С данным лекарственным препаратом мы столкнулись когда у сына выявили задержку речевого развития.,0,0,0,1,0,DI[1],2463217,1
"Часто простужаюсь, а при активном насыщенном ритме жизни лекарственных средств, помогающих облегчить симптомы простуды пришлось перепробовать немало, попадался нередко среди них и Колдрекс, однако без особой необходимости стараюсь его не брать и вот почему: наверное, главный фактор - цена, по сути, препарат не имеет каких-либо преимуществ по своей эффективности в сравнении с другими, но ценовая накрутка достаточно впечатляет, то есть, по сути, покупатель платит деньги за весьма масштабную рекламную кампанию препарата.",0,0,0,1,0,DI[1],910748,1
Температура от него могла держаться.,0,0,0,1,0,DI[5],591856,6
"Теперь это псевдолекарство обхожу стороной, толку ноль от него.",0,1,0,0,0,INF[3],2428403,5
А после трех дней молочница прошла.,1,0,0,1,0,EF[4]|DI[6],1086939,12
"на следующей день, я не могла открыть глаза на них были мешки с картошкой, раздражительность, психи, усталость, торможенние в движениях, в мозгах и это всего пол таблетки, незнаю как люди его выдерживают, мне не подходит, очень мощная штука, по моему мнению ее нужно пить дюдям, в очень крайних ситуациях, но я бы, даже крысе не дала бы!!!",0,0,1,0,0,ADR[4],667816,3
"Не советую мешать с алкоголем, если есть нарушения с психикой, может вызвать галлюцинации.",0,0,0,0,1,Finding[2],2472239,2
"Настроился режим сна, стала легче засыпать.",1,0,0,1,0,EF[2]|DI[1],940903,4
"Спустя 3 часа, чувствовался озноб, но повышения температуры не было, голова так же болела... Вообщем, я понимаю, что все мы разные... но пожалуйста, перед тем, как давать ребенку, испробуйте на себе.",0,0,0,1,0,DI[1],2438387,9
"Да и бог с ценой, но ведь часто он вообще не помогает.",0,1,0,0,0,INF[2],886333,12
Ничуть он не помогал.,0,1,0,0,0,INF[2],934850,4
"Как то я заметила, что мне помогает настойка валерианы.",1,0,0,0,0,EF[5],647288,4
"В месяц по нескольку раз причем со всеми вытекающими симптомами : кашель, боль горле, насморк.",0,0,0,1,0,DI[2],592814,3
Утром не было сонливости.,0,0,0,1,0,DI[8],747352,5
"Капали мы 3 дня по 5 раз на день, а уже на четвертый день у нас появилась температура и кашель.",0,1,0,1,0,INF[3]|DI[2],644737,10
"Мы начинаем прием ""ударной дозы"" при первых признаках простуды, и как ни странно (возможно, это самовнушение), но он помогает.",1,0,0,1,0,EF[6]|DI[5],639476,2
"Слышала информацию, что он плохо влияет на память, но я не замечала.",0,0,0,0,1,Finding[3],2685800,8
Видимый эффект нам наверное рано еще судить но малыш простудился и простуда прошла в легкой форме.,1,0,0,1,0,EF[2]|DI[1],2732647,8
"Перепробовав много всевозможных снотворных, оставался только этот препарат неиспробованный.",0,0,0,0,0,NEUTRAL,1326637,1
Во вторых очень много работает и первоначальные симптомы просто списывает на усталость.,0,0,0,0,1,Finding[1],2457936,9
"Как лекарству от боли в горле не хватает немного обволакивающего свойства, как только конфетка растворяется, лечебное действие практически сразу проходит, однако как средство для снятия несильной боли, могу смело рекомендовать, в составе антибиотики и анестетик, благодаря которому боль действительно спадает.",1,0,0,1,0,EF[3]|DI[1],824400,3
А остальное просто выбрасывание денег.,0,0,0,0,0,NEUTRAL,2533930,12
Я честно рекомендую Ингавирин при начальных симптомах простуды и даже в целях профилактики.,0,0,0,1,0,DI[5],2663253,12
"Моему ребёнку 6 лет, у него задержка речевого развития.",0,0,0,1,0,DI[3],2461123,4
"Малоэффективен, вызывает диарею, которая может продолжаться 2-3 дня.",0,1,1,0,0,INF[1]|ADR[2],1979075,1
При соблюдении схемы приема действительно помогает.,1,0,0,0,0,EF[2],814053,3
"В данном случае все-таки рекомендую применять тот же препарат, но только в лекарственной форме мази - не имеет столь выраженного системного действия на организм ( в основном проявляется токсическим действием на печень).",0,0,0,0,0,NEUTRAL,2445572,3
"С этими таблетками знакома не понаслышке, ,моя родственница болеет психическим заболеванием, может по 3 дня не спать и по ночам ходить., перепробовав много снотворных помогло это., донормил не помогает при психическом расстройстве.",0,1,0,1,0,INF[6]|DI[5],818785,1
"Что я увидела уже, это то что дочка стала лучше спать, нет криков сквозь сон, вечных расставаний в туалет и т. д В упаковке находится 15 пакетиков.",1,0,0,1,0,EF[3]|DI[5],2397861,7
"Нам не помогал, болели часто.",0,1,0,0,0,INF[2],2448225,3
"Не знаю совпадение это или препарат помог, пока ребенок его принимал в течение месяца вообще не болел.",1,0,0,0,0,EF[4],656118,6
"Даю ""Анаферон"" -одной для лечения-другой для профилактики.",0,0,0,1,0,DI[2],810713,5
"Уже после недели, может чуть больше, я почувствовала явные улучшения в самочувствии.",1,0,0,0,0,EF[3],655424,5
"После 3-го укола сын начал проявлять интерес к повторению звуков, новые звуки появлялись, старые мог повторять по несколько раз, слов как таковых новых не произносил.",1,0,0,0,0,EF[4],2424557,4
"Вылезла простуда на губах, заказала мужу, чтоб купил мазь Ацикловир, ну вообщем он забыл название, и купил, то, что собственно ему предложили в аптеке, прорекламировав так, что мол жена оценит некий матирующий эффект от данного средства.",0,0,0,1,0,DI[3],2523468,1
"При ОРВИ нормально подойдёт, а вот если грипп надо поискать лекарство поэффективнее.",0,0,0,1,1,DI[5]|Finding[7],807999,8
"Потом пошли к лору сделали все обследования, ничего не было на них, что указывало на лор заболевания, сдали анализы все в норме, но кашель так и не проходил не смотря на все это, лечение не помогало.",0,0,0,1,0,DI[3],793853,2
"Вроде бы и нагрузки никакой нет, а сердце бьется непривычно часто, как будто ты только что догонял уходящий автобус.",0,0,1,0,0,ADR[2],2693866,12
"Больше я не ставила эти свечи и температура больше 38,5 не росла.",0,0,1,0,0,ADR[4],2309597,8
"В то время как мы попали в больницу, доктор нам сообщил, что именно после приема этого препарата очень много детей поступает в больницы скорой помощи с тяжелыми аллергическими реакциями.",0,0,1,0,0,ADR[1],2886803,5
Общее впечатление : помогают RATING 4 NOTE,0,0,0,0,0,NEUTRAL,594839,5
