sentences,EF,INF,ADR,DI,Finding,annotation,review_id,sentence_id
"Сколько уже было испробовано всяких разных противовирусных препаратов, на пальцах не пересчитать, и каждый раз когда идешь в аптеку с рецептом, думаешь, авось это то что нам надо( Иногда разочаровываешься в качестве, иногда в цене.",0,0,0,0,0,NEUTRAL,656340,1
"А вот в последние дни, когда сопелек уже нет почти, тоже хорошо.",0,0,0,1,0,DI[1],877405,7
"Судя по составу, это средство содержит большинство компонентов предназначенных для борьбы с простудой.",0,0,0,1,0,DI[2],2477731,6
Какого же было мое удивление когда в анализах вирус снова был обнаружен!,0,1,0,0,0,INF[3],2733948,8
Время использования: Несколько лет,0,0,0,0,0,NEUTRAL,2513399,13
"Списали на усталость, но ночью крик повторился.",0,0,1,0,1,ADR[5]|Finding[4],2597892,4
Не зря же его врачи назначают.,0,0,0,0,0,NEUTRAL,2503811,14
"Его ничего нерадовало и взгляд в одну точку... Жуткая рвота, слезы истерика.",0,0,1,0,0,ADR[2],2597892,8
"По инструкции сделала, как написано, расслабилась, и жду... жду... сон не спешит ко мне... настроение спокойное... пролежала, заснула поздно.",0,1,0,1,1,INF[2]|DI[3]|Finding[5],2427129,2
"В нашей стране, я думаю, каждый второй человек живет в состоянии стресса.",0,0,0,1,0,DI[1],832096,1
"Не развернутыми предложениями, конечно, но с каждым днем все лучше и лучше.",1,0,0,0,0,EF[4],910944,7
"средство действительно действует, да вы заснете, но когда проснетесь поймете, что лучше бы не засыпали под действием этого препарата!",1,0,0,0,0,EF[5],108315,11
На мое раздраженное горло смородневый вкус как-то не очень повлиял.,0,1,0,1,0,INF[11]|DI[6],2733509,10
"В итоге, пришлось спасаться от простуды этим средством.",0,0,0,1,0,DI[2],2500754,3
анафилактический шок - если не ошибаюсь.,0,0,1,0,0,ADR[1],1443820,7
"На третий день применения показалось, что вызвал достаточно сильную аллергическую реакцию.",0,0,1,0,0,ADR[1],822853,1
"Купили, но долго не решалась его давать ребёнку.",0,0,0,0,0,NEUTRAL,885404,5
"Так как переплачивать за бренд (типа Зовиракс) не вижу смысла, при первых признаках ""простуды"" на губах беру крем ацикловир.",0,0,0,1,0,DI[2],942403,2
"Младший в 3 месяца переболел бронхитом, боюсь рецидива, стараюсь уберечь его всеми способами.",0,0,0,1,0,DI[3],2497493,3
"Начинаем лечиться, в течении пяти, примерно, дней общая симптоматика идет на спад.",1,0,0,0,0,EF[2],4540580,2
При этом не справляется с поставленной перед ним задачей - ОРВИ.,0,0,0,1,0,DI[1],2572533,5
"И ещё после приёма Лавомакса появилась слабость, рези в желудке, которые в свою очередь вызвали (понос), очень сильно крутило в костях и неприятная ноющая боль в суставах, шум в ушах и потемнение в глазах, тошнота и потеря сознания, жар, поднялась температура резко до 38, пот, лихорадка и дрожь.",0,0,1,0,0,ADR[3],2818054,2
"мне так плохо было от них голова просто взрывалось, недомогание, усиление головокружение я думала умру!",0,1,1,0,0,INF[2]|ADR[1],800450,4
После того как закончили принимать неоотропные препараты нервопатолог посоветовала оставить киндинорм и попринимать его на протяжении еще месяца.,0,0,0,0,0,NEUTRAL,2460834,3
Показан для лечения и профилактики гриппа и прочих острых респираторных вирусных инфекций.,0,0,0,1,0,DI[2],646265,4
Вызывает сонливость в течении дня.,0,0,1,0,0,ADR[5],2385125,12
"Если конечно боли не связаны с нарушениями работы желудочно-кишечного тракта (отравлениями, острыми кишечными инфекциями, застоями).",0,0,0,1,0,DI[3],647288,5
И нечего детям давать всякую гадость просто так(при первом же чихании или насморке).,0,0,0,1,0,DI[4],810713,13
И вот буквально месяц назад у меня вскочил герпес.,0,0,0,1,0,DI[1],2490571,3
"Первый раз купила капли по совету врача, когда была беременной и простудилась.",0,0,0,1,0,DI[2],250977,1
Таблетки должны были помочь ослабленному иммунитету ребенка.,0,0,0,1,0,DI[1],2525665,3
"Врач сказала, что капли повышают иммунитет.",0,0,0,0,0,NEUTRAL,250977,2
"Первый раз столкнулся с препаратом когда лечили бабушку, уже довольно пожилая и возможно по-старости ее последнее время беспокоила гипертония.",0,0,0,1,0,DI[1],618094,1
"Хотел бы поделиться с вами мнение о порошке при простуде Stada ""Гриппостад"".",0,0,0,1,0,DI[3],950351,2
"Я принимал в соответствии с инструкцией, но не помогло совершенно.",0,1,0,0,0,INF[2],2428403,3
"Составляющие я не знаю, но кому интересно может посмотреть аннотацию в интернете, способ применения я изложу: Первая таблетка пьется сразу - появляется облегчение, к приему второй таблетки, а это через 24 часа мне стало намного лучше.",1,0,0,0,0,EF[5],1400882,5
"В связи с неспокойным поведение дочери, эти таблеточки ей прописал невролог где-то в год.",0,0,0,1,0,DI[1],2387405,4
"Ну и действительно, циклоферон за 2 дня полностью на ноги поставил!",1,0,0,0,0,EF[1],5967832,5
Всем доброго времени суток!,0,0,0,0,0,NEUTRAL,2724762,1
"Ни для профилактики ( после профилактического курса я заболела, да и ещё очень сильно), ни при последующем лечении.",0,0,1,1,0,ADR[4]|DI[5],2445928,8
Общее впечатление : Препарат не эффективен RATING 2 NOTE,0,0,0,0,0,NEUTRAL,656249,7
"Да, сонливость, вялость, апатия - все это было, но и расслабило нормально.",1,0,1,0,0,EF[4]|ADR[9],2653333,3
"Мне его назначил кардиолог, у меня часто повышалось артериальное давление, была постоянная слабость, бессонница.",0,0,0,1,0,DI[1],616736,1
"С противовирусными свечками Кипферон знаком давно, первый раз столкнулись с ними когда у жены был воспалительный процесс, очень дорогие по стоимости, но врач рекомендовал как найлучший препарат.",0,0,0,1,0,DI[3],591673,1
"Этот препарат специально для детей, которые часто болеют простудными и воспалительными заболеваниями.",0,0,0,1,0,DI[6],2869916,11
"В переход от сезона к сезону мы все подвержены ОРВИ, я оказалась не исключением.",0,0,0,1,0,DI[2],2424679,2
"Сезон простуд, к сожалению, коснулся и моей семьи.",0,0,0,1,0,DI[1],2673128,1
"Наверное нет такого человека, который хоть раз не столкнулся с тем, что возникла необходимость применять лекарственные препараты.",0,0,0,0,0,NEUTRAL,2385125,1
"Никакого эффекта Тенотена я не заметила - может он появляется со временем, не знаю.",0,1,0,0,0,INF[4],2537351,10
"была удивлена что моя простуда прошла к концу 4-х суток, при этом пропал извечный насморк, который так и не успел развиться в полноценный гайморит (как обычно).",1,0,0,1,1,EF[3]|DI[6]|Finding[5],2695134,6
"Затем голова стала тяжелой, в животе было вздутие.",0,0,1,0,0,ADR[7],2438387,7
Самочувствие не улучшилось ни на грамм.,0,1,0,0,0,INF[1],656118,10
Но о возможности аллергии считаю нужным предупредить людей.,0,0,1,0,0,ADR[1],183478,8
"Детишкам моим нравится когда промываем, а мне нравится что они не пытаются сбежать от этой процедуры.",0,0,0,0,0,NEUTRAL,794482,9
"Незнаю может и самовнушение, но для меня этот препарат оказывает положительное действие.",1,0,0,0,0,EF[2],818395,4
"Думаю, что препарат хорош для взрослых с крепкой сердечно-сосудистой системой, легко переносящих высокую температуру.",1,0,1,0,0,EF[2]|ADR[4],2414358,7
"У меня шаткая нервная система, поэтому проблемы со сном часто меня беспокоят.",0,0,0,1,1,DI[7]|Finding[1],108315,1
В состав её входит димедрол.,0,0,0,0,0,NEUTRAL,2503806,2
"Сейчас у нас поднялась температура после прохождения больниц, по совету опять же врача решили их купить, чтобы не разболеться сильнее.",0,0,0,1,0,DI[3],2718592,3
Врач сразу же выписала Тонзилгон.,0,0,0,0,0,NEUTRAL,3048058,3
"Не понравился, ни вкус, ни запах... и эффект я тоже не увидела.",0,1,0,0,0,INF[3],2541923,1
Лимфоузлы успокоились и уменьшились.,1,0,0,0,0,EF[7],6430802,21
"Эта мазь нам всегда помогала, поэтому она всегда в моей сумочке.",1,0,0,0,0,EF[1],2390194,8
Общее впечатление : Хорошее средство для нормализации нервишек.,1,0,0,0,0,EF[6],832096,13
"Жалея меня, мама купила в аптеке супер разрекламированное средство от простуды и гриппа под названием ""АнвиМакс"", которое должно было чудесным образом поставить меня на ноги, ибо стоило недешево, а в составе значится парацетамол, по маминому мнению, очень эффективное средство.",0,0,0,1,0,DI[4],899066,3
"Спрей ИРС 19, меня как то не впечатлил.",0,0,0,0,0,NEUTRAL,265385,1
"Многие врачи мне не советуют её делать ребёнку дальше, так как после первого тура у нас была рвота и температура, забрали в больницу там подхватили орви, назначили антибиотики, боюсь даже представить, что было бы после второго тура, наверно все видели новости о мальчике, у которого капли вызвали миокардит вроде, и он скончался, и это не один случай, в Киеве уже троих не стало, считаю это просто хотят уничтожить генофон, таким вот оружием, вызывая искусственный иммунодефицит!",0,0,1,0,1,ADR[3]|Finding[1],2692315,4
Начал интересоваться.,0,0,0,0,0,NEUTRAL,2658215,4
"Мы все же взрослые люди, и спихивать все на препараты нет смысла, ведь и сад многое дает.",0,0,0,0,0,NEUTRAL,1294530,7
"Но факт остается фактом, чуда не случилось, выздоровление в тот же миг не наступило.",0,1,0,0,0,INF[7],1394389,25
"Пить нужно было по пол ампулы 2 раза в день, строго до 2-х часов дня, врач предупредил что на фоне приема может быть эмоциональное возбуждение, поэтому пить только в первой половине дня.",0,0,0,0,1,Finding[7],2424525,2
"Пришлось опять идти в аптеку покупать Називин, помог тут же.",1,0,0,0,0,EF[4],2390747,3
"А так даже для профилактики берем, особенно в осенне-зимний период.",0,0,0,1,0,DI[1],639476,10
Естественно невролог назначением только мексикора не ограничился.,0,0,0,0,0,NEUTRAL,2718482,8
"Свечи мне понравились, время болезни сокращяют, симптомы облегчают, помогают справиться с соплями и предотвратить присоединение вирусной инфекции и избежать приём антибиотиков.",1,0,0,1,1,EF[5]|DI[3]|Finding[4],2432421,4
"Я например быстро завожусь, и если кто попадёт под руку, считай не повезло.",0,0,0,1,0,DI[4],2665872,3
"Только в отличии от обычного ксимелина этот более мягкий по своему действию препарат, он не содержит консервантов.",0,0,0,0,0,NEUTRAL,2430254,3
"При этом кто тебя видит в этот день спрашивают - все ли в порядке со здоровьем, т. к. лицо бледное и синяки под глазами.",0,0,1,0,0,ADR[4],108315,9
"Сначала - эффекта никакого, на пятый день я действительно вроде поуспокоилась, но стала кружить голова, да так что в стороны заносило, с давлением появились проблемы.",1,0,1,1,0,EF[3]|ADR[4]|DI[5],609191,7
"После применения ""Гриппферона"" сразу чувствуешь некое облегчение в дыхательных путях.",1,0,0,1,0,EF[3]|DI[2],2446305,7
"Я прям почувствовал разницу и сделал вывод, что Иммунал не пригоден для поддержания иммунитета при тяжёлых инфекциях.",0,0,0,1,0,DI[3],649988,6
"Вылечился и остался доволен, мне вот не так сильно повезло.",1,0,0,0,0,EF[8],2515768,11
"Пока свой иммунитет не выработается у ребенка, по-моему, бесполезно чем-то пытаться его ""подстегнуть"".",0,0,0,0,1,Finding[4],653736,4
"Двое детей разного возраста, это не шутки.",0,0,0,0,0,NEUTRAL,5629005,2
вообще от этих лекарств толку никакого.,0,1,0,0,0,INF[4],2491980,5
Нам он помогает.,1,0,0,0,0,EF[1],2718592,14
Уже после первой таблетки зуб прошел.,1,0,0,1,0,EF[5]|DI[3],1086939,11
"Валерьянка на меня давно не действует, а что-нибудь ""потяжелее"" я не хочу принимать.",0,1,0,0,0,INF[3],832096,3
"Средства типа валерианы мне не помогают совсем, поэтому начала искать для себя новое средство.",0,1,0,0,0,INF[1],264987,2
"Но вот осенью, на фоне простуды он опять появился, правда в легкой форме.",0,0,0,1,0,DI[7],2653511,3
"Мои любимые свечи Виферон не подошли дочке, развилась аллергия на масло какао, что бывает давольно часто.",0,0,1,0,0,ADR[1],2432421,1
"Я этот препарат в основном принимал на вечер, так как от Барбовала идёт спецефичесский запах, за рулём употребляя данный препарат ездить нельзя, у меня нарушались функции движения и координации, такое впечатление, что я был пьяный, а в таком состояние страшновато садиться за руль автомобиля.",0,0,1,0,0,ADR[1],880939,2
Общее впечатление : при сильной боли не будет эффективно RATING 4 NOTE,0,0,0,1,0,DI[2],824400,5
"Все повторилось, никакого спокойного обволакивающего засыпания.",0,1,0,1,0,INF[4]|DI[1],2427129,5
В нашем случае оказался сильный ринит.,0,0,1,0,0,ADR[3],217439,9
"Потом попробовали его намазать летом - покусали комарики, да еще и расчесали - не помог тоже.",0,1,0,0,0,INF[6],591900,4
"В начале января переболели пневмонией (прикорневой) ребёнку 2года 8 мес, кололи цевтриаксон 5 дней в больнице, хотя нужно было 7!",0,0,0,1,0,DI[1],6275749,1
Насчет его иммуномоделирующего действия пока ничего сказать не могу.,0,0,0,0,0,NEUTRAL,183478,7
Время использования: 1-2 дня,0,0,0,0,0,NEUTRAL,271761,13
Этим препаратом от простуды я одно время часто лечилась.,0,0,0,1,0,DI[8],2395998,1
"А вот Ново-пассит в таблетках немного эффективнее, но сильно в сон клонит.",1,0,1,0,0,EF[3]|ADR[1],792635,10
"Да и по эффекту - с одного приёма начал ""срубать"" меня в сон через 10 минут!",1,0,1,0,0,EF[1]|ADR[2],2855204,7
Бессонные ночи давали о себе знать в моей повседневной раздражительности.,0,0,0,1,0,DI[1],2738039,3
"Что ж, врачам, наверно, стоит верить, в особенности докторам наук ) Но, ситуация отечности носа усугублялась и чувствовала себя мелким гнусавым слоненком.",0,1,0,1,0,INF[4]|DI[5],3188437,6
Однажды у ребенка поднялась высокая температура и чтобы ее сбить я решила дать парацетамол для детей в суспензит.,0,0,0,1,0,DI[3],2550136,4
"Сухость во рту не так страшна, но не приятна.",0,0,1,0,0,ADR[3],2693866,9
В 2004 году случайно при сдаче анализов у меня обнаружили гепатит С.,0,0,0,1,0,DI[1],2763304,1
Я просто испугалась и выбросила оставшиеся капсулы.,0,0,0,0,0,NEUTRAL,1263885,7
"У ОБЕИХ: до 3х ни в одном глазу, примерно в 2 ночи началось сильное сердцебиение и лихорадка, к 5 ночи удалось заснуть, но было ощущение, что в полусне и были жуткие кошмары.",0,1,1,1,0,INF[9]|ADR[8]|DI[2],151880,7
"После первого применения, через некоторое время препарат вызвал рвоту, понос и боли в животике(понос и боль продолжается 3-й день уже)!!!",0,0,1,0,0,ADR[2],1605602,2
"Температура уже прошла, но анализы ходила сдавать) Нашли золотистый стафилококк.",0,0,0,1,0,DI[4],591856,4
Проблема была такая за ночь просыпалась раза 4-5.,0,0,0,1,0,DI[4],1071769,1
"Ребенок спал уже практически всю ночь, просыпался но криков таких не было.",1,0,0,1,0,EF[5]|DI[1],2460834,6
Пришла я к нему с жалобами на хроническую усталость и проблемы с засыпанием.,0,0,0,1,0,DI[3],2662915,2
Берегите своих детей!,0,0,0,0,0,NEUTRAL,2500038,4
"После первого брызга произошло чудо-наши сопельки исчезли, я подумала-надо же, какой чудо спрей, за одно применение сопли прошли... НО не тут то было... после второго брызга и последующих сопли начали литься в двойном обьеме, я в шоке, вместо того чтоб сопли прошли они начали течь еще намного больше... Ерунда в общем дорогая, и бестолковая... Больше никогда не куплюэтот препарат.",0,1,0,1,0,INF[2]|DI[3],589250,4
"После первой недели сразу заметила, он стал более внимательным, начал отвечать на вопросы как ""разговаривают животные"", до этого, добиться от него хоть слова было очень трудно, только если хорошее настроение.",1,0,0,1,0,EF[1]|DI[4],2407197,3
"Однако, примерно через несколько дней применения, заметила, что ребенок стал беспокойным, возбужденным, плохо спал ночью.",0,0,1,0,0,ADR[1],1171419,8
Кто из нас хоть один раз в жизни не сталкивался с проблемой бессонницы?,0,0,0,1,0,DI[3],2516885,3
"но к концу приема, (т. е пили где то 20 дней если не меньше, )у ребенка заболела сильно правая нога, через неделю левая, жаловался на боли в руках, сильные боли в мышщах.",0,0,1,0,0,ADR[2],1111461,4
Единственно что надо отметить - переболеть ветрянкой надо всем в детском возрасте - у взрослых она протекает на порядок сложнее.,0,0,0,1,0,DI[1],2450448,10
"Не только при вирусных заболеваниях, но и при хронических инфекционно-воспалительных, вторичном иммунодефиците, при гинекологических заболеваниях и др.",0,0,0,1,0,DI[4],953794,8
