1	никакой флуоксетин не поможет такой долбоёбке как я нахуй я его пачками жру толку ноль
1	Поняла, что расстройство сна у меня не из-за дулоксетина, потому что оно обострилось при увеличении дозы ламотрика. Сегодня мне снилось, что я вынуждена жить на 10 этаже в шатающемся доме с боязнью высоты. А мне говорят, что дом не шатается, мне просто кажется.
1	мама не купила то  что я просила по причине ей лень и теперь я лежу задыхаюсь без сальбутамола 👍👍👍👍😋
1	у меня ночью был приступ от него и пришлось снимать сальбутамолом, я не уверен, что мне подойдет из-за БА
1	не увлекайся, в штатах тип на отходах от паксила (оригинал венгерской поделки с фото) пострелял домочадцев из ружья и застрелился сам.
1	Пила долго золофт, из побочки отсутствие либидо и тошнота иногда, психиатр сказала, что не особо женский препеарат. Сейчас на прозаке, из побочки только тошнит иногда. ТОЛЬКО НЕ ПЕЙ КАЛИКСТА, + 10 кг, не могла понять откуда, хорошо, что психиатр спалился и быстро вернула вес)
1	После того, как я снова села на прегабалин, пидорасить стало поменьше, но зато стало так тоскливо, что хоть вешайся. Хорошо хоть муж рядом, да еще и свекровь приезжает. Я сейчас как никогда нуждаюсь в заботе и нежности.
1	@comrade_wolgast Мой психиатр очень критиковал назначение мне флуоксетина после подростковой попытки суицида. Говорил: «Серьезно? Назначать препарат, который вызывает самое выраженное усиление суицидальных тенденций?» Но мне норм с ним было, убить себя больше точно не хотелось.
1	Флуоксетин не легкая штука, но и не тяжёлая. Хорошо снимает тревожность.
1	пришлось смешать флуоксетин с фенибутом = выпала из реальности
1	@modern___myth алпразолам (но если слезешь с них, то, возможно, единственное живое, кого тебе захочется убить, будешь ты сама)   З.Ы. - а ещё на него нужно рецепт :(
1	Дилемма Либо попшыкаться с сальбутамолом и уснуть, но с вероятностью опять проснутсья (50:50) при этом мне станет хуже когда проснусь и вообще лимит исчерпан типа либо просто лежать до утра но пиздец воздуха не хватает короче
1	Такое ощущение, что это ламотриджин вывел меня из состояния деперсонализации/дереализации, в котором я находилась последнее время,  и теперь ко мне вернулась депрессия
1	помните, росомаха в последней части был такой болезненный и побитый, потом сделал себе инъекцию зеленой штуки, воспрял, начал бегать и всех крошить, а через 10 минут действие лекарства кончилось, и он снова стал дряхлым и хромающим?  вот у меня такая же ситуация с сальбутамолом
1	Ух, если понижение дозировки алпразолама так тяжело даётся, что же будет после отмены через неделю
1	Блд. Какой паксил? Это ж антидепрессант. Ненене. Мне просто от тупости мозга нада) фенотропил -хорошо помогает, но после пары дней придётся успокоительные пить, он очень нервирует меня)
1	О только сейчас дошло почему при метформине не рекомендуют употреблять алкоголь. Алкоголь же тоже снижает уровень сахара.
1	Вот русский флуоксетин хороший, ядрёный, крепкий, выпьешь таблетку, ходишь припизднутый и ебись оно всё в рот, сразу видно русские люди делали.  Не то что бездуховный австрийский, аккуратненький такой, очищенный, чтобы тонкую психику толерантного европейца не повредить, тьфу.
1	Аноны, как кончить под антидепрессантами? Я скоро стены ебать начну. Пью пароксетин, если что.
1	Нету там уже сибутрамина давно(((((((( больно он хорошо помогает, невыгодно им нас худеть
1	далее идет шок инфа про то что ВНИМАНИЕ от передозировки ксанаксом умер лил пип (хотя от какой наркоты он умер непонятно до сих пор) умер макмиллер и "застрелили рэпера икса"  твит благодарности коле за то что он не сказал про англичанина потому что на русское музло ему насрать
1	у тебя нет сонливости от него? меня последнее время рубит днем. понять не могу, то ли у меня спидорак какой, то ли флуоксетин так начал действовать
1	въебала в пять утра перед сном 200 мг кветиапина и вот уже три часа дня, я не очень давно таки выволокла себя из теплой кроватки, все утро шел дождь, я пару раз просыпалась, но потом засыпала обратно. охуенно. чувствую себя плюшевоватной, но отдохнувшей.
1	После кокаина, героина и оксикодона кожа лица становится шерше и упруже
1	с флуоксетина спать тянет хоть с чем то ты помогаешь
1	О, бро, золофт это тема. Единственное что даёт мне силы жить. Главное - начинай наращивать дозу постепенно. Оланзапин канеш такое себе, есть и поновее и помягче нейролептики. Ну и ты месяц ещё будешь ходить вечно сонным пока не втянешься.
1	кветирон хорошо рубит с 50 мг но он по рецепту
1	Только без прозака. От него немного самовыпилиться хочется.
1	Разумеется, я пью эзомепразол на постоянной основе, от ГПОД. Но не помогло( Нимесил все равно повлиял негативно
1	смотря что пить. От флуоксетина похудела за месяц на 4 кг, хотя специально для этого ничего не делала) но не советую, конечно
1	на деле я наелась перед сном кветиапина и довольно неплохо себя чувствую. вроде даже есть хочется, кажется. и рисовать.
1	Забыла вчера выпить алпразолам перед сном - страдала бессонницей до четырёх утра, пока не встала и не пошла за таблеткой. Не знаю, что это было. Совпадение и самовнушение или реально такой эффект.
1	С квентиакса очень смешно рубит. Будто я очень сильно перепила, но стараюсь выглядеть трезвой и не уснуть.
1	@lucky_the13th забери мой аппетит. Я из-за прозака хочу сожрать куриный торт, а потом вскрыть себе вены.
1	У меня такие странные мышечные ощущения от паксила кстати бывают. Может у феназепама тоже бывают такие побочки
1	Сертралин это всё-таки новое поколение сиозс, пароксетин и флуоксетин это пиздец какое дно при тдр. У меня тупо начинается вегетативный криз с него и панические атаки лютые на ровном месте. Даже с одной капсулы в минималке.
1	Блять. Ксанакс и рогипнол закончились, не могу уснуть даже под блистером феназепама, мда
1	Гриша, ты флуоксетином себе желудок посадишь на всю жизнь и это говно - эффект плацебо
1	секрет того что я вышла в мае в баттл первый раз в том что я выпила 2 таблы флуоксетина а потом бутылку сидра и мне было ваще все равно и поэтому танцевала я нормально и мысли были о музыке и движении а не о том что блятб тут же знакомые они смотрят на меня я ничего не умею фмл
1	психотерапевтка позвонила спросить как дела че ответить?нормально проспала под ксанаксом 19 часов?
1	сижу на работе, просто на ровном месте начинаю задыхаться, пшикаю сальбутамолом, не помогает, от этого начинается паника и я начинаю еще больше задыхаться. мне пизда!
1	Я уже и забыла что отменять венлафаксин НИХУЯСЕБЕ ПОМОГИТЕ
1	Здравствуйте!скажите пожалуйста может ли прием эутирокса быть причиной головокружения?
1	@psy__web Бля, от Кветиапина спал по 15-20 часов в сутки  Это была жесть
1	бля, как же я хочу просто нажраться кветиапином и уснуть на часов 15 (у меня еще целая пластинка), но хрен мне, школа ведь.
1	Мне понравилось видео "Как похудеть - метформин для "сушки" в спорте"
1	Увеличила дозу кветирона Знаю нельзя самостоятельно это делать Но не могу пребывать в бодровственном состоянии, мне лучше когда я сплю Пусть даже мне снится бред и ужасы,там я не думаю о том что я не в порядке
1	А вот рубит меня третий день хули? Это не иммунитет, иначе я б соплями исходила, но нет. Пирацетам с флуоксетином такое взаимодействие даёт?
1	@tordius Очень выгодно производить пустышку  как лекарство  от простуды, которая проходит самос-но  через несколько дней. Сложно оценить эффективность.Даже тамифлю с доказан-й эффективностью от гриппа  не сокращал продолжительность болезни в сравнении с банальным парацетамолом
1	В прошлый раз из-за флуоксетина я оказалась в больнице
1	я очень плохо тошноту переношу, так что я ламотриджин тупо дропнула
1	уже часов двенадцать почти постоянно тошнит (побочка от паксила) кмп надеюсь скоро пройдёт и станет лучше
1	15) На прошлой зимней олимпиаде большинство лыжников приехало со справкой о том что у них якобы астма. Сделано это было для того, чтобы легально принимать сальбутамол (то же что и я принимаю в ингаляторах) который расширяет объём легких. По сути допинг для здорового человека.
1	У меня большие вопросы к своему организму То есть под гидазепамом ты, сучара, засыпаешь намертво, а под прописанным врачом кветиапином - нет? Ты должен был бороться со злом, а не примкнуть к нему! Я мечтаю ощутить выспанность по утрам, а не чувство выползания из вязкого болота
1	по идее, это всё не норма, но ламотриджин заставляет переставать об этом думать и типа-перестраивать ценности хз то ли повышать дозу то ли не знаю что
1	Возможно, его пора заменить на другой препарат. Спросите своего врача. Но лично у меня после начала апатии в ходе приёма паксила, врач просто заменил лекарство, и все окей
1	Круги под глазами больше, чем сиськи. Спасибо (нет) флуоксетину за -4 кг за месяц, лучше чем спиды, 10/10, блядь.
1	короче лол  аллергия была не на метформин а на гормоны (причём не на оболочку а на сами блять гормоны кккккк) и теперь я тупа не знаю как буду лечить свой бешеный гормональный перекос
1	сейчас чуть не сдох в горле запершило кашлять начал думал все пизда приступ а симбикорт высоко поставлен
1	Вальдаксан, он не влияет на либидо, а значит что и на творческий полет, потому что в основном все колёса отбивают желание заниматься сексом и творчеством, под прозаком я даже музыка расхотела слушать
1	оксикодон, но от оксимирона меня тож блюёт и не помогает боли, так что одна хуйня?..
1	опять начала тафен, опять восхитительные ощущения разлитой в носоглотке кислоты
1	мне надо дожить до вечера понедельника. у меня тревога, тошнота, полное отсутствие аппетита, и последняя четвертинка кетилепта на случай пиздеца.
1	@vishnevskaya_18 так просто не хотела есть?или ты пила что-то типа флуоксетина?или ты может болела?
1	В отделе бурное обсуждение похудения и флуоксетина. Настя: Если Регина меня убьёт, то мне не придётся худеть. Алёна: А ты не хочешь в гробу красиво смотреться?
1	@ineed_a_doctor_ НЕ НАДО ГЛЮКОФАЖ!!! ОСОБЕННО ЕСЛИ есть шансы на анемию. ИР прекрасно снимается диетой и берберином БЕЗ глюкофажа. От него может очень тошнить и он  блокирует усвоение Б12
1	Моя любимая история про флуоксетин: препарат применяется для лечения анорексии, при этом, внимание, в побочках «может вызывать анорексию». А А А А А А А А
1	мне интересно если я забью на то, что от прозака задыхаюсь, и буду пить двойную дозу как раньше, мне полегчает типа? я уже готова
1	Если я допью всю пачку Метопролола, то у меня может остановиться сердце. Эта мысль не даёт мне покоя.
1	Пиздец душишь, тут про бухыч же. Лоперамид вообще врагу не пожелаю. Лучше просраться хорошенько чем 3 дня вообще не срать и чувствовать что нужно бы посрать
1	эутирокс. гормон ттг у меня был понижен, все из-за него.
1	Самое стремное чувство - это, когда таблетка флуоксетина застревает в горле и там растворяется, обжигая слизистую.
1	@denegnetnixya @soskoter @elenash500 Но ты смогла!! А муж три раза бросал, мы три раза страдали, в последний раз я подключила прозак и витамины, было легче. Продержался 2 года и закурил(!
1	очень люблю нечаянно пропускать прием прегабалина а потом удивляться что ж мне так хуево
1	короче, когда мне снизили дозу венлафаксина, мне через какое-то время стало полегче. два дня мне было сносно, я даже смогла съездить к полине, убраться в комнате и сделать ещё пару мелких дел. на этом всё, сейчас я опять лежу и от тахикардии в груди жжёт
1	От антибиотиков очень клонит в сон. Хуже кетилепта, блин.
1	Годные таблетки (венлаксор). У меня вначале от них было сердцебиение, расширенные зрачки и головокружение, но через три месяца они начали работать по назначению. Не бросай, если что, слишком рано. It takes time.
1	феназепамом дознулся под все это дело с блевотней постоянной. на очереди алпразолам. в будни вернусь к вальпройке, от нее только внутренности в ебучий ужас скрючивало
1	От ципралекса у меня единственная побочка +15 кг, хотя от него такое типа очень редко, поэтому и пересадили на другие. Золофт с ламикталом вместе еле-еле действуют, и чем дальше, тем меньше (видимо привыкание, хз)
1	У меня от метформина такие газы что я весь спортзал пропердел :(
1	Здрасьте. Пью паксил и атаракс уже 20 дней а эффекта 0, лишь ужасные побочки. Через неделю пойду к психотерапевту менять таблетки. Какие мне могут выписать вместо этих? Самое отвратное это просыпаться. Я стал спать часа 4-5, а просыпаясь чувствую невероя
1	почти не долблю велаксин все ещё ловлю пиздецки странные и реалистичные сны
1	сероквель, побочные эффекты: перманентный бичфейс.
1	меня и так тошнит постоянно то от алкоголя то от прозака но когда я ко всему ещё и заболела ситуация стала вообще критической
1	Обманчиво-приподнятое настроение из-за флуоксетина, хочется всего и сразу, но под всем этим сквозит лютая подавленность
1	Лида старый состав 30 капсул - Частично блокирует аппетит, усиленная на сибутрамине 30 капсул - полностью блокирует аппетит и сжигает жир
1	помню самое клевое и самое стремное одновременно было на прозаке я тогда похудела до 48 кг и не могла ничего писать вообще никак
1	@vrodeinna раньше мы покупали Баклофен, не знаю, продаётся ли сейчас. Но вещь чумовая - сначала ты гиперактивный, потом ходячий труп.
1	Рапортую: таблетки принял. Побочки противные. Ещё вместо тебантина продали аналог от fpizer (? Так пишется ?).
1	всё же пить пароксетин с утра было так себе идеей. продуктивность низкая, прокрастинация одолела. надо эти два дня доработать в режиме бззз.
1	Акку-Чек-немецкий глюкометр,Метформин известен с 40х годов,очень широко применялся,потом отменили из-за лактоацидоза(может вызвать),а теперь вновь препарат первой линии при лечении СД.
1	Через прегабалин сегодня на меня снизошла благодать божия. Делюсь ею с вами. Аминь.
1	затравка: флуоксетин подавляет голод ожидание: всё точно так же, просто голод приходит медленнее реальность: не хочешь есть не хочешь есть не хочешь есть ХУЯК ЖИВОТ СВОДИТ ТАК ЧТО ХОДИТЬ НЕВОЗМОЖНО ГОЛОВА КРУЖИТСЯ ЕЛЕ СТОИШЬ НА НОГАХ
1	ципролет и за 4 дня всё проходит. если горло, то фурацилин. а ломка это просто симптом, ничего не поделаешь. не умирай, Ань.
1	Омг, у одной клиентки моего психотерапевта голова раскалывается от флуоксетина
1	Побочка от имодиума: тошнота.  О Х У Е Н Н О
1	бля, аж ноги похолодели. я 2 года назад флуоксетин пила,не помню рассказывала тебе или нет как меня из петли вытаскивали и в лес увозили в багажнике ))0) так что да, знаю что это за ебанина. без алкоголя я легко продержусь
1	Венлаксор закончился вчера утром, я сутки без лекарств, и меня уже трясёт, рычу на всех, как в самый худший ПМС в жизни.  Это что, я до венлы всегда такая была? 🤭🙈🙈🙈
1	я перестала пить фенибут и перестала спать. это ещё цветочки, к весне психиатр снимет меня с ламотриджина и ад, наверное, можно уже натирать веревку мылом
