1	Ципрофлоксацин очень сильно давит на желудок, не принимайте его без надобности
1	Баклосан - это зло. Особенно отходняки с него. По возможности старайтесь избегать упарывания баклосаном.
1	@brilliantmad Ну, я что так хочу спать, что так хочу спать Но от ксанакса еще от дозы побольше приятно ведет и я чувствую, что мне приятно упасть в кровать И я не просыпаюсь теперь трижды за ночь от тахикардии Только один разочек
1	Когла таксист врубает нужен ксанакс, жизнь становится ярче.
1	Объёбаный от ксанакса лежу на заднем сиденье
1	– С чем тебе сделать кофе? – Со снотворным. – Могу только с лопедиумом. – Это чтобы меня так не бомбило?
1	Единственный плюс вставать рано — можно посмотреть больше серий сериала, пока меня не унесёт на волнах кветиапина в одиннадцать вечера
1	Приём прозака может вызывать попытки суицида
1	Так значит, это окончательный ответ. Мгм. Ну теперь главное продержаться до флуоксетина несколько дней и не получить ебейший срыв
1	За выходные долечилась, убралась в квартире и в клетке у крыс, съездила на дачу, сходила в магазин, приготовила еды и СРАЗУ после готовки помыла посуду. Флуоксетин заебись!
1	Белый Бим Чёрная ревность в крови есть перестал прозак криво вставлял с травой засада транков нет сна хуй дождешься самооценка ноль не помогает алкоголь сознание спутано бред друзья беспокоятся я с ними груб когда человек влюблён с нихуя он превращается в злобный труп
1	в самом носу. Можно пить обезбол для зубов, но саму проблему это не решит. Для носа капли только стероидные как-то помогут, с флутиказоном, но их больше месяца капать не рекомендую, ибо привыкание вызывает и нихуя не помогает :с
1	сука, вот читаю про лечение своей биполярки. прием венлафаксина год и более создает 35% вероятности перехода в гипоманию я пью уже год, и где она блять я ее очень жду
1	просто интересно, было бы все настолько фатально в этом плане, если б не вот эти постоянные упреки. я помню, как когда набрал резко вес из-за оланзапина, был в шаге от самоубийства из-за ненависти к себе (хотя были и другие причины). и это страшно.
1	приступ начался из за вентолина но без него я не могу дышать от спазмов выбирай стул так сказать
1	и самое ужасное для меня то, что я не хочу повышать дозу прозака, потому что без эмоций жить тоже мерзко, будто ты машина без эмоций
1	Сейчас чувствую такое безразличие, словно я под ебучим флуоксетином
1	Так разогнал прегабалин что в какой-то момент на несколько минут потерял связь с реальностью совсем.Не понравилось.До сих пор отхожу от это.
1	можно, конечно, но бензодиазепины и кветиапин меня по крайней мере вырубят
1	Детишки, по возможности не мешайте редбул с парацетамолом, лазолваном, эргофероном, прозаком и новопасситом. Меня снова вмазало((((
1	но, честно, я даже не представляю, как буду обходиться без кветиапина, т.к. он дарил мне стабильный и заебенный сон
1	Я бы накачалась флуоксетином, но от него не только нервы отключаются, но и мозги. А мне этого сейчас не надо.
1	@Ally_Besoalone @aoi_ano_sora Я сидела на нем 3 месяца, стала как зомби, на лице улыбка, внутри пустота. Резко бросила, 3 дня в агонии была. У паксила из всех ад самая хуевая отмена.  Если у тебя пройдёт легко, то ты волшебная
1	бляхомуха чумазики кто пил флуоксетин у вас были огромные зрачки после него?
1	И качество проверили бы тоже. Невозможно, меняют коробки, внутри фальсификат, от которого плохо, что это. Энам, Ципролет, Анаприлин, все поддельное, людей просто травят.
1	блять моё супердорогое лекарство кончилось 3-4 дня назад а я уже чувствую эту тяжесть в груди слышу хрипы как напряжно лежать даже на боку и у меня НАЧИНАЕТСЯ ПАНИКА ИЗ-ЗА ЭТОГО паникую что мне снова придётся брызгать сальбутамол снова вся эту хуйня не меньше 8 приступов за сутки
1	Есть транквилизаторы, но они отупляют. Нейролептики - нет, от них сначала хреново (но это не опасно), а потом и сон норм, и эмоции выключают, что тоже полезно. В моем случае Кветиапин
1	Фенозепам отключает память. Лучше фенибут, прегабалин, алпрозолам. Или мдма и каннабис)
1	Я: от кветиапина меня вырубает  Психиатр: увЕЛИЧИТБ ДОЗУ
1	я блядь просто в ахуе моей маме какая-то мразь дала флуоксетин чтобы блядь ПОХУДЕТь просто какого хуя
1	выпить утром кветиапин = спать весь рабочий день
1	сука, вспоминаю как в ночь на пятницу ко мне во сне под баклофеном пришел дремин и затер за жизнь и, блять, был максимально прав
1	Первый: кветиапин Северная звезда, 25мг. Доступность и цена: 9/10, действие в сравнении с оригом: 8/10, побочки в сравнении с оригом: 2/10. Ты хочешь спать и на ориге, но только на этом дженерике у тебя галюны (ты должен бороться со злом, а не стать им) и крючит (не акатизия).
1	сука сука сука ебаная тревога да что ж ты будешь делать можно жрать кветиапин постоянно спать и не тревожиться можно не жрать кветиапин и всё равно постоянно спать но тревожиться
1	до сих пор помню, как плохо мне было от хлорпротиксена, хотя это всего лишь нейролептик, как и оланзапин;
1	@Alexxxjaster Эутирокс давал мне нормальные анализы  какое-то время,  но оставались симптомы. Потом приходилось повышать. Постепенно с 25 у меня доза выросла до 100. При этом самочувствие ухудшалось.
1	ну не хочу я спать по 2 дня подряд (фенибут) или же страдать от головной боли (атаракс, флуоксетин), не хочу жить без всего спектра эмоций (флуоксетин)
1	Серотонин понижен. Тут либо флуоксетин либо каннабис
1	Прочитала, что Ламотриджин повышает частоту суицидального поведения. А ведь по факту это самый часто применяемый нормотимик. Бля. Стрем.
1	@daria_calma @proza_c я тоже много лет сидел на эутироксе (синтетический Т4) и при этом имел лишний вес, утомляемость, рассеянное внимание, трудности со сном,  мышечные боли, низкий уровень энергии и т.д.  про то что  моно терапия  синтетическим  т4  мало кому помогает даже при  якобы норм анализах
1	@Melamoryya @Barsa_01_35 так, я зарылся в инструкции по применению и нарыл, что как раз имодиум, не проникает через гематоэнцефалический барьер, то биш на мозг он не действует и да, есть те, кто занимаются таким, но у меня уже мозг не соображает, кто из них😂
1	О, я неистово плюсую габапентин, у меня с ним засыпание сократилось с трёх часов до минут 20. И панические атаки и комок в горле ушли. Прям чудное дело
1	постоянных снов о матери, в которых теперь начал появляться ещё и отец. сейчас вот проснулась после очень долгого яркого и тяжёлого сна и так гадко, но плакать не получается, потому что даже десятидневный курс флуоксетина запер слёзки внутри и прорыдаться не выйдет
1	Вроде всего второй день ламиктала, а тот же второй день не штормит. Может самовнушение? При этом же будто само благорасположение. Нет я не могу сказать, что мне хорошо. Скорее я пропускаю мир сквозь себя с улыбкой.
1	"Стимуляторы, галлюцинациногены и эйфоретики доказывают, что рай умещается в пакетике". В блистере Флуоксетина, если совсем уж точно.
1	@Lieslia_Sau Кровь, скорее, из-за того, что препарат оказался еще и сосудосуживающим - этого лучше не надо, там привыкание слизистой, если &gt;7 дн. Азеластин норм. Будесонид и Беклометазон еще хорошо - это глюкокортикоиды, но из-за местного применения на надпочечники не действуют.
1	спрашивает зачем тебе нужен прегабалин  говорю побочные у меня от ад были в виде судорог он говорит ОТ ТВОЕГО АД ТАКОГО НЕ БЫВАЕТ  бич????? скажи это моему организму И графе побочек в инструкциях
1	Принимая, например, прозак очень сложно заснуть. Пять месяцев почти провел на снотворных. Потом почему-то отпустило
1	у меня это кветирон - принимаешь и отрубаешься без шанса проснуться часов на 10
1	перестал действовать ципролет перестал действовать солпадеин это глубоко неправильно ибо мне нечем блять даже их заменить в 3-30 ночи
1	@25igonino4ka @OdessaTatiana Это вы зря. Итог талидомида это 40.000 родившихся детей без рук и ног.  А реклама впаривала, как он полезен. Точно тоже с вакцинами.
1	При совместном применении флуоксетина и алкоголя проявляются признаки повышенного содержания серотонина в крови и ещё ДОХУЯ всего разного и неприятного, лол
1	А еще вот. В феврале у меня был общий кризис, и тут я решила перестать пить АД (велаксин). Работал он слабо, плюс меня от него жутко рвало. Хуже не стало, и я подумала, что ура, стрессовый фактор (ДНР) ушел. А на самом деле, мне было плохо, а начинает лучшеть только сейчас!
1	@Faustovsky_ В наличии и под заказ, чуть что, пропадает аппетит. В прошлом году полгода насильно еду в себя пихала. Так что теперь не парюсь лишними см и кг, главное, что пожрать охота. А ведь это и аппетит к жизни, что важнее для жизни) Метформин не помогает наладить углеводный обмен?
1	узнала сегодня, что от прозака снятся кошмары. это объясняет пару лет моей жизни
1	Огосподи, ну если «не есть», то результат будет без метформина. А вообще погуглите «инсулинорезистентность» и как с ней бороться. Это будет получше, чем жрать невыписанные врачом таблетки. Метформин кстати снижает витамины В в организме, о чем мало кто знает.
1	А паксил разве помогает от мрачных мыслей? По-моему, от него только тошнит и болит голова.
1	Скорее всего я вчера проблевалась потому что сожрала всё в состав чего входила мука В инструкции к глюкофажу конечно указано "нееш быстрые углеводы подумой" но я слишком занятая девушка чтобы читать какие-то там инструкции к препаратам от которых могут отказать почки
1	@Riot_Ko и он уменьшает объем мозга, как и оланзапин
1	Или это ипохондрия, потому что дозировка того же кветиапина маленькая, не сотка же, хотя под соткой я бы спала сурком и не возникала. А так я не сплю, не ем, злюсь на кота, слышу звуки и чувствую запахи, что тоже бесит
1	А, возможно, меня всё ещё пячит с прегабалина, поэтому я не овощу, а ебашу, потому что после него у меня кокойто моторчег включается и я не могу просто тупить в экран.
1	@nightbvrd но лоперамида много нельзя 💦 он отключает кишечник насовсем 💦💦💦 а если там вирус, то 💦💦💦💦💦 смекту или угля надо похавать
1	ещё одна таблетка тригексифенидила или кветиапина и можете заказывать мне гроб
1	Вопрос знатокам: как пить оланзапин и перестать толстеть?
1	2 капсулы велаксина - и я апатичная амебка 3 капсулы - и у меня такая эйфория, что зубы скрипят ну здравствуйте, конечно
1	когда ебаю симбикорт, начинаю неебово так кашлять
1	Ночью подыхала на 120 ударах, закинулась метопрололом. Сейчас 64 удара и я тоже подыхаю. Что за хуйня
1	Ебашим флуоксетин, клиническая повторная депрессия, класс блять.
1	3. при этом я никак не могла отказаться от таблеток, потому что в том состоянии, в котором я приползла в марте, меня чуть не положили в больничку.  поэтому изначально мне впихнули велаксин.   велаксин это исчадие ада, особенно если вы берете российский дженерик (не надо так)
1	Метформин имитирует голодание. Опыты на мышах продемонстрировали, что метформин способен продлить жизнь на 10%,
1	Я перестала есть потому что больше не хочется. Флуоксетин пока даёт только этот эффект. Ем потому что надо три раза в день, иногда два. Ещё бы щитовидку проверить и плотно заняться здоровьем и спортом. Тогда может и не наберу обратно вес.
1	Одна из историй моей жизни: решила я однажды таблеток наглотаться (истерила, рыдала задыхаясь и всякое такое), но тут мой мозг вспомнил момент из фильма, где девочка пыталась покончить с собой с помощью имодиума. А главный герой ржал, что она в туалет год не сможет ходить
1	Смотрю попеременно на лоперамид и суматриптан, представила себя, сидящей на толчке с мигренью и решила просто сдаться на милость судьбы. Будь что будет. Понос позорнее.
1	Назначали алпразолам, превращалась в довольного овоща, думала НУ ЗАЧЕМ ТАК, но одновременно на все тааак чудесно пофиг, что немного страшно.  Оказалось, что ксанакс и есть алпразолам, я модная. Бгг.
1	и до лета надо похудеть поэтому мкц и глюкофаж снова будут помогать😊🙏
1	ЕСТЬ ПЕРЕСТАЛ, ПРОЗАК КРИВО ВСТАВЛЯЛ.
1	Паксил. Это антидепрессанты. Считаются вроде как лёгкими, но приход от них хороший. Вызывают абсолютное чувство похуизма совершенно на всё. У меня подруга на них сидела после развода, а я периодически стреляла у неё, когда совсем херово было.
1	Думаю - какого хрена вернулась головная боль, сонливость, раздражение.  Доза ксанакса на сегодня всё ещё меня ожидает.
1	однако спасибо метформину -4 кг йухуууу уже можно спокойно жрать на нг
1	Скомпенсированный сахарный диабет, пьёт Глюкофаж лонг: 750 мг 1 табл. Сосуды пролечивает систематически.  Плохая работа ЖКТ, частые диареи, в последнее время по утрам тошнота, до рвоты.
1	Я, кстати дозировку до 200 у сероквеля снизила. С 450. Ну, пока вроде просто чуть более раскованно чувствую. И то может просто на хороший секс наложилось.
1	Впервые 50кг без фена и флуоксетина! Похудела на чистом стрессе и нервах Хвастаюсь, потому что могу
1	Предположительно артист умер перед своим концертом от передозировки «Ксанаксом».
1	Я так натриггерилась,что мечтаю о новом рецепте на рекситин,чтобы меня не ебашило
1	выпила велаксин и умираю от тошноты. к черту такую жизнь, господа.
1	Когда ты принимаешь а/д. Ты не замечаешь их действия. Ты пьёшь и пьёшь, а потом думаешь нафиг я их пью и так все вроде прошло. А это они подействовали просто. Привыкание и отмена это у комплексных а/д типа паксила. Их параноикам прописывают.
1	я не понимаю, за каким хуем мне повысили дозировку атаракса, если я чуть ли не прямым текстом сказала, что говно залупа ещё и феварин выписали если ко мне тревога вернётся из-за того, что паксил пить не буду, я ему глаз на жопу натяну
1	я нашла отличный аналог флуоксетину со стороны отбивания аппетита
1	Из глаз выветрилась жуть самозахаванности, такая, как у Глебушки на афишах. Это было красиво, но очень больно. *Пока неуверенно* спасибо, тразодон.
1	Мониторьте своё состояние внимательно, Саша, что не так - сразу к врачу. Иногда АД меняют. (По себе знаю, от Венлафаксина эпично блевала, не смогла пить.)
1	Вчерась пережила шикарный приступ околоастмы. Накрыло возле яшки, плюс толпа людей на переходе, а я одна и мне страшно. Даблкилл. Трясущимися руками расплачивалась за сальбутамол в аптеке и запшикивала легкие. И как жить в этом газовом аду зимой?!
1	@InnaShidlovskay смпаю после флуоксетина только больше есть хотелось. + он вроде усиливает суицидомысли и тревогу
1	из-за сероквеля худею с немыслимой скоростью, из-за **** толстела. что со мной блядь не так
1	- от флуоксетина только похудеешь, у меня есть феназепам - феназепам-пам-пам
1	Я хочу домой и спать нереально. из-за кветиапина ядолжна была уже привыкнуть
1	@dibart1 У мужа 2 инфаркта 4 стента.Пьет Крестор тк должен холестерин ниже нормы Выбирали  побочка, повышает хор холестерин снижает плохой
1	@carolinamoskvi Конвалис, в побочных эффектах головокружение, заторможенность, потеря ориентации
