1	Прогулял физ ру  Обожрался ксанаксом  На алгебре сижу и ем вагину одноклассницы  Эта проститутка даже не сказала мне спасибо  Это не красиво
1	во мне столько энергии, что мне хочется бегатьбегатьбегать. уфф, меня трясет. весело, кароч. мне понравился этот антидепрессант (паксил), 100 из 10, рекомендую! охуенно себя чувствую!
1	выпила утром паксил и теперь буду весь день думать о том как не блевануть на пациентов и вам доброго утречка!
1	БЛЯТЬ РЕАЛЬНО ХОЧЕТСЯ УМЕРЕТЬ БЕЗ КВЕТИАПИНА МОЖЕТ ПРОДОЛЖИТЬ ЕГО ЖРАТЬ ТЕМ ПАЧЕ ЧТО Я ПОТОРОПИЛСЯ ГОВОРИТЬ ЧТО ЕСТЬ СИЛЫ ПРОСТО БЫВАЕТ ТАКОЕ ЧУВСТВО ЧТО ЕСТЬ ЧТО СВЕЖАЯ ГОЛОВА НО ВСЁ РАВНО ПОСТОЯННО СПЛЮ МНОГО И НАХУЯ МНЕ СВЕЖАЯ ГОЛОВА ВООБЩЕ
1	@anubisorpheus нет, хотя по идее должна бы, просто после таблеток вроде атаракса и паксила, феназепам уже не так по мозгам бьет
1	я триттико пью, он нетипичный и повышает либидо хихи :D тоже СИОЗС больше не выписывают
1	Никогда Слышите Никогда не пробуйте жевательный лоперамид в таблетках, я не знаю что там в составе, но я блевал дальше, чем видел
1	Не особо работает( я от метформина ловлю такие адские побочки
1	баклофен с алкоголем и вот я: счастливый, весёлый и сильный, по направлению вверх пытаюсь ползти, пытаюсь бежать #мальвинафолловиткотанов
1	Я сейчас пью паксил + кветиапин. Уже полгода. Мне отменили мощный транквилизатор и меня накрывает эмоциями, врач говорит что это нормально и надо перетерпеть
1	не принимал сегодня метформин и наконец-то чувство будто все внутренности что-то разъедает исчезло.
1	Я начинаю процедуру выползания из дома. Флуоксетин закончился, а без него такой откат будет, что вообще в овощ превращусь.
1	Венлаксор, мой старый добрый друг! Мы несколько лет не виделись, но судьба снова свела нас вместе, возрадуемся же. Зато теперь буду спать, ура.
1	Я всегда сплю на матрасе флуоксетина
1	@TheHomoErgaster @InPearly Для колли, шелти, келпи, и пары фидов овчарок опасны: гидрокортизон, декса, лоперамид Был мужик, что лечил водкой собаку, что упала в прорубь. Люди в лечатся так. А собака получила непоправимое поражение нервной системы. Пришлось усыпить.
1	Может и совпадение но после нескольких рах использования этого предмета получил хр бронхит . Курил сальбутамол .
1	Мне флуоксетин и близко не помог
1	Я то надеялась на сонную ночь а все вокруг бабки бегаю доктора шилом в жопу тыкаю шоб лечил додумались что это метопролол с аминозином дали такую гипотензию
1	У меня от пароксетина аноргазмия)
1	Ребятки, мне реально страшно. Похоже я попал на новую побочку прозака - я всерьез думаю перейти на винду. Пиздец. Всего лишь второй день сидения в kdenlive, а я уже на грани безумных решений. Очень надеюсь, что к утру попустит.
1	Под прегабалином так классно смотреть на экраны софиты и всякую там подсветку. Просто АЩ.
1	Кстати! Только осознала что я без паксила уже 3 месяца. Причем довольно тяжелые и насыщенные три месяца. Надеюсь, что я слезла с антидепрессантов окончательно
1	Опубликованы результаты сисиемных наблюдений по ингибиторам протонной помпы.  У принимающих препараты этой группы (омепразол,эзомепразол, ланзопразол) существенно увеличиваются шансы на развитие тяжелого поражения почек https://t.co/Zks9xCYCxW
1	4. три года пью антидепрессанты. первый был флуоксетин, потом флюанксол+паксил, сейчас карбамазепин+велаксин. пью большую дозу, но, если честно, не чувствую эффекта (пробовал не пить - незначительно хуже). замечено: выматывающие полнометражные сны и отсутствие интереса к сексу
1	Длительный прием антидиабетического препарата может привести к увеличению сахара в крови Антидиабетический препарат лираглутид является инкр
1	Вот хочу с вами поделиться. Я в том году сидела на диетах. Могла спокойно отсидеть два месяца голода, но как мне быть теперь? Из-за бисака и флуоксетина я посадила мочевой и желудок.Все бы ничего, я могла так же сидеть на голоде но нет.
1	На шестой день приема флуоксетина меня скрутило паническими атаками.
1	первые несколько дней на велаксине все было как и до него на прозаке, и тут В КОНЦЕ РАБОЧЕГО ДНЯ МЕНЯ НАКРЫЛА, добралась домой не помню как
1	Чувствую себя Элиотом который под аддералом 8 суток не спал мне необходимо как минимум 8 часов здорового сна
1	Марин,приступ был не понятный какой-то. Затрясловсю от кишков до волос,в пот бросило,руки сука как каменные стали,ажно поднять только усилеем воли.Давку померила норм140/90 сердце было 94-97 ну я и хряпнула эгилок 50мг.Шатать начало померила,там 100/67 лежала,хз чё было,самавшоке
1	дома истинный лазарет: у одного кота температура 41 и 8 лекарств каждое утро, второй хромает на обе лапы после 3 дней уколов ношпы и вообще плотно сидит на габапентине, а меня укачивает до блевотни и темноты в глазах каждый раз, когда пытаюсь дойти хотя бы до ванны.
1	я: извините прозак по-моему вреден для меня, мне становится хуже в последнее время, могу я поменять антидепрессанты? психотерапевт: ТЫ ЧТО ХОЧЕШЬ SSRI ОПЯТЬ ГЛОТАТЬ я:но у них сравнительно мало побочек.. пст: ЕЩЁ ОДНО СЛОВО И ТЕБЕ ПИЗДА
1	«я помню в Краснодаре лоперамид съел. а потом экстази. мне просто плохо было»
1	Я поняла, это отсутствие паксила. Я как белка-истеричка щас, кидаюсь в разные стороны и везде ОХУЕННО (кроме Собчак)
1	50.5 - спасибо Прозаку. Но остальные побочки выбешивают, где мой сон до вечера, встаю в 4 утра, каждый день, Карл.
1	От этого алпразолама адские отходосы. От ксанакса таких нет.
1	@VStativ @AlenaSvetoch и кстати - на прошлой неделе купила наш заменитель серетида - сердце заходится просто!! А от французского препарата было норм! Ну и покупала бы францию скажете вы. нет такой возможности! Его просто нет в аптеках! А если есть у меня на него денег не хватает!
1	После утренней дозы кветиапина адски клонит в сон. С трудом держусь.
1	Я на амбулаторном этапе этим занимаюсь. Антидепрессанты (лучше венлафаксин, я думаю, чем СИОЗС, снижающие аппетит), нейролептики не люблю, но иногда без них никуда. Режим набора веса крайне аккуратный нужен. Личная и семейная терапия точно нужны, но не все готовы на это.
1	хочешь спать - не можешь до 4 утра, хочешь позалипать в какую-либо хуйню в два часа ночи - рубит как на отходах от ксанакса
1	Носовое кровотечение, головная боль, рассеянность, тошнота, злость, злость, злость. У меня вопрос - это ламотриджин, погода, или стресс, который каким был, таким и остался (но с которым я справляюсь с блеском не в последнюю очередь благодаря ламотриджину).
1	у меня от паксила челюсти сводит. Особенно мучительно зевать
1	Выпил ксанакса Приспал, и мне приснилось, что я президент России Недалёкое будущее, лигалайз – всё, как вы просили Нога затекла, ссать охота, зато настроение стало ощутимо позвонче Я люблю Россию, Россия любит меня, мы поможем друг другу кончить
1	Тромбоэмболия может произойти и при профилактике. И от профилактики (гепарин, фраксипарин, ксарелто) могут быть осложнения - кровотечения. Тут очень тонкая грань. Сам по себе перелом или вывих шейного отдела позвоночника может привести к смерти из-за отёка мозга
1	Я который день в ломке от пароксетина и не хожу на пары Хех
1	итого: я заболела, с месячными и без кветиапина. завтра нужно по делам. мне _пизда_
1	снится какая-то больная бредятина, у меня закончились мои таблетки и ПАКСИЛ
1	- лекарства-убийцы (талидомид, левомицетин, стрептоцид, метаквалон, Фленфлурамин, прозак, парацетамол, тимеросал) - расширение показаний для операций, имеющее в основе финансовую выгоду (тонзилэктомия, удаление вен, кесарево сечение и др)
1	Периодически юзаю паксил + атаракс. Первые три дня приёма спишь постоянно. Ну и эффект антиеботиков 100%. А так все ок всегда. Даже был случай, когда выходила резко, но все относительно безболезненно прошло.
1	99% жрет флуоксетин. Его всем подрят выписывают. Я его ел 3 месяца подряд в детстве прикола ради, в дозировках значительно превышающих терапевтические и на 3 месяц был вынужден отказаться из-за невыносимой побочки.
1	Меня от таблетки Флуоксетина и глотка коньяка снесло.
1	сидел на АД, антипсихотиках и нормотимиках. нагрузок не было, за питанием начал следить после первой недели на колесах (появились силы), спать начал меньше (сидел на флуоксетине, поэтому первый день прошел как на спидах, после отпустило, но спал меньше чем надо)
1	аддерал больше не могу принимать ибо если меняешь дозировку (больше или меньше) то становишься ненормальной и вообще в рф незаконно
1	25. Как-то раз случайно (напившись) сожрала очень много ксанакса и проспала двое суток. Повторять не собираюсь
1	Итак, проснулась, от тревоги всё дрожит, начинаем тестировать местный аналог ксанакса, день первый
1	На прощанье доктор попугал меня ломками после привыкания к прозаку и сменой АД.
1	опять спать не могу. ето удвоение ламотриджина или гипомания душит?
1	Никогда не принимайте АД #Пароксетин  От него вас так разнесёт, шо пиздец   Единственный плюс - это гордиться потом, что похудел на 15 кг  Ну или не похудел 😬🤷🏼‍♀️
1	Пароксетин это прямо панацея, жизнь без постоянной тревоги если не сказка, то по крайней мере уже не ад
1	И так, Эутирокс 125 работает👌. Вес уходит .  Это не для похудения, это моя щитовидная железа фсё ёк, из-за этого пошел резкий набор. ☝️ Обследуйтесь у эндокринолога, сдайте кровь на всякие там ТТ, если вдруг стали набирать вес на ровном месте и чувствуете постоянную усталость.
1	@A_Kapustin Сибутрамин.  Торговое название - голд лайн . От него еще и хуй стоит постоянно.
1	читаю тред про рпп хм почему худеющие челы так тащатся по флуоксетину он же наоборот убирает всякие навязчивые состояния
1	Периодически за день случались такие эмоциональные качели, что Конни-Айленд не снилось Но в целом паксил хорош, держит крепко Без него был бы пиздец кромешный
1	@sanyacharon Привет,  котенок,  я человек с тем же диагнозом, уже полтора месяца принимаю пароксетин и пока не вижу эффекта (твой тред вызвал надежду)  Как думаешь, ТДР давит на восприятие?  У меня страх,  что я не люблю своего человека,  потому что не испытываю того,  что было до депрессии
1	чувствую прозак ещё даст о себе знатьу меня уже началась аритмиябля )))
1	Но вот побочки у прегабалина пздц было написано
1	В если сильные,невропатический боли?И стягивание кожи,нечувствительность полная..ноги в ступне,она сама не поднимается? Что делать?8 мес на габапентине или прегабалине?И по другому никак?
1	когда пиздецкое воспаление сочетается с подъемом на прозаке, получается странно  покашляла кровью, настроение превосходное
1	раньше паксил назначали, но теперь с него параноит
1	Попила цифран ст с зубами своими больными, уже месяц второй страдаю от последствий того, что он убил всё нахуй в организме. Как люди после химии восстанавливаются?
1	35. Ой я совсем забыла про ебучий ФЛУОКСЕТИН АКА ПРОЗАК который жрали просто все, кому не лень. Тогда ещё не так строго было в аптеках с препаратами по рецепту))) в побочках написано АНОРЕКСИЯ!!! правда никто не уточнял, что желание жрать пропадает максимум на 2 недели
1	Бабушка с диабетом второго типа наелась метформина и пошла в поликлинику сдавать кровь на сахар натощак. Там она упала в обморок из-за развившейся гипогликемии Что примечательно, она не может установить причинно-следственную связь между этими двумя событиями
1	На самом деле флу притупляет аппетит, но очень хорошо выравнивает настроение и нет таких диких скачков, как раньше.  Когда я перешла с пароксетина на флуоксетин, мне стало намного лучше. Я почувствовала себя живой и нормальной.
1	итак сейчас посмотрим кто сильнее мой организм или кветирон от которого меня все еще жестко рубит после 10 часов сна
1	Это даже не нервная система, это уже психика будет задействована( Однажды мне прописали сибутрамин, который Лорик пила - я чуть не сдохла в первые же три дня, были дикие головные боли( А Лорик вон прекрасно переносила, правда, её причина в другом
1	Ну, порошки какие-нибудь типа фервекса, промывать нос аквалором или чем-то таким,после спрей, если мешает заложенность, от горла можно доритрицин рассасывать или спреи (оралсепт вроде норм),можно противовирусные типа ингавирина/кагоцела/тамифлю, но хз, это все такое
1	Могу сказать то же самое на примере прозака. Я с нашего за неделю приема стал прикованным к тазику овощем
1	54. кстати, индивидуальных побочек может быть больше, чем вы думаете. никогда не знаешь, окажешься ли ты в том самом "очень редко" или нет. потому что далеко не всех так колбасит и убивает с велаксина или того же депакина. и никто тебя не застрахует.
1	еще блин Вове врач прописал антибиотик цифран, а я вспомнила, что это уеба, от которой меня жутко мутило, и я еще тогда бросила его пить.   Ну подумала, типа Вове мб норм будет  а нет, его тоже от него тошнит(
1	Проебала четыре приема велафакса, и теперь у меня отваливается голова
1	Новости: с паксила очень хочется спать
1	Сформулировал в диалоге опыт от флуоксетина, не могу не поделиться: Флуоксетин дарит чудесный эффект похуя. Не злого и отстраненного похуя, какой бывает и при дерьмовейшем настроении, а благостного, живого, конструктивного похуя. Это похуй не отрицания, но сияющего спокойствия.
1	лрт а на самом деле в чем прикол флуоксетина я один раз выпила таблетку пошла на улицу и чуть не уснула
1	Крепист чел! Иди к психиатру, пей паксил, станет проще. Позже появится силы! Думаю, у тебя все получится, сама в таком дерьме живу.
1	чувствую себя как все жертвы этой ловушки, когда ЗЕВАЮ ИЗ-ЗА ПРОЗАКА
1	@moon_out @Zverovski рексетин курсом ебошить надо и он рецептурный, перед его приёмом надо к психиатру сходить. да, и он больше эйфорических ощущений принесёт, а не успокоения, обратный же захват серотонина, вся хурма.
1	я понимаю почему от флуоксетина худеют тебя тошнит так что ты не способна переварить никакую пищу
1	надеюсь мне купят флуоксетин и я ещё месяц смогу жить как полу овощ
1	проснулась сегодня с низким давлением, опять все мышцы напряжены и тошнит ужасно. и тут я вспомнила почему я бросила паксил.
1	уже ловлю приходы от сальбутамола
1	Если смешать прозак, флуоксетин и велбутрин, а потом запить вином, будет очень весело.  Но вам не советую.
1	Отъехал по работе. После двух капсул габапентина.  Чем выше стресс, тем дальше едешь)
1	наконец-то я закончил пить этот Таваник. От которого бессонница.
1	*закинулся ксанаксом и смотрит телепузиков на потолке*
1	"Например, модафинил гораздо лучше, чем кофеин, улучшал способность невыспавшихся людей с юмором воспринимать мультики. Однако ни кофеин, ни модафинил, ни декстроамфетамин не улучшили реакцию испытуемых на словесные шутки." чет насторожился от этой статьи ахах
1	@crazy___fan Я каждый день забываю "Тафен" капать, придётся что-то с этим делать.  А вот "Ирифрин" сука поганая, ужасно жжёт глаз(((
