1	Зачем нужны спиды, если есть венлафаксин? &gt;24 часов бодрствования, полёт нормальный. Т.е. вроде бы и спать хочется, но вроде бы и терпимо.
1	Пью прозак Не могу пока сказать что появилась мотивация жить и работать   Зато тошнит постоянно 🤢 и настроение скачет от нормального (жизнь прикольная штука)  до рыдального (my life sucks).
1	Моя мама полгода пила флуоксетин, назначенный неврологом (в России неврологи имеют право выписывать психоактивные препараты) и была вполне несчастлива. Личный опыт - дело такое. Ошибка выжившего, все дела. Есть официальные исследования и доказательная медицина.
1	А Тамифлю таки работает, братцы! Даже, когда, кажется, уже все сроки прошли! Голос, правда, пропал, но появилась надежда на светлое будущее! 😀 Кстати, наша больничная касса Маккаби распространяет препарат по рецепту бесплатно. Мелочь, но приятно!
1	Поэтому при назначении флуоксетина  следует соотнести риск суицида и пользу от их применения.
1	съела сегодня какой то заграничный орех и начала задыхаться так сильно что мне помог только вентолин так я узнала что у меня на них аллергия
1	Поняла, что никакие отхода от веществ не сравнятся с синдромом отмены пароксетина
1	походу я единственный в мире человек который толстеет от флуоксетина :(
1	какая разница из-за чего покончить с собой: из-за депрессии, или предлагаемо набранных 20 кг от сероквеля?
1	@catspirit ну в моем случае комбо венлафаксина\миртазапина странное. ибо один хрен овощем хожу-лежу, лол.
1	спасибо адепрессу, циклодолу и нейролептикам за то, что я такая счастливая теперь.
1	Блядь, мне делать отчёт по практике,но я сижу под баклосаном и ничего не хочу делать эх
1	Начала пить таблетки и готова прямо сейчас умереть от этого сейзара. Адские побочки, просто потрясающе.
1	@FeelinaZ А ксанакс имеет моментальный эффект? Я ещё злюсь, что тот же феназепам не сразу помогает, эффект через несколько часов, когда уже не надо (а ещё хуже когда на работе накрывает, и хер ты что с этим сделаешь) Ну а в целом, лучше, когда хуево, перебрать с АД, чем повеситься))0)
1	Побочки метформина — это такая дрянь, уважаемые, что у меня даже приличного слова не находится. Лежу, дышу, пытаюсь не сильно умирать.
1	БЛЯ сейчас у подруги на балконе встретила упаковку флуоксетина, первая мысль: сцапать 2 шт, чтоб не видно было. когда она вернулась, сказала ей, и она убрала. по чувствам беспомощность, злость, грусть, разочарование, бессилие
1	Забылась и выпила Венлафаксин на голодный желудок. Расплачиваюсь.
1	как флуоксетин начала пить так и не было как перестала два дня назад так и хуево постоянно но дольше чем две недели его нельзя пить
1	я думаю че так настроение ебашит забыла что вторую капсулу флуоксетина закинула
1	@Gornostaiv @TheSuperDay @poebist от Прозака у меня тоже была фригидность.
1	Сонливость от Сейзара тоже была, кстати
1	2 капсулы флуоксетина зрачки опять за орбитой просто какого??? 7?
1	вот реально от прозака нехорошие мысли появляются х_х
1	Я чувствую себя лучше, я пытаюсь справляться. И у меня получается, пусть и не так быстро. Я все еще не могу ночью спать из-за голосов, но я уже контролирую свои бредовые идеи, меньше истерю. Это моя 3 серьезная попытка бросить флуоксетин. И последняя, потому что я молодец:3
1	Под ксанаксом сим действительно успокаивается, даже слишком. Он долго тупит перед тем, как выполнить действие, потому что сильно залипает. Иногда его вообще рубит спать.
1	Во первых надо исключить нагрузку недели на 2, пропить противовоспалительные, если финансы позволяют лучше коксибы, наружные нпвс мази, физиопроцедуры делов-то? Ну и миорелаксанты, миловали или баклосан, с последним аккуратнее, говорят может давление завалить
1	Препарат снимает спазм легких, который свойственен для астмы. Вы сколько не бегайте, устанете, но бронхоспазма у вас не будет. Вы тоже можете попробовать вентолин после бега - ничего не изменится.
1	@Lanik_Sky Особенно сейчас по осени вспоминается, когда симбикорт всегда рядом)  Местного действия от горла, полоскания разные, что-то в нос. Всегда консультировалась с врачом. Но оба раза токсикоз в первом триместре и в лёжку дома.Простуды были во втором триместре, а там больше разрешается
1	нет, простите, мне нужно это написать &gt;по результатам постмаркетинговых наблюдений оланзапина были зафиксированы случаи внезапной смерти
1	Когда первый раз норм выпила на фоне флуоксетина, весь следующий день казалось, что сейчас отъедет кукуха, но еще не отъехала, но держится на одном кирпичике, и так весь день (было настолько стрёмно, что не пила потом недели три)
1	@MimiMoloh Нет, в этом году у меня щоки и в прошлогодние джинсы не влезаю, которые на мне висели, когда я к тебе приезжала Хотя может на флуоксетине похудею. Аппетита уже нет.
1	КУРИШЬ ЧТОБЫ РУКИ НЕ ДРОЖАЛИ ПОТОМУ ЧТО ИЗ-ЗА ПРОЗАКА У ТЕБЯ СРАНЫЙ ТРЕМОР
1	антибиотик цифран мерзкий на вкус, хожу уже который день как говна поела и ничем этот привкус не убрать
1	Штош, это была максимально отвратительная ночь, еще и голова теперь болит. Будет мне уроком. Из-за этого я собирался высраться очень тяжелым текстом, но я себя пересилил. Без кветиапина очень хуево.
1	Пацан-лар Назначили Аатракс ?(вроде 3 раза в день) и паксил вроде 1 раз в день утром. Врроде что то из этого блочит никотиновые рецепторы. Как я буду теперь курить, и будет ли хоть какой то эффект с сижек? или вооббще усилит
1	@bloodyemaria Как вам новый феназепам? По мне так слабее тревожность снимает, зато сонливость сильнее. Как алпразолам стал
1	С понижением дозы ксанакса реально стал гораздо лучше спать, таки побочка это была, побочка
1	@nastya02081998 Голодание+кофе+сигареты+бисакодил+фуросемид+феназепам+флуоксетин=реанимация и тахикардия, испорченная обменка и все в куче Фуросемид жестко выводит кальций из организма
1	В голове творится такая хуйня, будто сижу на прозаке, мысли словно утекают в сточные воды. Пока скидываю все на погоду.
1	Да флуоксетин, т.к. от него аппетит уменьшается и он дешёвый
1	Смотрела недавно видос одной девушки, которая говорила о флуоксетине Мол, да, сначала помогало, а потом ей стало ПОХУЙ КОНКРЕТНО НА ВСЕ Что бы ни происходило. Абсолютно.на.все.
1	Если не знаешь ОРЗ у тебя или ОРВИ-выпей антигриппин от UPSA. Не вылечит, но симптомы снимет.Ежели грипп,то тамифлю или реленза (они рекомендованы ВОЗ).Остальное ( типа кагоцел,ингавирин)-шляпа
1	на тразодоне сплю свои восемь часов, кайнд оф йей
1	из-за отсутствия паксила в Минске пришлось заменить его дешевым аналогом, чувствую себя достаточно разжеванно
1	Это было похоже на эпидемию, которую связали с ухудшением экологии- промышленный бум как никак. Но в 1961 году один профессор нашел взаимосвязь между родившимися детьми с пороками и приемом талидомида   матерью во время беременности. Спустя долгих 14 лет после начала его продаж..
1	Кстати, циклодоша та ещё беда. Из как минимум 3 моих хороших знакомых тупо быстро и резко на моих глазах чисто слетели с катушек и необратимо деградировали. И баклофен ещё. Эти два препарата я считаю абсолютным злом.
1	Прозак це торговое название того же Флуоксетина. Лично мне подобные вещи только хуже делают. Усиливается депра + истерики, усиление ВСД, паник атаки и вегетативные кризы. Чесслово, лучше вообще эти сраные СИОЗС не трогать во время БАР.
1	Аххах это как я принимал триттико, меня врач невропатолог спрашивает, вам лучше я говорю нет, она что совсем? Я говорю ещё хуже)))). От них по утрам тяжело вставать оооооочень тяжело.
1	Щас бы выпить ксанакса и уснуть. Крутая штука
1	Есть перестал, прозак криво вставлял.
1	@_Avalanche__ вот-вот после пары таких ночей я решила купить флуоксетин(создание дьявола) спустя три недели (тк накапливается в организме) из-за неправильного приема им же и передознулась после чего стала каждый день падать в обмороки😃 итог: поставила рекорд 7 обмороков за день😎😎😎
1	Пиздец у нас цены на лекарства. Покупаю папке антикоагулянты, без которых при мерцательной аритмии вообще не вариант (риск инсульта и тромбоэмболии). Есть дешёвый варфарин, от которого самого по ходу можно отъехать. А есть современный Ксарелто 2681р за 28 таб. 35000 в год.
1	"широкую известность в США получили случаи суицида и других видов агрессивного поведения на фоне приёма флуоксетина"   агрессивный суицид
1	без габапентина либо параличи либо ужасы снятся нахуй надо больше не буду пропускать не дня этих нейролептиков
1	Мне сначала рексетин на год выписывали, но я от них как овощ была и при этом спать перестала. Зато никаких эмоций вообще
1	По назначению врача сегодня планово начала принимать антибиотик Левофлоксацин. Скажу я вам, давно у меня таких приходов не было. Сознание спутанное, взгляд не фокусируется, мысли убегают. Вот это побочка, вот это я понимаю 😆
1	а имодиум - это это могучее заклинание, снимающее поносное проклятие
1	бля начинает физически пидорить от смены медикаментов и резкой отмены паксила и вообще я хотела на втором аккаунте настрочить сто твитов о том как я сейчас счастлива но мне так физически хуево что я с завтрашнего дня скорее всего не буду просыпаться и все забуду к хуям
1	А еще беспокоит нога. Если в пятницу я уже почти бегал, то в сб-вс снова стал ощущать легкую боль. Мама волнуется из-за эутирокса, говорит, что он может тоже вызывать такие проблемы с ногами
1	Какие же от венлафаксина красивые блестящие глаза, который день умиляюсь.
1	так сегодня первый день уменьшения эсциталопрама и увеличения венлафаксина надеюсь организм не умрёт страшной смертью
1	при приеме сиофора влияеет ли на потенцию
1	Хотя, может, это потому что сегодня впервые въебал карбамазепин утром. Психиатр говорил, что от ламотриджина меньше седация, но его медленнее и дольше повышать нужно, как будто я куда-то тороплюсь :( Буду ламотриджин просить, наверное!
1	Это флувоксамин! Другой препарат и стоит в десять раз больше флуоксетина :( Я сама думала, что вот Грандаксин мне не нужен, потому что ПА у меня прошли, но врачиня сказала принимать. Возможно, у меня и правда тревожность, просто я уже не замечаю, что можно по-другому.
1	ДА ПОЧЕМУ Я НЕ ЕМ НО ТОЛСТЕЮ  КВЕТИАПИН Я ТЕБЯ НЕНАВИЖУ
1	Да чтоб я ещё раз взяла что-то по совету аптекарей! Парацетамольный порошок на вкус такой, будто зубную пасту выпил. Потеря части ужина и залп вентолина после кашля в комплекте. Нет, мироздание, когда я думала о том, что не хочу прямо сейчас спать, я не это имела в виду.
1	@baetaejo @soukokuisreal И вообще я в целом говорю, просто не жрите таблетки. Сначала ты просто интересуешься, а потом покупаешь. Я так чуть не подделала рецепт, лишь бы флуоксетин купить.. пожалуйста, осторожнее вы обе😭💖 Если неспокойно, купите персен, и тогда вы будете овощем, которому на все насрать
1	Прозак заебись, меня не бесит работа, переносится отлично - как будто просто обычная я, но меня ничего не раздражает. Единственное, что нифига он не стимулирует, спать охота олл дэй, из-за чего приходится пить много много кофе.
1	было дело - Амизон, Цифран, много пил тёплой воды, только так.
1	@juliamayko Это не нервы, а слабость от антибиотиков( Правильно Лорик их не употребляет) Чета этот Ципролет жутко токсичный оказался((
1	А помнишь Элис как март 2012го просто проспала весь. на прозаке. вот ведь классно было.
1	Срочное ревью: таваник самый ужасный антибиотик из тех, что я знаю, если у вас есть расстройства, не покупайте, выпил одну таблетку @ очутился в спайсовом бедаке (?), я хз даже, как это назвать, И ЭТО ХОРОШО ЕЩЁ, ЧТО Я НА СВОИХ ЛЕКАРСТВАХ, а о внутренних органах просто помолимся.
1	Глаз правый мутно видит, я не знаю что с этим делать, тетрациклин закладываю, ципрофлоксацин капаю, антибиотик пью.  Но глаз тупо перестаёт видеть.
1	Учитывая то, что мне назначили сероквель, с которого любую анобабащку распидорасит, имеет смысл вернуться к ведению дневника жранины.  К слову, с колес я выспалась как никогда, просто все дерьмо из этих семи часов выспала.
1	7 моих смертных грехов: 1. не спать до часу ночи 2. не спать до 2 ночи 3. не спать до 3 ночи 4. не спать до 4 утра 5. не спать до 5 утра 6. таблеточка сероквеля 7. проспать нахуй всё https://t.co/tf4WbPOINr
1	«БАКЛОСАН ПОЛНАЯ ХУЙНЯ, КОТОРУЮ НЕЛЬЗЯ КОНТРОЛИРОВАТЬ, ОТ КОТОРОЙ ПРОТЕКАЕТ КОЛПАК, ЕСЛИ НА НЕЕ ПОДСЯДИТЕ ВЫ В ФИНАЛЕ: ОКАЖИТЕСЬ В ПСИХУШКЕ, ПУСКАЯ СЛЮНИ.., С ОРГАНИЧЕСКИМ ПОРАЖЕНИЕМ ГОЛОВНОГО МОЗГА И ВДРЫЗГ РАЪЕБАНОЙ НЕРВНОЙ СИСТЕМОЙ!!!!!»
1	Чем больше ты удалбливаешься сейчас прозаком и прочим, тем больше ты будешь смазывать хавчик со своего ебала в старости
1	@vladanrains сертралин -&gt; флуоксетин, оба сиозс. в обоих случаях был небольшой тремор, изменение веса и длительности сна. от флуоксетина была изжога, если пить на голодный желудок. а либидо у меня по жизни низкое но оба сработали, мне больше не хотелось плакать целыми днями
1	Lil Peep'a убил токсичный эффект от фентанила и алпразолама. Фентанил, синтетический опиод, в сотни раз мощнее морфина. В крови нашли следы употребления марихуаны, кокаина и болеут-го Трамадол. В моче нашли остатки гидрокодона, гидроморфона, оксикодона, оксиморфона и оксимирона
1	«Имодиум» быстро и эффективно избавит вас от «Даниссимо».  #FollowBack #FF_RU
1	И, для спокойствия, гикированный гемоглобин. Метформин в помощ, похудеть на 30 кг
1	рано пробудился, однако. триттико - оно такоэ.
1	я в Вильнюсе в музыкальном театре сегодня работаю и ещё сегодня первый день перехода на следующую дозу Паксила. У меня зрачки размером с пивную крышечку и я хочу всех послать в пизду
1	65. на флуоксетине я сбросила ~7 кг. вес не вернулся до сих пор. совмещала с шоколадной диетой. не советую, но результат держится
1	Ну и отлично. Не помру от повышения вальпроевой кислотой риска суицидальных мыслей, так помру от токсичности ламиктала.
1	@alonsokexano Пойти к психиатру и сказать, что чот мне не очень, но есть объективные причины, что делать? У тебя не Паксил был, случайно? А то с них ещё слезать надо медленно и печально, сокращая до 1/4, иначе может ломать.
1	Пока на глаза попалась "Я сошла с ума", признаюсь ксанаксу: Я сошла с ума, я сошла с ума, мне нужна она - ТАБЛЕТОЧКА.
1	Держал только Паксил. От Велафакса и Тералиджена вообще мало толку. Одна сонливость и ещё более депрессивная апатия. Атаракс быстро тоже не помогает. Возвращаться к Паксилу уже поздно.  Чёртова суицидальная хандра. Помогает алкоголь, но днём его нельзя. Мир умирает- это прекрасно
1	Послезавтра защита дипломного проекта. Сдам я его конечно на пять, я же охуенная. (накачаюсь ксанаксом чтобы не умереть от паники публичного выступления)
1	Раньше фликсоназе, потом пару лет помогал лоратадин обычный, в этом году лоратадин не работает
1	Используя в качестве модели рыбку данио-рерио, ученые обнаружили, что под формировавшиеся под действием флуоксетина рыбки теряют способность адаптироваться к новым стрессовым условиям:
