1	однако спасибо метформину -4 кг йухуууу уже можно спокойно жрать на нг
1	и самое ужасное для меня то, что я не хочу повышать дозу прозака, потому что без эмоций жить тоже мерзко, будто ты машина без эмоций
1	аддерал больше не могу принимать ибо если меняешь дозировку (больше или меньше) то становишься ненормальной и вообще в рф незаконно
1	2 капсулы велаксина - и я апатичная амебка 3 капсулы - и у меня такая эйфория, что зубы скрипят ну здравствуйте, конечно
1	Поэтому при назначении флуоксетина  следует соотнести риск суицида и пользу от их применения.
1	у меня от паксила челюсти сводит. Особенно мучительно зевать
1	перестал действовать ципролет перестал действовать солпадеин это глубоко неправильно ибо мне нечем блять даже их заменить в 3-30 ночи
1	@nastya02081998 Голодание+кофе+сигареты+бисакодил+фуросемид+феназепам+флуоксетин=реанимация и тахикардия, испорченная обменка и все в куче Фуросемид жестко выводит кальций из организма
1	Пью прозак Не могу пока сказать что появилась мотивация жить и работать   Зато тошнит постоянно 🤢 и настроение скачет от нормального (жизнь прикольная штука)  до рыдального (my life sucks).
1	У меня от метформина такие газы что я весь спортзал пропердел :(
1	Мне сначала рексетин на год выписывали, но я от них как овощ была и при этом спать перестала. Зато никаких эмоций вообще
1	Лида старый состав 30 капсул - Частично блокирует аппетит, усиленная на сибутрамине 30 капсул - полностью блокирует аппетит и сжигает жир
1	А, возможно, меня всё ещё пячит с прегабалина, поэтому я не овощу, а ебашу, потому что после него у меня кокойто моторчег включается и я не могу просто тупить в экран.
1	От этого алпразолама адские отходосы. От ксанакса таких нет.
1	А еще вот. В феврале у меня был общий кризис, и тут я решила перестать пить АД (велаксин). Работал он слабо, плюс меня от него жутко рвало. Хуже не стало, и я подумала, что ура, стрессовый фактор (ДНР) ушел. А на самом деле, мне было плохо, а начинает лучшеть только сейчас!
1	Вопрос знатокам: как пить оланзапин и перестать толстеть?
1	зависит от группы. если сиозс (флуоксетин, пароксетин) готовься, что эффект будет появляться в течение 4н в среднем, не сразу~бах и ты охуенно счастлив. главное грамотное наращивание дозировки. первые 2н мб незначительное ухудшение настроения.ну и не бросать резко(прием от 6мес)
1	ночью чуть не вызвала скорую птушо думала что меня инфаркт хватил. потом погуглила и поняла что это тот самый эффект отмены венлафаксина, о котором так долго говорили большевики, а я его тупо два дня забывала пить
1	бляхомуха чумазики кто пил флуоксетин у вас были огромные зрачки после него?
1	Я, кстати дозировку до 200 у сероквеля снизила. С 450. Ну, пока вроде просто чуть более раскованно чувствую. И то может просто на хороший секс наложилось.
1	лрт а на самом деле в чем прикол флуоксетина я один раз выпила таблетку пошла на улицу и чуть не уснула
1	ебнула велаксина, а как будто бы мдма - челюсть сводит и  какое-то возбуждение странно приятное
1	На самом деле я была удивлена, насколько совпало то, что у меня нашли и то, о чем ты писал, там было про инсулинорезистентность, если не ошибаюсь. В общем, я уже вторые сутки хожу в легком недоумении и панике - Глюкофаж и достинекс могут превратить в овощ, или это я умираю? Ахах
1	очень люблю нечаянно пропускать прием прегабалина а потом удивляться что ж мне так хуево
1	Фенозепам отключает память. Лучше фенибут, прегабалин, алпрозолам. Или мдма и каннабис)
1	Здрасьте. Пью паксил и атаракс уже 20 дней а эффекта 0, лишь ужасные побочки. Через неделю пойду к психотерапевту менять таблетки. Какие мне могут выписать вместо этих? Самое отвратное это просыпаться. Я стал спать часа 4-5, а просыпаясь чувствую невероя
1	спасибо адепрессу, циклодолу и нейролептикам за то, что я такая счастливая теперь.
1	Периодически юзаю паксил + атаракс. Первые три дня приёма спишь постоянно. Ну и эффект антиеботиков 100%. А так все ок всегда. Даже был случай, когда выходила резко, но все относительно безболезненно прошло.
1	Забылась и выпила Венлафаксин на голодный желудок. Расплачиваюсь.
1	Щас бы выпить ксанакса и уснуть. Крутая штука
1	Хотя, может, это потому что сегодня впервые въебал карбамазепин утром. Психиатр говорил, что от ламотриджина меньше седация, но его медленнее и дольше повышать нужно, как будто я куда-то тороплюсь :( Буду ламотриджин просить, наверное!
1	Аааа, какой кошмар( Как у меня от метформина, не усваивается В12(( Да, эти лекарства одно лечат, другое калечат(
1	Такое ощущение, что это ламотриджин вывел меня из состояния деперсонализации/дереализации, в котором я находилась последнее время,  и теперь ко мне вернулась депрессия
1	Сформулировал в диалоге опыт от флуоксетина, не могу не поделиться: Флуоксетин дарит чудесный эффект похуя. Не злого и отстраненного похуя, какой бывает и при дерьмовейшем настроении, а благостного, живого, конструктивного похуя. Это похуй не отрицания, но сияющего спокойствия.
1	Прогулял физ ру  Обожрался ксанаксом  На алгебре сижу и ем вагину одноклассницы  Эта проститутка даже не сказала мне спасибо  Это не красиво
1	@hujonch испытывала подобные чувства, когда на жестких сильно похудела, и все говорили что это обменка хорошая и что я ничего не делала. и все толстые такие:это гены. а ты такой не жрешь еду, пьешь флуоксетин и такой: ага ага, гены
1	Это даже не нервная система, это уже психика будет задействована( Однажды мне прописали сибутрамин, который Лорик пила - я чуть не сдохла в первые же три дня, были дикие головные боли( А Лорик вон прекрасно переносила, правда, её причина в другом
1	@tordius Очень выгодно производить пустышку  как лекарство  от простуды, которая проходит самос-но  через несколько дней. Сложно оценить эффективность.Даже тамифлю с доказан-й эффективностью от гриппа  не сокращал продолжительность болезни в сравнении с банальным парацетамолом
1	позавчера моя психиаторка сказала что от моих лекарств может быть запор а я такой ЧЁ САФРИС НЕ ТОЛЬКО ВЫГЛЯДИТ КАК ИМОДИУМ НО И ДЕЙСТВУЕТ?))
1	50.5 - спасибо Прозаку. Но остальные побочки выбешивают, где мой сон до вечера, встаю в 4 утра, каждый день, Карл.
1	так сегодня первый день уменьшения эсциталопрама и увеличения венлафаксина надеюсь организм не умрёт страшной смертью
1	Если не знаешь ОРЗ у тебя или ОРВИ-выпей антигриппин от UPSA. Не вылечит, но симптомы снимет.Ежели грипп,то тамифлю или реленза (они рекомендованы ВОЗ).Остальное ( типа кагоцел,ингавирин)-шляпа
1	Самое стремное чувство - это, когда таблетка флуоксетина застревает в горле и там растворяется, обжигая слизистую.
1	Могу сказать то же самое на примере прозака. Я с нашего за неделю приема стал прикованным к тазику овощем
1	бля начинает физически пидорить от смены медикаментов и резкой отмены паксила и вообще я хотела на втором аккаунте настрочить сто твитов о том как я сейчас счастлива но мне так физически хуево что я с завтрашнего дня скорее всего не буду просыпаться и все забуду к хуям
1	Сейчас чувствую такое безразличие, словно я под ебучим флуоксетином
1	@moon_out @Zverovski рексетин курсом ебошить надо и он рецептурный, перед его приёмом надо к психиатру сходить. да, и он больше эйфорических ощущений принесёт, а не успокоения, обратный же захват серотонина, вся хурма.
1	Бабушка с диабетом второго типа наелась метформина и пошла в поликлинику сдавать кровь на сахар натощак. Там она упала в обморок из-за развившейся гипогликемии Что примечательно, она не может установить причинно-следственную связь между этими двумя событиями
1	С понижением дозы ксанакса реально стал гораздо лучше спать, таки побочка это была, побочка
1	от ксанакса и не встанет
1	@Ally_Besoalone @aoi_ano_sora Я сидела на нем 3 месяца, стала как зомби, на лице улыбка, внутри пустота. Резко бросила, 3 дня в агонии была. У паксила из всех ад самая хуевая отмена.  Если у тебя пройдёт легко, то ты волшебная
1	Когла таксист врубает нужен ксанакс, жизнь становится ярче.
1	итого: я заболела, с месячными и без кветиапина. завтра нужно по делам. мне _пизда_
1	А еще беспокоит нога. Если в пятницу я уже почти бегал, то в сб-вс снова стал ощущать легкую боль. Мама волнуется из-за эутирокса, говорит, что он может тоже вызывать такие проблемы с ногами
1	итак сейчас посмотрим кто сильнее мой организм или кветирон от которого меня все еще жестко рубит после 10 часов сна
1	Срочное ревью: таваник самый ужасный антибиотик из тех, что я знаю, если у вас есть расстройства, не покупайте, выпил одну таблетку @ очутился в спайсовом бедаке (?), я хз даже, как это назвать, И ЭТО ХОРОШО ЕЩЁ, ЧТО Я НА СВОИХ ЛЕКАРСТВАХ, а о внутренних органах просто помолимся.
1	Ночью подыхала на 120 ударах, закинулась метопрололом. Сейчас 64 удара и я тоже подыхаю. Что за хуйня
1	Так разогнал прегабалин что в какой-то момент на несколько минут потерял связь с реальностью совсем.Не понравилось.До сих пор отхожу от это.
1	Блять. Ксанакс и рогипнол закончились, не могу уснуть даже под блистером феназепама, мда
1	Гриша, ты флуоксетином себе желудок посадишь на всю жизнь и это говно - эффект плацебо
1	Я уже и забыла что отменять венлафаксин НИХУЯСЕБЕ ПОМОГИТЕ
1	Побочка от имодиума: тошнота.  О Х У Е Н Н О
1	Единственный плюс вставать рано — можно посмотреть больше серий сериала, пока меня не унесёт на волнах кветиапина в одиннадцать вечера
1	ксанакс с бухлишком же смешивать не рекомендуют!
1	когда ебаю симбикорт, начинаю неебово так кашлять
1	опять спать не могу. ето удвоение ламотриджина или гипомания душит?
1	Тромбоэмболия может произойти и при профилактике. И от профилактики (гепарин, фраксипарин, ксарелто) могут быть осложнения - кровотечения. Тут очень тонкая грань. Сам по себе перелом или вывих шейного отдела позвоночника может привести к смерти из-за отёка мозга
1	Проебала четыре приема велафакса, и теперь у меня отваливается голова
1	Мне флуоксетин и близко не помог
1	Предположительно артист умер перед своим концертом от передозировки «Ксанаксом».
1	затравка: флуоксетин подавляет голод ожидание: всё точно так же, просто голод приходит медленнее реальность: не хочешь есть не хочешь есть не хочешь есть ХУЯК ЖИВОТ СВОДИТ ТАК ЧТО ХОДИТЬ НЕВОЗМОЖНО ГОЛОВА КРУЖИТСЯ ЕЛЕ СТОИШЬ НА НОГАХ
1	Капец мне плохо такое чувство будто одышка, не хватает воздуха но я воспользовалась сальбутамолом уже дважды и  у меня такое чувство будто я буквально слышу свое сердцебиение и оно то ускоряется то замедляется Вот именно после того, как помыли кота
1	сука, вспоминаю как в ночь на пятницу ко мне во сне под баклофеном пришел дремин и затер за жизнь и, блять, был максимально прав
1	узнала сегодня, что от прозака снятся кошмары. это объясняет пару лет моей жизни
1	@baetaejo @soukokuisreal И вообще я в целом говорю, просто не жрите таблетки. Сначала ты просто интересуешься, а потом покупаешь. Я так чуть не подделала рецепт, лишь бы флуоксетин купить.. пожалуйста, осторожнее вы обе😭💖 Если неспокойно, купите персен, и тогда вы будете овощем, которому на все насрать
1	Кстати! Только осознала что я без паксила уже 3 месяца. Причем довольно тяжелые и насыщенные три месяца. Надеюсь, что я слезла с антидепрессантов окончательно
1	Только без прозака. От него немного самовыпилиться хочется.
1	Венлаксор, мой старый добрый друг! Мы несколько лет не виделись, но судьба снова свела нас вместе, возрадуемся же. Зато теперь буду спать, ура.
1	"""Стимуляторы, галлюцинациногены и эйфоретики доказывают, что рай умещается в пакетике"". В блистере Флуоксетина, если совсем уж точно."
1	Попила цифран ст с зубами своими больными, уже месяц второй страдаю от последствий того, что он убил всё нахуй в организме. Как люди после химии восстанавливаются?
1	Глаз правый мутно видит, я не знаю что с этим делать, тетрациклин закладываю, ципрофлоксацин капаю, антибиотик пью.  Но глаз тупо перестаёт видеть.
1	Детишки, по возможности не мешайте редбул с парацетамолом, лазолваном, эргофероном, прозаком и новопасситом. Меня снова вмазало((((
1	@Gornostaiv @TheSuperDay @poebist от Прозака у меня тоже была фригидность.
1	Приём прозака может вызывать попытки суицида
1	А паксил разве помогает от мрачных мыслей? По-моему, от него только тошнит и болит голова.
1	@bloodyemaria Как вам новый феназепам? По мне так слабее тревожность снимает, зато сонливость сильнее. Как алпразолам стал
1	мне интересно если я забью на то, что от прозака задыхаюсь, и буду пить двойную дозу как раньше, мне полегчает типа? я уже готова
1	бля, аж ноги похолодели. я 2 года назад флуоксетин пила,не помню рассказывала тебе или нет как меня из петли вытаскивали и в лес увозили в багажнике ))0) так что да, знаю что это за ебанина. без алкоголя я легко продержусь
1	@Lanik_Sky Особенно сейчас по осени вспоминается, когда симбикорт всегда рядом)  Местного действия от горла, полоскания разные, что-то в нос. Всегда консультировалась с врачом. Но оба раза токсикоз в первом триместре и в лёжку дома.Простуды были во втором триместре, а там больше разрешается
1	сука сука сука ебаная тревога да что ж ты будешь делать можно жрать кветиапин постоянно спать и не тревожиться можно не жрать кветиапин и всё равно постоянно спать но тревожиться
1	Не особо работает( я от метформина ловлю такие адские побочки
1	Никогда не принимайте АД #Пароксетин  От него вас так разнесёт, шо пиздец   Единственный плюс - это гордиться потом, что похудел на 15 кг  Ну или не похудел 😬🤷🏼‍♀️
1	@alonsokexano Пойти к психиатру и сказать, что чот мне не очень, но есть объективные причины, что делать? У тебя не Паксил был, случайно? А то с них ещё слезать надо медленно и печально, сокращая до 1/4, иначе может ломать.
1	под прозаком такое бывает. ёбнешь колесо и три часа всех любишь, радость дикая такая. потом, как отпускает, начинаются кары египетские.
1	короче лол  аллергия была не на метформин а на гормоны (причём не на оболочку а на сами блять гормоны кккккк) и теперь я тупа не знаю как буду лечить свой бешеный гормональный перекос
1	О, я неистово плюсую габапентин, у меня с ним засыпание сократилось с трёх часов до минут 20. И панические атаки и комок в горле ушли. Прям чудное дело
1	Учитывая то, что мне назначили сероквель, с которого любую анобабащку распидорасит, имеет смысл вернуться к ведению дневника жранины.  К слову, с колес я выспалась как никогда, просто все дерьмо из этих семи часов выспала.
1	выпить утром кветиапин = спать весь рабочий день
0	У меня диабет 2 типа. Лекарство-метформин стали бесплатно выдавать только перед выборами Президента России(Татарстан)
0	Может закинуться лидокаином или флуоксетином, дабы полегчало?
0	Хуета, Паша расскажет за ксанакс и корвус
0	Скорее бы начать пить триттико
0	@alderaanrush Эриус или дезал ещё хороший + в нос назарел Но это сильные
