1	однако спасибо метформину -4 кг йухуууу уже можно спокойно жрать на нг
1	- от флуоксетина только похудеешь, у меня есть феназепам - феназепам-пам-пам
1	Носовое кровотечение, головная боль, рассеянность, тошнота, злость, злость, злость. У меня вопрос - это ламотриджин, погода, или стресс, который каким был, таким и остался (но с которым я справляюсь с блеском не в последнюю очередь благодаря ламотриджину).
1	Вчерась пережила шикарный приступ околоастмы. Накрыло возле яшки, плюс толпа людей на переходе, а я одна и мне страшно. Даблкилл. Трясущимися руками расплачивалась за сальбутамол в аптеке и запшикивала легкие. И как жить в этом газовом аду зимой?!
1	@juliamayko Это не нервы, а слабость от антибиотиков( Правильно Лорик их не употребляет) Чета этот Ципролет жутко токсичный оказался((
1	Но у меня нет МДМА. Есть только пара припасенных капсул с Прегабалином. Впрочем, почему бы и не да. Голова-то болит совершенно скотски.
1	без габапентина либо параличи либо ужасы снятся нахуй надо больше не буду пропускать не дня этих нейролептиков
1	Используя в качестве модели рыбку данио-рерио, ученые обнаружили, что под формировавшиеся под действием флуоксетина рыбки теряют способность адаптироваться к новым стрессовым условиям:
1	на тразодоне сплю свои восемь часов, кайнд оф йей
1	делаю ингаляцию с вентолином. после него сердце будет стучать будто после четырех чашек кофе
1	Я хочу домой и спать нереально. из-за кветиапина ядолжна была уже привыкнуть
1	35. Ой я совсем забыла про ебучий ФЛУОКСЕТИН АКА ПРОЗАК который жрали просто все, кому не лень. Тогда ещё не так строго было в аптеках с препаратами по рецепту))) в побочках написано АНОРЕКСИЯ!!! правда никто не уточнял, что желание жрать пропадает максимум на 2 недели
1	При совместном применении флуоксетина и алкоголя проявляются признаки повышенного содержания серотонина в крови и ещё ДОХУЯ всего разного и неприятного, лол
1	А вот рубит меня третий день хули? Это не иммунитет, иначе я б соплями исходила, но нет. Пирацетам с флуоксетином такое взаимодействие даёт?
1	наконец-то я закончил пить этот Таваник. От которого бессонница.
1	въебала в пять утра перед сном 200 мг кветиапина и вот уже три часа дня, я не очень давно таки выволокла себя из теплой кроватки, все утро шел дождь, я пару раз просыпалась, но потом засыпала обратно. охуенно. чувствую себя плюшевоватной, но отдохнувшей.
1	Серотонин понижен. Тут либо флуоксетин либо каннабис
1	во мне столько энергии, что мне хочется бегатьбегатьбегать. уфф, меня трясет. весело, кароч. мне понравился этот антидепрессант (паксил), 100 из 10, рекомендую! охуенно себя чувствую!
1	Ну, порошки какие-нибудь типа фервекса, промывать нос аквалором или чем-то таким,после спрей, если мешает заложенность, от горла можно доритрицин рассасывать или спреи (оралсепт вроде норм),можно противовирусные типа ингавирина/кагоцела/тамифлю, но хз, это все такое
1	из-за отсутствия паксила в Минске пришлось заменить его дешевым аналогом, чувствую себя достаточно разжеванно
1	Мне определенно нравится спать без кошмаров и шутить тупые шуточки под флуоксетином.
1	я блядь просто в ахуе моей маме какая-то мразь дала флуоксетин чтобы блядь ПОХУДЕТь просто какого хуя
1	Пацан-лар Назначили Аатракс ?(вроде 3 раза в день) и паксил вроде 1 раз в день утром. Врроде что то из этого блочит никотиновые рецепторы. Как я буду теперь курить, и будет ли хоть какой то эффект с сижек? или вооббще усилит
1	Есть транквилизаторы, но они отупляют. Нейролептики - нет, от них сначала хреново (но это не опасно), а потом и сон норм, и эмоции выключают, что тоже полезно. В моем случае Кветиапин
1	На прощанье доктор попугал меня ломками после привыкания к прозаку и сменой АД.
1	Поняла, что никакие отхода от веществ не сравнятся с синдромом отмены пароксетина
1	Под прегабалином так классно смотреть на экраны софиты и всякую там подсветку. Просто АЩ.
1	Пароксетин это прямо панацея, жизнь без постоянной тревоги если не сказка, то по крайней мере уже не ад
1	Итак, проснулась, от тревоги всё дрожит, начинаем тестировать местный аналог ксанакса, день первый
1	@ineed_a_doctor_ НЕ НАДО ГЛЮКОФАЖ!!! ОСОБЕННО ЕСЛИ есть шансы на анемию. ИР прекрасно снимается диетой и берберином БЕЗ глюкофажа. От него может очень тошнить и он  блокирует усвоение Б12
1	@vladanrains сертралин -&gt; флуоксетин, оба сиозс. в обоих случаях был небольшой тремор, изменение веса и длительности сна. от флуоксетина была изжога, если пить на голодный желудок. а либидо у меня по жизни низкое но оба сработали, мне больше не хотелось плакать целыми днями
1	О только сейчас дошло почему при метформине не рекомендуют употреблять алкоголь. Алкоголь же тоже снижает уровень сахара.
1	хочу отказаться от паксила потому что появились неадекватные мысли в голове и панические атаки которых никогда не было
1	Пиздец у нас цены на лекарства. Покупаю папке антикоагулянты, без которых при мерцательной аритмии вообще не вариант (риск инсульта и тромбоэмболии). Есть дешёвый варфарин, от которого самого по ходу можно отъехать. А есть современный Ксарелто 2681р за 28 таб. 35000 в год.
1	Понял что сероквель можно использовать как рекреационный наркотик: выпил пару таблеток и спишь видишь сны
1	И, для спокойствия, гикированный гемоглобин. Метформин в помощ, похудеть на 30 кг
1	Зипрекса- полный пиздец. самый сильный нейролептик-антипсихотик. из моего опыта: мне назначил его доктор-ебантяй, думая что у меня совсем пиздец проблемы с башкой. так вот, от ЧЕТВЕРТИНКИ я спал ДВОЕ СУТОК БЛЯТЬ, ДВОЕ
1	В прошлый раз из-за флуоксетина я оказалась в больнице
1	Периодически за день случались такие эмоциональные качели, что Конни-Айленд не снилось Но в целом паксил хорош, держит крепко Без него был бы пиздец кромешный
1	Зачем нужны спиды, если есть венлафаксин? &gt;24 часов бодрствования, полёт нормальный. Т.е. вроде бы и спать хочется, но вроде бы и терпимо.
1	@Melamoryya @Barsa_01_35 так, я зарылся в инструкции по применению и нарыл, что как раз имодиум, не проникает через гематоэнцефалический барьер, то биш на мозг он не действует и да, есть те, кто занимаются таким, но у меня уже мозг не соображает, кто из них😂
1	Сонливость от Сейзара тоже была, кстати
1	Здравствуйте!скажите пожалуйста может ли прием эутирокса быть причиной головокружения?
1	не увлекайся, в штатах тип на отходах от паксила (оригинал венгерской поделки с фото) пострелял домочадцев из ружья и застрелился сам.
1	Баклосан - это зло. Особенно отходняки с него. По возможности старайтесь избегать упарывания баклосаном.
1	Я перестала есть потому что больше не хочется. Флуоксетин пока даёт только этот эффект. Ем потому что надо три раза в день, иногда два. Ещё бы щитовидку проверить и плотно заняться здоровьем и спортом. Тогда может и не наберу обратно вес.
1	я с флуоксетина вообще с катушек слетела и это был пипоц
1	Пила долго золофт, из побочки отсутствие либидо и тошнота иногда, психиатр сказала, что не особо женский препеарат. Сейчас на прозаке, из побочки только тошнит иногда. ТОЛЬКО НЕ ПЕЙ КАЛИКСТА, + 10 кг, не могла понять откуда, хорошо, что психиатр спалился и быстро вернула вес)
1	На чилле улетаю в Чили @ каламбуры от Ксанакса, не переключайтесь.
1	О, бро, золофт это тема. Единственное что даёт мне силы жить. Главное - начинай наращивать дозу постепенно. Оланзапин канеш такое себе, есть и поновее и помягче нейролептики. Ну и ты месяц ещё будешь ходить вечно сонным пока не втянешься.
1	Вот русский флуоксетин хороший, ядрёный, крепкий, выпьешь таблетку, ходишь припизднутый и ебись оно всё в рот, сразу видно русские люди делали.  Не то что бездуховный австрийский, аккуратненький такой, очищенный, чтобы тонкую психику толерантного европейца не повредить, тьфу.
1	Из глаз выветрилась жуть самозахаванности, такая, как у Глебушки на афишах. Это было красиво, но очень больно. *Пока неуверенно* спасибо, тразодон.
1	Ну и отлично. Не помру от повышения вальпроевой кислотой риска суицидальных мыслей, так помру от токсичности ламиктала.
1	Крепист чел! Иди к психиатру, пей паксил, станет проще. Позже появится силы! Думаю, у тебя все получится, сама в таком дерьме живу.
1	Штош, это была максимально отвратительная ночь, еще и голова теперь болит. Будет мне уроком. Из-за этого я собирался высраться очень тяжелым текстом, но я себя пересилил. Без кветиапина очень хуево.
1	я триттико пью, он нетипичный и повышает либидо хихи :D тоже СИОЗС больше не выписывают
1	мама не купила то  что я просила по причине ей лень и теперь я лежу задыхаюсь без сальбутамола 👍👍👍👍😋
1	Приём запрещённых препаратов действительно влияет на когнитивные способности: например амфетамин улучшает умственные способности, его добавляют в адерал, который американские студенты принимают для того, чтобы лучше учиться, а кокаин помогает не уставать и работать дольше.
1	сижу на работе, просто на ровном месте начинаю задыхаться, пшикаю сальбутамолом, не помогает, от этого начинается паника и я начинаю еще больше задыхаться. мне пизда!
1	антибиотик цифран мерзкий на вкус, хожу уже который день как говна поела и ничем этот привкус не убрать
1	короче, когда мне снизили дозу венлафаксина, мне через какое-то время стало полегче. два дня мне было сносно, я даже смогла съездить к полине, убраться в комнате и сделать ещё пару мелких дел. на этом всё, сейчас я опять лежу и от тахикардии в груди жжёт
1	блять моё супердорогое лекарство кончилось 3-4 дня назад а я уже чувствую эту тяжесть в груди слышу хрипы как напряжно лежать даже на боку и у меня НАЧИНАЕТСЯ ПАНИКА ИЗ-ЗА ЭТОГО паникую что мне снова придётся брызгать сальбутамол снова вся эту хуйня не меньше 8 приступов за сутки
1	@daria_calma @proza_c я тоже много лет сидел на эутироксе (синтетический Т4) и при этом имел лишний вес, утомляемость, рассеянное внимание, трудности со сном,  мышечные боли, низкий уровень энергии и т.д.  про то что  моно терапия  синтетическим  т4  мало кому помогает даже при  якобы норм анализах
1	Аххах это как я принимал триттико, меня врач невропатолог спрашивает, вам лучше я говорю нет, она что совсем? Я говорю ещё хуже)))). От них по утрам тяжело вставать оооооочень тяжело.
1	А помнишь Элис как март 2012го просто проспала весь. на прозаке. вот ведь классно было.
1	походу лоперамид сломал мой желудок к хуям
1	я очень плохо тошноту переношу, так что я ламотриджин тупо дропнула
1	1959 -талидомидовая трагедия:беременные,употребляя талидомид, списали своих детей в инвалиды,8-12тыс детей родились с тюленьими конечностями
1	вот пион читал, но не пробовал лично. Сегодня у меня фенотропил с габапентином. Улыбаюсь, планов море, уверенности вагон. К вечеру только притормозило сильно, вырубает спать, надо что-то менять будет. Но весь день бодрячком и с улыбкой :)
1	Есть перестал, прозак криво вставлял, с травой засада Транков нет, сна хуй дождёшься, самооценка ноль, не помогает алкоголь Сознание спутано, бред, друзья беспокоятся, я с ними груб
1	по идее, это всё не норма, но ламотриджин заставляет переставать об этом думать и типа-перестраивать ценности хз то ли повышать дозу то ли не знаю что
1	От лоперамида как раз мазать и перестает
1	Ебашим флуоксетин, клиническая повторная депрессия, класс блять.
1	"далее идет шок инфа про то что ВНИМАНИЕ от передозировки ксанаксом умер лил пип (хотя от какой наркоты он умер непонятно до сих пор) умер макмиллер и ""застрелили рэпера икса""  твит благодарности коле за то что он не сказал про англичанина потому что на русское музло ему насрать"
1	– С чем тебе сделать кофе? – Со снотворным. – Могу только с лопедиумом. – Это чтобы меня так не бомбило?
1	когда пиздецкое воспаление сочетается с подъемом на прозаке, получается странно  покашляла кровью, настроение превосходное
1	я: извините прозак по-моему вреден для меня, мне становится хуже в последнее время, могу я поменять антидепрессанты? психотерапевт: ТЫ ЧТО ХОЧЕШЬ SSRI ОПЯТЬ ГЛОТАТЬ я:но у них сравнительно мало побочек.. пст: ЕЩЁ ОДНО СЛОВО И ТЕБЕ ПИЗДА
1	Если смешать прозак, флуоксетин и велбутрин, а потом запить вином, будет очень весело.  Но вам не советую.
1	После того, как я снова села на прегабалин, пидорасить стало поменьше, но зато стало так тоскливо, что хоть вешайся. Хорошо хоть муж рядом, да еще и свекровь приезжает. Я сейчас как никогда нуждаюсь в заботе и нежности.
1	симбалта/иксель но симбалта лучше именно для сосредоточения и повышения самоконтроля и силы воли а иксель больше просто энергию даёт и ещё делает тебя злым и хорни эз фак так что не наш выбор
1	Новости: с паксила очень хочется спать
1	Раньше фликсоназе, потом пару лет помогал лоратадин обычный, в этом году лоратадин не работает
1	всё же пить пароксетин с утра было так себе идеей. продуктивность низкая, прокрастинация одолела. надо эти два дня доработать в режиме бззз.
1	@InnaShidlovskay смпаю после флуоксетина только больше есть хотелось. + он вроде усиливает суицидомысли и тревогу
1	Смотрю попеременно на лоперамид и суматриптан, представила себя, сидящей на толчке с мигренью и решила просто сдаться на милость судьбы. Будь что будет. Понос позорнее.
1	КУРИШЬ ЧТОБЫ РУКИ НЕ ДРОЖАЛИ ПОТОМУ ЧТО ИЗ-ЗА ПРОЗАКА У ТЕБЯ СРАНЫЙ ТРЕМОР
1	Ребятки, мне реально страшно. Похоже я попал на новую побочку прозака - я всерьез думаю перейти на винду. Пиздец. Всего лишь второй день сидения в kdenlive, а я уже на грани безумных решений. Очень надеюсь, что к утру попустит.
1	вот реально от прозака нехорошие мысли появляются х_х
1	"""Например, модафинил гораздо лучше, чем кофеин, улучшал способность невыспавшихся людей с юмором воспринимать мультики. Однако ни кофеин, ни модафинил, ни декстроамфетамин не улучшили реакцию испытуемых на словесные шутки."" чет насторожился от этой статьи ахах"
1	Вот вроде сижу угараю и все классно Но реветь хочеца будто обожрался ксанакса
1	психотерапевтка позвонила спросить как дела че ответить?нормально проспала под ксанаксом 19 часов?
1	@carolinamoskvi Конвалис, в побочных эффектах головокружение, заторможенность, потеря ориентации
1	«я помню в Краснодаре лоперамид съел. а потом экстази. мне просто плохо было»
1	В тему о беречь родителей. Нашла у матери таблетки «метформин». Говорит, сестра ей дала для похудения. Таблетки от сахарного диабета. С кучей побочек и большой вероятностью отказа почек. Вставила словесных пиздюлей обоим!
1	рано пробудился, однако. триттико - оно такоэ.
1	Вставило от алпразолама я успокоилась но теперь все такое странное
1	Отъехал по работе. После двух капсул габапентина.  Чем выше стресс, тем дальше едешь)
1	я понимаю почему от флуоксетина худеют тебя тошнит так что ты не способна переварить никакую пищу
