1	однако спасибо метформину -4 кг йухуууу уже можно спокойно жрать на нг
0	3 дня🙋👣👣👣 ползу из последних сил - на антибиотиках диклофенаке и удвоенном паксиле. удивительно - никто на работке ни ухом, ни рылом о моём уходе, невзирая на намёки
0	у тебя ракоспид,мой друг  мелкий пиздюк у ксанакса сосал  вот и подохнуть вдруг не зассал
0	Я решила идти в саморазрушении до конца и слезла с венлафаксина
0	привет, пока больше приступов не было, даем габагамму, возможно она и блокирует их, 13 числа по плану поездка в Вильнюс на мрт
0	А ещё дома нет лоперамида, единственного препарата, который с моей тягой все время жрать не то должен быть у меня всегда
0	@suyup_l Ох, Лерок, какой глицин, я на прозаке уже плотняком😥спасибо 💞
0	@Loly_girl @KeyjiShemale Я имею ввиду что угодно, что приведет меня в порядок, легально или нет, не важно.  Фенотропил и прозак поможет?
0	Форадил - лекарственное средство в Москве -
0	завтра закуплюсь ебучим флуоксетином и буду питаться воздухом и колой зеро
0	Немного о прекрасной медицине в процветающей при губернаторе @O_Kuvshinnikov Вологодской области. У мамы приступ астмы, кладут в больницу, тут же просят привезти обычные пульмикорт и беродуал. Нет, говорят, лекарств, совсем Кстати, @volzdrav и зарплат по майским указам нет тоже
0	Я за ним упаду в пропасть я за ним поднимусь в небо я за ним извини гордость я за ним одним я к нему К ПРОЗАКУ
0	дайте мне ксанакса и я уже сдохну
0	@sntriechan венлафаксин. начиталась кучу ужасов про него, надеюсь, меня не затронет
0	#новости Продажа лоперамида в виде раствора запрещена в России
0	Если у вас проблемы со сном, советую купить баклосан, если у вас это получится, конечно
0	Что за бред, сибутрамин продают в Рашке свободно, хотя может там уже давно не сибутрамин.
0	это масштабный психологический эксперимент по изучению деформации личности под внезапно свалившимся оксикодоном
0	@andre_bodro ты еще спроси, что под баклофеном модно
0	От @ilysammy1 Телефон, ингалипт, гексорал табс, кальцемин, алмагель А, эутирокс, хофитол, альбом, карандаш, ластик.
0	@torosenkomax @sashkosha Ипать что? Знач эт ксанакс прост они его замаскировали🤔
0	дозировка оланзапина и вальдоксана, на ночь аминазин помогают поверить, что каждый человек заменим. новый день даст по печени и за спиной заломит руки, как мент. убивая мозг, кроша прошлое на бессмысленные фрагменты.
0	Иди еще однажды обожрался элькарнитина, уснул, пердел и просыпался от этого. От лоперамида отказался, герой хуев.
0	бггг в аптечке есть лоперамид, если что))
0	"@cursivanovo Что-то странное творится с закупками лекарств для диабетиков! Уже 2 месяц в 7-й пол-ке не выдают ни Галвуса или Янувии! Не закупили!-отвечают в Департаменте.Почему? А как быть больным? Ведь цена на эти препараты в аптеках очень ""кусается""! На пенсию не купить."
0	Заменять прегабалин чем-нибудь другим -- это всё равно, что ебаться с кем попало.
0	Предпочитаю суровые нейролептики. Но прозак доступнее без рецепта.
0	@_easterly_wind_ @B2Bwld сроки проверили сразу, печенье и так съели бы, но просрочка поразила. За Лоперамид в курсе, но он не панацея.
0	Мимо остановки,где я кормила Краснова баклофеном,мимо моста, где мы целовались впервые,мимо заправки шелл,где баклофен подействовал.
0	эх сейчас бы ксанакса и селедки под шубой, ууухх
0	ксанакс с кровью на губе синяки на ребрах, смерть, запрети мне полететь я убью твой паритет
0	Можно просто разрешить вентолин и здоровым принимать, но это запрещено. Это не аргумент? Или почему запрет есть? Уравнять шансы, так всем! Нет?
0	одно из хуевых последствий смерти бати, на самом деле, то что ради адвила, аддерола и оксикодона мне придется общаться с племянницей живущей в хьюстоне (или молиться, чтобы у брата были рейсы в сша).
0	Л-ЛСД Г-Героин Б-Бупренорфин Т-Тебаин Тег еселф так сказать https://t.co/2qHk0OQKEp
0	Когда в меня вселяется религия, я её ИМОДИУМОМ лечу. 2 капсулы -- и через 20 минут ты атеист!
0	– алло? пачку алпразолама размером с Саратов, пожалуйста.
0	эх ща ток пульмикортом подышу и спать
0	В 2018 с паксилом - единственный препарат, который мне упорно возвращают.
0	У меня хронический бронхит, ну, пока сальбутамола хватает  (,но что же делать людям без Эреспала? !! https://t.co/2koMIyjZLv
0	Моё здоровье - Отмена Адепресса и Депакина хроно, слияние сна и реальности,
0	ща бы флуоксетином закинуться но мне его так и не продали
0	#Экселон - родственники воют, что дорог и нет дженериков.
0	Тамифлю - единственный препарат с клинически доказанным эффектом. Все остальные кагоцелы, амиксины и тд доказанного действия не имеют.
0	я хз как вы, но по мне XXX пизже ваших Пипов отъехавших от ксанакса, вот его рил жалко пизда
0	Если речь о Ксанаксе, то тогда за кем основа?
0	былой вкус перкосета скоро найду для тебя
0	Кофеин состоит из углерода, водорода, азота и кислорода - так же, как и кокаин, талидомид, нейлон, тротил и героин.
0	на работе угостили четвертинкой алпразолама, вот это норм, вот это я понимаю, не то что эти всякие печеньки, пироги и шоколадки
0	пил бы в школе прозак - уже б шутером был, а тут чот как-то
0	На фоне всех этих эмоциональных скачков пытаюсь вспомнить, выпила ли я сегодня хоть 100 мг ламиктала.
0	Всем привет, ищу людей у которых есть рецепт на Вентолин
0	блять потолстел из за ебучего оланзапина
0	Юля, забери меня в Питер. я буду кормить тебя баклофеном, а ты будешь сосать мой песяцки
0	А как вы Кошелева разговариваете на приеме? И отказываете в получении лекарств,нам уже все обьснили что вы поступаете незаконно когда отказываете получать льготное лакарство форадил комби ,который невыходил из льготных лекарств!!!!!
0	Проверяю работу паксила, читаю лену миро, жду выбесит или как. Не только не бесит а прям захватывающий проект. Интиресно среди этих мужиков есть хоть одна лена?
0	"Итак,давайте разрешим вопрос: что говорит Техник в песне ""Xanax"" между фразами ""нужен ксанакс"" и ""или игра с самим собой"""
0	хочу ксанакс перкоцет оксикодон прометазин кодеин
0	По-моему, об этом вещал ему Майкл Мур в своих фильмах и обозначал население штатов, как прозак нейшн!
0	Окай. Можно считать, что 2018-2019 годы - годы, когда я научилась получать удовольствие. От разного. И да, как ни крути, с приёмом флуоксетина это никак не связано. Началось всё чуток раньше.  А вот с приёмом алко - вполне возможно, блин. &gt;&lt;
0	"Писал трактат о разнице понятий ""любовь"" и ""влюбленность"" и плавно перешел на объяснение эффекта от СИОЗС (типа Прозака)"
0	Продюсер “The Apprentice” совсем недавно рассказал, что Трамп на аддерале сидел очень плотно; таблетки он раздавливал в порошок и занюхивал его через трубочку как кокс
0	встретила новый вид человека страдающего: жалуется на моральное давление со стороны девушек в отношениях, говорит, что псих, рассказывает как зависим от ксанакса и своего психолога, хвастается своей депрессией.  хотелось ему пощечину влепить, я же просто пива хотела попить.
0	нормотимик и антиконвульсант ламотриджин под македонской торговой маркой сейзар разбавлен таким количеством подсластителя сахаринат натрия и черносмородинного ароматизатора что никакой вольчек не нужен
0	перестань дружить со мной, я тебе не подхожу, потому что мы с тобою ходим к одному врачу поцелуй меня покрепче мы по космосу летим не влюбляйся в меня сильно — это всё флуоксетин
0	@daria66li я как раз на эутирокс на подделку наткнулся и 3 месяца потерял попробуй может лучше тебе от него будет
0	Ксанакс(первое что в голову пришло,простите)
0	Боюсь, что скоро понадобится баллончик сальбутамола.
0	– завела дружочка галю  – ламотриджин – роаккутан (хоть и дженерик) – стала заказывать серёжки и смешные носки на алике – купила вэнсы &gt;
0	Случайный факт: Кофеин состоит из углерода, водорода, азота и кислорода — так же, как и кокаин, талидомид, нейлон, тротил и героин.
0	вообще никогда не имел дела с питомцами, полезный опыт наверное (подготовил зиртек и сальбутамол на всякий случай 🚑)
0	я тоже постепенно отвыкаю от таблов. Теперь атаракс+паксил пью раз в четыре дня
0	Люблю вкус габапентина с кофе по утрам
0	Музыка, комиксы, винище и бэй - лучшие антидепрессанты после Паксила
0	но что если я уже сижу на ксанаксе семь лет..
0	Это значит, что придется прощаться с прозаком и велбутрином, а я не могу без этих ребят. На диете сидеть потом. Вино нельзя. С пузом на шугаринг, наверное, как-то не удобно идти. Зарасту😂 Хорошо хоть сиськи не отвиснут - нечему😂 И что потом вообще делать?!
0	@Natalya57_57 Метформином в мегадозах рак уже давно лечат. Сейчас терапия будет намного более эффективной.   @IngaZaionz
0	что-то у всех тусы какие-то, а я соло баклофен упарываю и мне пиздец
0	Поэтому путь к микрофону им прокладывают ксанаксом и хлебными крошками
0	#Томск : Мне нужно купить флуоксетин без рецепта
0	@ChuwaJY О боже((и никакой помощи?( сальбутамол не помогает? Тебе нужно хорошее обследование, может даже не в твоем городе
0	Хватит, мать вашу, хватит! Сальбутамол РАЗРЕШЁН https://t.co/zlKInl5Tr3
0	и его внук, ламотриджин, который польский только на треть
0	хочу утонуть в море таблеток прозака
0	Женя, мы ждём песню про баклофен @caltovka605
0	Я что-то вот готовлюсь, что завтра на алаи буду рыдать как сучка, ПОТОМУ ЧТО МОЙ ПАКСИЛ НЕ РАБОТАЕТ БЛЯТТ!!!!
0	А спонсор моей уверенности на экзаменах - лоперамид. Лоперамид - вагус, ты заебал!
0	все бы сейчас отдала за один пшик сальбутамола.только.один.я же умная,я же думала он мне больше не понадобится.люблютехкоголюблю в случае моей смерти
0	Тразодон часто используется не только как антидепрессант, но и как транквилизатор и снотворное средство. Его рассматривают как препарат, способный заменить атипичные нейролептики для купирования возбуждения и агрессии при болезни Альцгеймера.
0	я от алкоголя плюс прозака не умерла значит все можно
0	Лента,а я теперь не одинока. :) Моё счастье дарит мне расслабление желание дышать. Люблю тебя,моя любимая. Люблю тебя,алпразолам.
0	О каком здоровье и выделении денег у вас говорится если мне лично таблетки не дают эутирокс, и пожаловаться некуда. а как в казахстанской армии служить и вас защищать дак приди долг отдай, а как мне нужна помощь, вас никого нет. теперь уж и меня для вас не будет и хочется уехать
0	ФЕН ФЕН БАКЛОФЕН В ИНТЕРЕСНУЮ ИГРУ А ВКАКУЮ НЕ СКАЖУ ОТГАДАЙТЕ САМИ КОТЭ ПАЛЬЧИК В ПОПКУ НАЛИВАЙ ГЕЛЬ
0	"На Зипрекса мне дала рецепт глав. врач, чтобы избавить меня от головных болей и ""псевдо-галлюцинаций"" в виде Василия, который мучает меня уже больше полугода. Психологи не помогли толком, они лишь его заткнули зачем-то. Ну надеюсь хоть Зипрекса поможет. Мне их и так задаром отда"
0	В Канаде во время хоккея рекламируют audi r8, у нас сеалекс. Вот и вся разница.
0	@VRSoloviev Владимир добрый день! Вы можете еще раз сказать Ваш рецепт против гриппа. Тамифлю,парацетамол и витамин С /порошок/ как пить? Спасибо большое.
0	я бы угарнула, если бы была реза про запрет ксанакса, кодеина, и прочих запрещённых препаратов.
0	Так паксил тоже должен был, вроде как. А где? А что? Я что-то в шоке и наставила себе уже диагнозов.
0	Также не рекомендовано принимать кветиапин вместе с грейпфрутовым соком.
0	Ля поцаны Подгоните лоперамид Или как там его Ибо хуйня жизнь
0	Тогда Беродуал или Спирива Респимат твои вечные спутники
0	Ну только если это не паксил какой-нибудь. Мне кажется, он вроде по 148
0	@Lenorka_LA Ксизал, Эриус, Зодак В нос Фликсоназе
0	Сектант - мой личный сорт флуоксетина
0	мб и леволет, я не знаю :((((
0	Ладно хоть пульмикорт не дорогой
0	@ThistleArts Спорить и не собирался. Интересно было почитать ваши наблюдения. т.к. сам с аит но лёгкой формы, часто болел, отеки, ТТГ 4,5.  Потом 0,25 эутирокса, вот уже лет 7. Регулярно сдаю ТТГ, УЗИ щитовидной и консультации эндокринолог.
0	кстати тут довольно часто упоминают прозак сижу каждый раз ))) привет 2016 )))
0	иммуноглобулины для гепатитов внутривенные при экспозиции не менее 4 часов ввода в вену и слабенькая эффективность 2 дорогущих противогриппозных(осельтамивир и занамивир), that's all, folks
0	Таблетки таблетоньки таблеточки осенний набор флуоксетин подешевел
0	"Мне прописали ""янувия"" - помогает"
0	Вместо Сеалекса гимн России! #РоссияЧерногория #EURO2016
0	не знаю, что делать, когда закончится баклофен, снова идти к неврологу и ныть, как мне больно или может уже на МРТ сходить, а то я не верю, что там все ок, я же Мелман
0	Кофеин состоит из углерода, водорода, азота и кислорода - так же, как и кокаин, талидомид, нейлон, тротил и героин. #интересно
0	Выбирала между паксилом и бухлом на вечер с всякой закусью. С трудом выбрала таблетки и невъебенно горда собой
0	А ты перестала пить прозак или прямо с ним?
0	Если у вас СРК (итп), то лучше попробовать Феварин, эффект от него лучше и после курса ещё действует, в отличии от Флуоксетина, который имеет много побочек.
0	когдца вацан использует сеалекс а что а вдруг
0	Ну все, ей пизда пришла. Как оказалось она не в первый раз такое делает и реально убивает поддельным ксанаксом людей. Американские фаны уже нашли ее домашний адрес и скинули его в полицию. Я надеюсь, что она получит своё
0	а у вас не будет сигареты? а вы идёте на пасош? я 10 лет употребляю наркотики будем кричать баклофен и найдёмся ГРУСТНО
0	надеюсь мне пропишут оксикодон чтобы умирать от рака было не так больно
0	Это я тогда ещё не знала, что мечтаю ещё и о новых часах. Прозак мне!
0	Да прибудет с тобой лоперамид
0	Читаем старика и море Увлекателнооо Блин скорей бы уроки закончились и я поеду с Таей за флуоксетином
0	Чтоб напиться нам в говно, Нужны веселые таблетки.  Такие есть Третий список нарк. Вещ.запрешенных в Рашке. Алпразолам
0	Поколение прозака. Как от нас скрывали правду об антидепрессантах — Сноб:
0	Поставка лекарственного средства Эзомепразол #tender
0	Я пробовала что-то порядка десяти разных антидепров за эти 8 лет. И остановилась на прозаке просто потому что дёшево. Хотя не помогло мне нихуя, от флу хотя бы не хуже. А остального я даже названия забыла как страшный сон.
0	Порекомендуйте, пожалуйста, хорошего врача-эндокринолога. И еще, кому назначили Эутирокс? Ваши отзывы. Спасибо. / #врачи@nashebutovo
0	"""Когда-нибудь я достану пачку флуоксетина и больше никогда не появлюсь онлайн"" © @ksen_koko"
0	6. но, к сожалению, не во всех регионах эти препараты активно используются. многим пациентам при неэффективности метформина (основа основ лечения диабета) до сих пор сразу предлагают инсулин
0	Хочу опять стать тупой и питаться только флуоксетином Эх, хорошие были времена с Настасием, кофе, проебыванием уроков и игральными картами
0	угадавшему, где неправда (2/5) - сладкий сюрприз в дм  — десять лет не ношу стринги  — не пробовал стимуляторных ПАВ сильнее флуоксетина — говорю о себе в м.р. ибо в душе мужик — никогда не сидела на лице — имею в анамнезе 6 закрытых ЧМТ
0	не знаю, насчет ксанакса, но нейролептики - это пиздец определенно, я решила, что не буду их пить)
