1	однако спасибо метформину -4 кг йухуууу уже можно спокойно жрать на нг
1	читаю тред про рпп хм почему худеющие челы так тащатся по флуоксетину он же наоборот убирает всякие навязчивые состояния
1	На самом деле флу притупляет аппетит, но очень хорошо выравнивает настроение и нет таких диких скачков, как раньше.  Когда я перешла с пароксетина на флуоксетин, мне стало намного лучше. Я почувствовала себя живой и нормальной.
1	Принимая, например, прозак очень сложно заснуть. Пять месяцев почти провел на снотворных. Потом почему-то отпустило
1	и до лета надо похудеть поэтому мкц и глюкофаж снова будут помогать😊🙏
1	Чувствую себя Элиотом который под аддералом 8 суток не спал мне необходимо как минимум 8 часов здорового сна
1	почти не долблю велаксин все ещё ловлю пиздецки странные и реалистичные сны
1	оксикодон, но от оксимирона меня тож блюёт и не помогает боли, так что одна хуйня?..
1	первые несколько дней на велаксине все было как и до него на прозаке, и тут В КОНЦЕ РАБОЧЕГО ДНЯ МЕНЯ НАКРЫЛА, добралась домой не помню как
1	Я поняла, это отсутствие паксила. Я как белка-истеричка щас, кидаюсь в разные стороны и везде ОХУЕННО (кроме Собчак)
1	сука, вот читаю про лечение своей биполярки. прием венлафаксина год и более создает 35% вероятности перехода в гипоманию я пью уже год, и где она блять я ее очень жду
1	Дилемма Либо попшыкаться с сальбутамолом и уснуть, но с вероятностью опять проснутсья (50:50) при этом мне станет хуже когда проснусь и вообще лимит исчерпан типа либо просто лежать до утра но пиздец воздуха не хватает короче
1	@comrade_wolgast Мой психиатр очень критиковал назначение мне флуоксетина после подростковой попытки суицида. Говорил: «Серьезно? Назначать препарат, который вызывает самое выраженное усиление суицидальных тенденций?» Но мне норм с ним было, убить себя больше точно не хотелось.
1	Ух, если понижение дозировки алпразолама так тяжело даётся, что же будет после отмены через неделю
1	я приняла тогда 1табл.метопролола,полтаблетки веропомила.У меня начался сердечный приступ(у меня порок сердца,надо индивидуально подб.лек-ва
1	@nappo_what Флуоксетин вместе с атараксом(успокоительное) Первую неделю спала как не в себя, а итоге режим сломался от слова совсем, отсюда пошло ухудшение и мысли о суициде, все это время ощущение, будто ты - не ты, не могла понять, где мои эмоции, а где химия мозга
1	@modern___myth алпразолам (но если слезешь с них, то, возможно, единственное живое, кого тебе захочется убить, будешь ты сама)   З.Ы. - а ещё на него нужно рецепт :(
1	Ладно бы просто грустненько_тм было как это обычно бывает, но тк это дешманский адепресс, отходняк начался сука физический, я будто каждую секунду катаюсь на вертелке, а потом блюю, спать толком не могу, голова болит пиздец я овощебаза короче
1	хочешь спать - не можешь до 4 утра, хочешь позалипать в какую-либо хуйню в два часа ночи - рубит как на отходах от ксанакса
1	Длительный прием антидиабетического препарата может привести к увеличению сахара в крови Антидиабетический препарат лираглутид является инкр
1	Объёбаный от ксанакса лежу на заднем сиденье
1	Первый: кветиапин Северная звезда, 25мг. Доступность и цена: 9/10, действие в сравнении с оригом: 8/10, побочки в сравнении с оригом: 2/10. Ты хочешь спать и на ориге, но только на этом дженерике у тебя галюны (ты должен бороться со злом, а не стать им) и крючит (не акатизия).
1	Я на амбулаторном этапе этим занимаюсь. Антидепрессанты (лучше венлафаксин, я думаю, чем СИОЗС, снижающие аппетит), нейролептики не люблю, но иногда без них никуда. Режим набора веса крайне аккуратный нужен. Личная и семейная терапия точно нужны, но не все готовы на это.
1	Кветиапин почему ты так жесток ещё только 22:45 можно пока не засыпать пожалусто
1	кветирон хорошо рубит с 50 мг но он по рецепту
1	из-за флуоксетина катастрофически не хочется что-либо есть, но почему-то БЛИНЫ ИЗ ТЕРЕМКА в меня влезают всегда  Теремок, спасибо что живая
1	Это флувоксамин! Другой препарат и стоит в десять раз больше флуоксетина :( Я сама думала, что вот Грандаксин мне не нужен, потому что ПА у меня прошли, но врачиня сказала принимать. Возможно, у меня и правда тревожность, просто я уже не замечаю, что можно по-другому.
1	Годные таблетки (венлаксор). У меня вначале от них было сердцебиение, расширенные зрачки и головокружение, но через три месяца они начали работать по назначению. Не бросай, если что, слишком рано. It takes time.
1	Обманчиво-приподнятое настроение из-за флуоксетина, хочется всего и сразу, но под всем этим сквозит лютая подавленность
1	нет, простите, мне нужно это написать &gt;по результатам постмаркетинговых наблюдений оланзапина были зафиксированы случаи внезапной смерти
1	Судмедэксперт почти не ест. Гэвин сам не страдает переизбытком аппетита, в основном из-за флуоксетина, но систематически берет кофе и какую-нибудь булочку в кафетерии. Ричард берет только чай. Обед, как Рид узнал из сплетен стажерок, тот тоже не носил. И жил на чае с 8 до 20.
1	"@crazy___fan Я каждый день забываю ""Тафен"" капать, придётся что-то с этим делать.  А вот ""Ирифрин"" сука поганая, ужасно жжёт глаз((("
1	@_Avalanche__ вот-вот после пары таких ночей я решила купить флуоксетин(создание дьявола) спустя три недели (тк накапливается в организме) из-за неправильного приема им же и передознулась после чего стала каждый день падать в обмороки😃 итог: поставила рекорд 7 обмороков за день😎😎😎
1	приступ начался из за вентолина но без него я не могу дышать от спазмов выбирай стул так сказать
1	Кроме того, что высокие дозы прозака порождают проблемы со сном и стимулируют криповые сновидения, ещё они выводят режим сна в такое тонкое состояние, когда все эти сны хорошо запоминаются. Идеальнейше.
1	да я за 6 лет много чего пережрал, последний раз кушал спитомин, гидроксизин и прегабалин поочерёдно. апатия только усиливалась, ничё не делал &gt; ловил неврозы от этого и самобичевался как мог, замкнутый круг. без них я щас ошалелый, но хотя бы дееспособный :'^)
1	Никогда Слышите Никогда не пробуйте жевательный лоперамид в таблетках, я не знаю что там в составе, но я блевал дальше, чем видел
1	опять начала тафен, опять восхитительные ощущения разлитой в носоглотке кислоты
1	Опубликованы результаты сисиемных наблюдений по ингибиторам протонной помпы.  У принимающих препараты этой группы (омепразол,эзомепразол, ланзопразол) существенно увеличиваются шансы на развитие тяжелого поражения почек https://t.co/Zks9xCYCxW
1	ципролет и за 4 дня всё проходит. если горло, то фурацилин. а ломка это просто симптом, ничего не поделаешь. не умирай, Ань.
1	Или это ипохондрия, потому что дозировка того же кветиапина маленькая, не сотка же, хотя под соткой я бы спала сурком и не возникала. А так я не сплю, не ем, злюсь на кота, слышу звуки и чувствую запахи, что тоже бесит
1	У меня такие странные мышечные ощущения от паксила кстати бывают. Может у феназепама тоже бывают такие побочки
1	@FeelinaZ А ксанакс имеет моментальный эффект? Я ещё злюсь, что тот же феназепам не сразу помогает, эффект через несколько часов, когда уже не надо (а ещё хуже когда на работе накрывает, и хер ты что с этим сделаешь) Ну а в целом, лучше, когда хуево, перебрать с АД, чем повеситься))0)
1	65. на флуоксетине я сбросила ~7 кг. вес не вернулся до сих пор. совмещала с шоколадной диетой. не советую, но результат держится
1	до сих пор помню, как плохо мне было от хлорпротиксена, хотя это всего лишь нейролептик, как и оланзапин;
1	из-за сероквеля худею с немыслимой скоростью, из-за **** толстела. что со мной блядь не так
1	еще про побочки. когда я принимал оланзапин мне нужно было получить банковскую карту. мне пришлось перевыпустить ее ТРИЖДЫ, потому что я забывал пинкод и забывал куда записывал пинкод. а однажды я даже забыл свой адрес.
1	Я то надеялась на сонную ночь а все вокруг бабки бегаю доктора шилом в жопу тыкаю шоб лечил додумались что это метопролол с аминозином дали такую гипотензию
1	с флуоксетина спать тянет хоть с чем то ты помогаешь
1	*закинулся ксанаксом и смотрит телепузиков на потолке*
1	Смотрела недавно видос одной девушки, которая говорила о флуоксетине Мол, да, сначала помогало, а потом ей стало ПОХУЙ КОНКРЕТНО НА ВСЕ Что бы ни происходило. Абсолютно.на.все.
1	Венлаксор закончился вчера утром, я сутки без лекарств, и меня уже трясёт, рычу на всех, как в самый худший ПМС в жизни.  Это что, я до венлы всегда такая была? 🤭🙈🙈🙈
1	сегодня ко мне на работу приехала скорая сейчас я засыпаю под алпразоламом в куче своего мусора жизнь прекрасна но у кого?
1	От Паксила вроде сорок и набрал, и либидо на нем нулевое было, да
1	Сертралин это всё-таки новое поколение сиозс, пароксетин и флуоксетин это пиздец какое дно при тдр. У меня тупо начинается вегетативный криз с него и панические атаки лютые на ровном месте. Даже с одной капсулы в минималке.
1	Послезавтра защита дипломного проекта. Сдам я его конечно на пять, я же охуенная. (накачаюсь ксанаксом чтобы не умереть от паники публичного выступления)
1	Мониторьте своё состояние внимательно, Саша, что не так - сразу к врачу. Иногда АД меняют. (По себе знаю, от Венлафаксина эпично блевала, не смогла пить.)
1	Побочки метформина — это такая дрянь, уважаемые, что у меня даже приличного слова не находится. Лежу, дышу, пытаюсь не сильно умирать.
1	у меня ночью был приступ от него и пришлось снимать сальбутамолом, я не уверен, что мне подойдет из-за БА
1	Впервые 50кг без фена и флуоксетина! Похудела на чистом стрессе и нервах Хвастаюсь, потому что могу
1	Я так натриггерилась,что мечтаю о новом рецепте на рекситин,чтобы меня не ебашило
1	От антибиотиков очень клонит в сон. Хуже кетилепта, блин.
1	@tataustini если переборщить с ксанаксом, то можно «словить» кайф паша техник в этом шарит (репер такой есть)
1	дома истинный лазарет: у одного кота температура 41 и 8 лекарств каждое утро, второй хромает на обе лапы после 3 дней уколов ношпы и вообще плотно сидит на габапентине, а меня укачивает до блевотни и темноты в глазах каждый раз, когда пытаюсь дойти хотя бы до ванны.
1	можно, конечно, но бензодиазепины и кветиапин меня по крайней мере вырубят
1	Я всегда сплю на матрасе флуоксетина
1	Я начинаю процедуру выползания из дома. Флуоксетин закончился, а без него такой откат будет, что вообще в овощ превращусь.
1	Начала пить таблетки и готова прямо сейчас умереть от этого сейзара. Адские побочки, просто потрясающе.
1	кветиапин обманул меня чтобы набрать классы я всё ещё не могу спать и вижу во сне всякую поебистику
1	спрашивает зачем тебе нужен прегабалин  говорю побочные у меня от ад были в виде судорог он говорит ОТ ТВОЕГО АД ТАКОГО НЕ БЫВАЕТ  бич????? скажи это моему организму И графе побочек в инструкциях
1	Скомпенсированный сахарный диабет, пьёт Глюкофаж лонг: 750 мг 1 табл. Сосуды пролечивает систематически.  Плохая работа ЖКТ, частые диареи, в последнее время по утрам тошнота, до рвоты.
1	@_alekseyt @dsyabitov тогда уж лучше Лоперамид. Мягче, действует быстрее. Фталазол пока перекроет все кусты пометишь. И потом запор на 3 дня
1	Да флуоксетин, т.к. от него аппетит уменьшается и он дешёвый
1	Кветиапин. Нейролептик. Убирает абсолютно все эмоции. Им даже кормят американских солдат, чтоб ничего не чувствовали. Достать можно лишь по рецепту от психиатра/невролога. из минусов- набор веса и пиздец какие странные сны
1	Прозак заебись, меня не бесит работа, переносится отлично - как будто просто обычная я, но меня ничего не раздражает. Единственное, что нифига он не стимулирует, спать охота олл дэй, из-за чего приходится пить много много кофе.
1	как флуоксетин начала пить так и не было как перестала два дня назад так и хуево постоянно но дольше чем две недели его нельзя пить
1	М! Кстати. Поздравьте меня. Я спала сегодня четыре часа подряд. А потом ещё три подряд! Спонсор этого - кетилепт. Кетилепт - жесткий транк для лечения шизофрении и биполярки, которых у меня нет.
1	Сменила нейролептик с эглонила на кветиапин и ко мне вернулась чувствительность. Половину утра неистово мастурбирую и радостно ржу после оргазмов
1	Не пил паксил 2 дня, начало сильно потряхивать,  как пьезой в суставы,  выпил одну, и чувствую как переть начинает, а что если её заюзать?
1	в самом носу. Можно пить обезбол для зубов, но саму проблему это не решит. Для носа капли только стероидные как-то помогут, с флутиказоном, но их больше месяца капать не рекомендую, ибо привыкание вызывает и нихуя не помогает :с
1	ДА ПОЧЕМУ Я НЕ ЕМ НО ТОЛСТЕЮ  КВЕТИАПИН Я ТЕБЯ НЕНАВИЖУ
1	«БАКЛОСАН ПОЛНАЯ ХУЙНЯ, КОТОРУЮ НЕЛЬЗЯ КОНТРОЛИРОВАТЬ, ОТ КОТОРОЙ ПРОТЕКАЕТ КОЛПАК, ЕСЛИ НА НЕЕ ПОДСЯДИТЕ ВЫ В ФИНАЛЕ: ОКАЖИТЕСЬ В ПСИХУШКЕ, ПУСКАЯ СЛЮНИ.., С ОРГАНИЧЕСКИМ ПОРАЖЕНИЕМ ГОЛОВНОГО МОЗГА И ВДРЫЗГ РАЪЕБАНОЙ НЕРВНОЙ СИСТЕМОЙ!!!!!»
1	помню самое клевое и самое стремное одновременно было на прозаке я тогда похудела до 48 кг и не могла ничего писать вообще никак
1	Судя по моему ебаному самочувствию, снижать дозу оланзапина не стоило.
1	@Alexxxjaster Эутирокс давал мне нормальные анализы  какое-то время,  но оставались симптомы. Потом приходилось повышать. Постепенно с 25 у меня доза выросла до 100. При этом самочувствие ухудшалось.
1	Назначали алпразолам, превращалась в довольного овоща, думала НУ ЗАЧЕМ ТАК, но одновременно на все тааак чудесно пофиг, что немного страшно.  Оказалось, что ксанакс и есть алпразолам, я модная. Бгг.
1	"54. кстати, индивидуальных побочек может быть больше, чем вы думаете. никогда не знаешь, окажешься ли ты в том самом ""очень редко"" или нет. потому что далеко не всех так колбасит и убивает с велаксина или того же депакина. и никто тебя не застрахует."
1	В если сильные,невропатический боли?И стягивание кожи,нечувствительность полная..ноги в ступне,она сама не поднимается? Что делать?8 мес на габапентине или прегабалине?И по другому никак?
1	блин я вот думаю  в прошлом году я пила кветиапин депакин и ципралекс и от чего-то из них дико рубило спать буквально через 30 минут после принятия  и это невозможно было фиксить но эти 30 минут до отключки превращались в ужасный неконтролируемый психоз и ненормальную истерию
1	никакой флуоксетин не поможет такой долбоёбке как я нахуй я его пачками жру толку ноль
1	Когда ты принимаешь а/д. Ты не замечаешь их действия. Ты пьёшь и пьёшь, а потом думаешь нафиг я их пью и так все вроде прошло. А это они подействовали просто. Привыкание и отмена это у комплексных а/д типа паксила. Их параноикам прописывают.
1	а имодиум - это это могучее заклинание, снимающее поносное проклятие
1	@Jas_Jase Да психотерапевт!  Паксил антидепры, начиталась отзывов- от него все толстеют и становятся овощем фригидным  Боюсь пить
