0	*that awkward moment when a guy accidentally pulls out your nuvaring
1	ципролет и за 4 дня всё проходит. если горло, то фурацилин. а ломка это просто симптом, ничего не поделаешь. не умирай, Ань.
0	symbicort is a steroid. it and spiriva give me some relief. not much else i can use. breathing is mandatory
0	my nicotine, my blue dream.
1	"""широкую известность в США получили случаи суицида и других видов агрессивного поведения на фоне приёма флуоксетина""   агрессивный суицид"
1	whoa, on the topamax?! the saphris is what causes my nighttime craziness (haha), topamax cuts off the cravings, keeps me in bed
0	guess i should take this trazodone the dr. gave me ... hate prescriptions ... but need sleep
0	omg the tamiflu commercial is . lol. i need a nap for i start hanging with the cuzins. happy thanksgiving
1	Во первых надо исключить нагрузку недели на 2, пропить противовоспалительные, если финансы позволяют лучше коксибы, наружные нпвс мази, физиопроцедуры делов-то? Ну и миорелаксанты, миловали или баклосан, с последним аккуратнее, говорят может давление завалить
0	Там слишком много побочных эффектов. Впрочем, всё равно лучше, чем прозак.
1	two weeks back on paxil. i have no more depressed thoughts or feeling ls but i also have no feelings at all again.
0	bird canyon vineyards brings together pungent tofu essences and a piquant albuterol essence in their pinot grigio.
0	go purchase some cymbalta.
1	am in the morning still awake valium didn't work subone still not working unproductive lame and boring and somebody gas a free buzz super
0	is putting prozac in someone's coffee a crime? asking for a friend.
0	"there was a time when tysabri was the thing for all autoimmune diseases. ""safe as aspirin"" it was, until it wasn't"
1	that is what my neurologist thinks too. he is eert on longevity. i take lipitor. violently allergic to crestor
0	con ventolin doc?
0	just realized i missed my daily dose of aubagio yesterday. not being at home, my routine was interrupted. at least i remembered today's.
1	oh, that's all. i remember when they took me off geodon and i slept for three days.
0	depression hurts... cymbalta can help.
1	im diabetic - i was on metformin since and had this yr b taken off it harmed my kidneys. i am on meds for diabetes now only diet.
0	a buprenorphine condition certainly would have been a very interesting addition to the trial!
1	cymbalta makes me thirsty to the point where my mouth is painfully dry. it feels like the sahara desert in my mouth.
0	i gave up when she recommended levofloxacin for someone admitted with seizures
0	court papers show lisa bought hydros, oxycontin, oxycodone in mos b4 death.she worked as crit care nurse while
1	yeah i know, i dont take my trazadone at night cause it makes me feel groggy in the morning and i wont wake to my alarm):
0	i take synthroid &amp; will have to do so for the rest of my life. i already feel like i have lots of energy.
0	the words competitive, effient and profitable is really repeat of same word, which included in there, profitable,
1	elderly, diabetic on olanzapine= raging bm's, mood swings and weight gain...cons may outweigh the pros..
0	and thalidomide was supposed to be a wonder drug. ah, if there was only integrity in marketing. ops.. another oxymoron.
0	and i of you. *bitch-slaps meridia with all of her clawed hands, leaving violent gashes across her face* //it's only fair//
1	i have been on enbrel, remicade, and simponi. enbrel didn't work well enough for me.
1	smh. lmao paxil was my first, i just stopped effer (the headaches were a nightmare)
1	the only things i know i'm allergic to are sulfa drugs and ciprofloxacin.
0	delivers the addictive drug nicotine and is at least as toxic as cigarette smoke
0	unfollowers hurt, cymbalta can help
1	fosamax and osteonecrosis of the jaw
1	очень люблю нечаянно пропускать прием прегабалина а потом удивляться что ж мне так хуево
0	"""как"" тут излишне, и это не первый такой эксперимент. Забужко отмечала, что история с Тамифлю и Тимошенко - из этой же оперы"
0	depression hurts, cymbalta can help
0	$arna if u guys dont know the side effect on chemical of fenfluramine + phentermine = do research on this topic folks - u will see why!
1	"sildenafil in high doses reported to have caused blindness - no wonder people always say ""love causes blindness"""
1	rt : what i lack in money and personality, i make up for in paxil induced impotency
0	ща бы флуоксетином закинуться но мне его так и не продали
0	although it would prob be cheaper for mcdonalds to give out atorvastatin
1	pain mess don't work i take mg oxycodone every hours plus lots of neurontin and valium and ativan it all does nothing
0	sterile water and geodon!
0	Новость, на которую всем похуй: наконец-то мои волосы выпадают в пределах нормы. Да здравствует левотироксин, железо и витамин D.
0	apixaban - mg bid, wait -30 hrs from last dose; next dose -6 hrs after; extreme caution due to lack of eerience.
0	no way possible i couldve failed that math final i studied for minutes and popped an adderall plus it was easy das a good trio right ther
0	what tf meridia
0	it's so painfully embarrassing how bad i've got at guitar hero i used to be like slash now i'm just as bad as a thalidomide
0	Жизнь штука сложная и непредсказуемая, лоперамид должен быть по рукой
0	Врач сказал, что щитовидку мою надо выкинуть на помойку и посадил на вечный курс левотироксина. Заебись.
0	fantastic, as usual. i see you've been busy with your vampires brother. how is meridia handling it?
0	В таких случаях эндокринолог советует какое-то время принимать Метформин по 1таблетке на ночь.Эти таблетки корректируют метаболизм.Дозировка 0,5.Движение,диета,движение,таблетка на ночь.Может вес пойдёт на убыль.
0	"@cursivanovo Что-то странное творится с закупками лекарств для диабетиков! Уже 2 месяц в 7-й пол-ке не выдают ни Галвуса или Янувии! Не закупили!-отвечают в Департаменте.Почему? А как быть больным? Ведь цена на эти препараты в аптеках очень ""кусается""! На пенсию не купить."
0	"ну есть разница между ""в город с населением 2000 человек завезли 10 миллионов таблеток оксикодона"" и ""провизора аптеки посадили за продажу нурофена без рецепта"""
1	i've been on paxil for years for depression/anxiety and at first it used to help but i guess i've built up tolerance and i come too fast.
0	keppra is evil stuff. vimpat doesn't work for me either. i'm on zonegran- seems to be controlling tcs
0	в смысле снится? Мне прописали цифран, я так и не решилась пить
1	do i look brave enough to refuse medication that has side effects i don't want? i have before. symbicort causes osteoporosis.
1	starting to crash from my adderall
0	would you slow down? you sound like the end of a cymbalta commercial.
1	started taking metformin and been throwing up constantly
1	oooh. lightheaded today. switching meds, it's been a few days without pristiq (the one i'm going off of) - withdrawals are fun.
0	which pharmaceuticals pushed out barbiturates, benzos, thalidomide, tamiflu, prozac etc milking the nhs dry?
0	debbie just hit the wall! she never had it all prozac a day husbands a cpa
0	Запасаемся вентолином/бередуалом и живем лол
0	узнала что такое флуоксетин  сижу с таким ебалом https://t.co/lSrTEC7Aaf
1	the cymbalta certainly is addictive &amp; its fda approved...
0	@onlylear когда сильно заебывает- похуй на 'перебор'.Можешь с прозака начать. В Украине покупала, там пару лет назад можно было все достать
0	viox likes bubes
1	recent spell in hospital and olanzapine sloth/weight gain
0	feeling better just not feeling my subone as usual and valium i do once in a while if i jump through the right hoop wtf man
1	thank god for vyvanse
1	i haven't slept in days due to
1	have decided to stop metoprolol and pain relief, sort chest infection and just see if can find normal and go from that point
0	i'm on enbrel myself and it's been life changing, as i could barely walk before i took it, as i have sacroiliitus.
1	someone out there needs to find a way to make ventolin less disgusting. i can't breathe and the foulness is not aiding the situation.
1	whenever i drink and im on prozac i always feel a little bit sick and twice as drunk as i usually would
1	уже ловлю приходы от сальбутамола
0	Эутирокс теперь тебе надо будет всю жизнь пить))))
0	the plan is to double my fluoxetine dose of my own accord and when that invariably doesn't work ask to switch to a different ssri
0	Лучше всего с демонами сражается могущественный ангел Алпразолам
0	"i have no idea what subone is..... rt"": what? go get your subone, you need it.”"
1	i just have to remember that what i'm feeling is the withdrawal from the venlafaxine. when my meds come, i will get better.
0	i've taken mg of lamotrigine. i think i still need to take a low dose. i feel weird without it
1	holy shit the mg saphris tablet tastes infinitely worse than the mg my mouth is on fire, gross pukey fire
1	partly true but olanzapine is the worst ever for inducing carb cravings for some unfortunate ppl serequel and clozaril a nd
1	fluoxetine makes me see shapes when i close my eyes
0	Не забыть: не жрать прегабалин минимум 4 дня теперь.
0	Иногда мне кажется, что все мы - нация прозака в Соединённых Штатах Депрессии
1	ventolin makin me all anxious. alone in the house and lost in the world. get hype
1	Это флувоксамин! Другой препарат и стоит в десять раз больше флуоксетина :( Я сама думала, что вот Грандаксин мне не нужен, потому что ПА у меня прошли, но врачиня сказала принимать. Возможно, у меня и правда тревожность, просто я уже не замечаю, что можно по-другому.
1	new meds have me out of it. i want therapy not doping up! i was highly functioning now have trouble standing!
1	"""Например, модафинил гораздо лучше, чем кофеин, улучшал способность невыспавшихся людей с юмором воспринимать мультики. Однако ни кофеин, ни модафинил, ни декстроамфетамин не улучшили реакцию испытуемых на словесные шутки."" чет насторожился от этой статьи ахах"
0	Флуоксетин православная вещь. В позапрошлом году обеспечил им себе счастливое лето. Кайфовые были времена
0	best not to get onto loperamide unless you have to travel by bus or similar...
0	Цветы в вазе алпразолам на базе
1	great.. i have hives up and down my legs from this gosh dang trazodone
1	boniva would've been better properly named as an erectile dysfunction drug.
0	insert bilat npas. gets the message across. my gf is currently enjoying the effects of trazodone. i'm jealous she's sleeping!
1	Самое стремное чувство - это, когда таблетка флуоксетина застревает в горле и там растворяется, обжигая слизистую.
0	it was not just ranbaxy's valsartan delayed launch, also launched duloxetine after misssing out the first wave in dec.
0	Че там, Lil Peep говорят умер от овердоза ксанакса. Раньше от героина умирали или спидбола, а теперь, блядь, от транквилизаторов
0	agree. there's efficacy in kind vs degree. use of arb = kind. different arb = degree. some claim telmisartan best
0	"Как же мне нравится название ""Ламотриджин"""
0	according to this xarelto commercial, jim has a fib &amp; that puts him at a higher risk for stroke! wonder what his chads score is
0	taking a straight black coffee and a hand full of adderall to the face or i may not survive this hour shift
1	
1	i took a mg oxycodone once i get out this tub i shud be hella knocked
0	lmao i guess that vyvanse didn't even phase you
1	Первый: кветиапин Северная звезда, 25мг. Доступность и цена: 9/10, действие в сравнении с оригом: 8/10, побочки в сравнении с оригом: 2/10. Ты хочешь спать и на ориге, но только на этом дженерике у тебя галюны (ты должен бороться со злом, а не стать им) и крючит (не акатизия).
0	no, you def can't have both. trazodone had no effect on me at all. nothing has worked for me except good ol' ambien.
0	so what do you take for the pn?? i'm on gabapentin mg/day, nortriptyline, and metanx and still have breakthrough pain! ugh
0	Темные аллели: как гены определяют исход лекарственной терапии и может ли антидепрессант заставить человека убивать? /  / Разработкой флуоксетина в 1970-х занималась компания «Эли-Лилли». Он появился в продаже под торговым названием «Прозак» в 1988 год.. https://t.co/3RtySKsj6t
1	this seroquel-dry-mouth thing is getting weird
1	owww. i hurt my foot. &amp; am concerned. st warning on cipro is tendon damage. :-/ it certainly wasn't a rupture. i'm sure i'm just paranoid.
1	it's better than some of my old meds which caused, like, mood swings and nightmares and insomnia. my vimpat (the current
0	made the perfect cocktail for tonight: effer, klonopin, minipress, abilify and a splash of diet coke. yum!
0	cedar canyon winery blends pungent cool whip flavors and a fetid albuterol flavor in their sauvignon blanc.
0	“: bananas contain a natural chemical that can make a person happy - the same chemical found in prozac.”
1	my enbrel shots hurt a lot less than my back but i still dread them. my brain makes no sense. lol.
0	lol scared the shit out .rt : victoza commercial sun else lol more then half the commercial talking bout the side effects
0	okia said having conducted more than autopsies, as well, she’s never concluded that someone died from acute buprenorphine intoxication.
0	taking a seroquel at pm is an awful idea but it's my only hope of getting any sleep tonight.
0	another enbrel commercial in which phil mickelson doesn't blink. is. he. an. alien?
0	as resp specialists i think we focus so much on the copd we don't pay enough attention to co-morbidities that are contributing to symptoms
0	you probably should so you can get me some adderall
0	i want vyvanse! i am on concerta though to treat my body.
0	настроение закинуть в себя пачечку флуоксетина
1	i've had to reduce the quetiapine back to mg. couldn't take the increased gastro pain. was crumpled in a heap crying x
0	: intense rosuvastatin associated w/ decrease in in non infarct related arteries in stemi - lorenz raber
0	max needs a tiny ventolin puffer
0	Как же так? Я засыпал и просыпался под рекламу сеалекса)
0	have you looked into nuvaring or iuds?
0	Прозак ? Или закон? . Это был быстрый тест, чтобы узнать, кто ты - юрист или депрессист.
0	Путь к моему сердцу лежит через прегабалин
0	that is not a defense of sps in this case. but a defense of lasix/bicarb + miralax after tonight.
0	ilovechunk and pizza and whiskey and nicotine and other stupid shit .
0	is huffing on some advair before she sings.
0	"""what's xigris classified as?"" ""a super eensive drug that you don't give unless they're meeting jesus at the pearly gates."" oh okay."
1	i tried giving ventolin to my patients before, pero they never had that jittery feeling... hmmmm~~?
0	loopy hufflepuff common room battlezone hemorrhoids pitiless comatose stately just the great cymbalta lunesta toilet smurf
0	@valeriyaale59 @Nonpalpabilis Если до завтра от припарок не полегчает - любой антибиотик широкого спектра. Цифран, например. 500 мг 2 раза в сутки. И так суток на 5 :)  Инструкцию только почитай, там противопоказаний куча и вообще хрень сильная, а дозняк выше - большой. Кефиром запасайся :(
0	japan’s takeda sues ranbaxy for breach of uloric patent in us.
0	it's not even medication. there is no way a dr would prescribe that with subone or that combo of pills
1	i start on tues b/c of so i know. it helped but it then destroyed my lungs.
0	gsk returns ex-australian rights for osteoporosis denosumab to amgen in return for $275 million in upfront and milestone payments
1	i feel so pill-ill again - decided to seriously cut down to just weekly enbrel and metho alongside daily nsaids .
0	i am content with my albuterol and flovent, though i may try to get off singulair
0	i feel so good holy shit ativan and flovent or w/e is real nice
0	я жила в танке ксанакс=алпразолам
0	who names a pill latuda? i gotta take a latuda
1	А еще вот. В феврале у меня был общий кризис, и тут я решила перестать пить АД (велаксин). Работал он слабо, плюс меня от него жутко рвало. Хуже не стало, и я подумала, что ура, стрессовый фактор (ДНР) ушел. А на самом деле, мне было плохо, а начинает лучшеть только сейчас!
1	really bad rls fron seroquel
0	ye not bad thanks, avin velcade and dex hope for nd sct this year. give my regards to your bro x
0	i've seen x11 ie for whole year &amp; yes it was for sildenafil as well
1	Думаю - какого хрена вернулась головная боль, сонливость, раздражение.  Доза ксанакса на сегодня всё ещё меня ожидает.
1	coming off effer was the worst ever. even my doctor was terrified of me doing it but the side effects left me no choice.
1	hugs i have been put on gabapentin and it is giving me migranes
0	it's the nicotine---- not from not brushing--- same as smoking!!
0	чиста катя ксанакс пасы, я переименовываюсь
0	Почитал кстати про сейзар. Похоже на мой финлепсин. По сути аналог.
0	buprenorphine
1	humira is the only treatment thats been effective in bringing about and maintaining remission. didn't respond to infliximab!
1	sorry to hear that. i was on humira for yrs, now remicade for mo. we must shake this fatigue!
1	also so glad they gave me percocets instead of t3s. oxycodone helps so much more than codeine. inb4 opiate withdrawels though.
1	there's a good chance i was misdiagnosed with and synthroid meds caused psychotic reactions that cost me my job.
0	shadow hangs over grunenthal as still refuse to compensate people they disabled with thalidomide and refuse access to their archives
0	vioxx was fast-tracked and it killed a half million people.
1	etanercept (enbrel) which can be got in pens, but the preservative stings, so he mixes his own&gt;
0	@kotkk1 Окей, Гугл, где лежит симбикорт
0	Я вообще не понимаю, как я в 14-15 спокойно закидывалась 6-8 таблетками флуоксетина в день, заедая их бисакодилом, а вечером шла бухать литр вискаря с колой.  Сейчас я не могу выпить таблеточку нурофена, когда у меня болит голова. 🙄🙄🙄 Юля, 23 годика.
1	смотря что пить. От флуоксетина похудела за месяц на 4 кг, хотя специально для этого ничего не делала) но не советую, конечно
1	popped an adderall and now i'm excessively sweating
1	gamma-aminobutyric acid+glycine aralyzing rem neurotransmittersrecisely when you shouldn't wake up=grumpy as fuck
0	i like loperamide because they're just tiny little pills and you can get like a million of them for $1.
0	that's what happened to me with the cymbalta
0	ik she lies but even with kief and court...probably still less a year i think. subone is not a drug they give often. and
1	amitriptyline is great at night, but it knocked me out too much. diclofenac is a bit stronger than naproxen
1	i am so damn sleepy today. i wonder if this is the avodart kicking in and getting rid of the last of the dht...
0	@so_many_bitches еще лекса и ксанакса ,ну для полного набора идиотки
1	perkiset and oxycodone lol they had me on morphine before but we didn't get along
1	"diclofenac ?"" an i'm like i have and it does nothing. they're just like ""oh ok."""
1	Под прегабалином так классно смотреть на экраны софиты и всякую там подсветку. Просто АЩ.
0	-generic drugs as effective as amgen's enbrel for arthritis- -: a blockbuster drug made b...
0	лоперамид (или если лоперамида гидрохлорид) это от диареи
1	woke up with my januvia flu symptoms. managed to plan out homeschool for the summer but that is about it for today. suddenly it is .
0	latuda is such an awesome name for an anti depression medicine! i'm dying laughing at the name 'latuda' hahaha
1	alright time to find out if a shit ton of vyvanse and not sleeping for days can get a trimester worth of homework done for classes
1	i hate my new medication. it makes me feel hungry
1	feel proud of myself for writing up my august favourites today even though i had my tysabri infusion and feel like shit.
0	А значит хочешь в Саратове жить без неконтролируемой агрессии и психозов, покупай оригинальный Сероквель в три раза дороже (около 2к)
1	seroquel is causing more gaps in memory, i don't remember going to therapy and as usual no one has stepped up to claim thos memories &gt;&gt;
1	trazodone hangovers are the worst, though. sigh
0	’s dr. matthew birnholz interviews top diabetes eerts at the invokana booth today. catch the interviews starting am!
0	when i first started taking nebivolol (bystolic, a beta blocker) it was $70 a month. it was lowered to $30. yay!
0	fluticasone propionate is fucking magic
0	В смысле? Ты не знал? Занакс, а не Ксанакс.
1	но, честно, я даже не представляю, как буду обходиться без кветиапина, т.к. он дарил мне стабильный и заебенный сон
1	Вставило от алпразолама я успокоилась но теперь все такое странное
0	-generic drugs as effective as amgen's enbrel for arthritis- -: a blockbuster drug made b...
0	y'all know where i can get some sodium diclofenac at this hour?
0	"humphries says thalidomide caused babies to be born ""horribly deformed"". not sure that's following guidelines?"
1	pros and cons of medication. dilemma: have been taking oxybutynin for hyperhidrosis. works very well, but drys out eyes &amp; mouth severely.
0	try some buprenorphine that always helps me feel better
1	i take qvar x a day. singulair gave me nightmares and advair made weird things grow out my skin, itching burning too :-/
0	oh yes and such a small drop. after doing lots of reading i think venlafaxine is supposed to be the most evil.nearly there though!
