1	хочу отказаться от паксила потому что появились неадекватные мысли в голове и панические атаки которых никогда не было
1	only problem is the ride has fuelled the olanzapine munchies. i was a nightmare in the supermarket tonight!
1	lamictal dosage increases kind of wreck my head for a day or two. but they also make me super productive as long as i can do things slowly.
0	depression medications mirtazapine and fluoxetine may increase a person's risk of developing clostridium difficile infection (cdi) by as ..
1	has anyone ever taken pristiq before? i just got prescribed it because effer made me nauseated does pristiq do the same thing?
1	probably a month ago after i started taking the viibryd i began tumbling out of dreams into a half conscious state
0	that's a good thing you fucking thalidomide baby.
1	gotta find an alternative to vyvanse, asap. i'd rather be sleepy &amp; happy, than alert &amp; depressed!
0	Портал — антидепрессант на основе флуоксетина, объясняет Википедия
0	научите прекратить пить глицин валерьянку чай с ромашкой фенибут флуоксетин в немеренных количествах
0	хуй там плавал. полгода пропил и все, не хотят выписывать. а рецепт очень строгий. и в москве ксанакс можно раздобыть только в митино, там аптека где продают даже морфин, и аптеку собр охраняет, с автоматами, прям внутри. такие дела
1	i came off pristiq in july last year. i still get brain zaps when tired. my genitals aren’t numb now tho - swings/roundabouts
1	"talk to your doctor to see if you need to up your dose of paroxetine. it is possible to ""plateau"" on it..i did."
0	ебать, а глюкофаж зачем ? сахар барахлит ?
0	чувак пишет что спустя неделю велаксин не работает ХММММ ПОЧЕМУ ЖЕ &gt;сука месяц хотя бы нужно принимать &gt;нельзя юзать во время курса венлы ЭТО ЖЕ БЛЯТЬ ЯСНО &gt;нельзя мешать любую хуйню с венлой два ада подряд ни к чему хорошему ни приведут &gt;ПИТЬ ТЕМ БОЛЕЕ СУКА НУ
1	pop a trazodone i have fuckin dry mouth
1	so damn sleepy. this seroquel is fucking me up so bad.
0	take the lamictal or no? i think maybe yes
1	i had allergic reaction from enbrel.
1	Пиздец у нас цены на лекарства. Покупаю папке антикоагулянты, без которых при мерцательной аритмии вообще не вариант (риск инсульта и тромбоэмболии). Есть дешёвый варфарин, от которого самого по ходу можно отъехать. А есть современный Ксарелто 2681р за 28 таб. 35000 в год.
1	god knows how i'm going to sleep tonight after sleeping hours in the day
1	i hate to be all anecdotal evidence-y but i was assured taking enbrel wouldn't make me get sick more. i got a cold day after my nd dose.
0	@7Zaebalas Обезболивающее.. На оксикодоне.. Деревенский героин😆
0	in other news, i now know why vimpat is a federally controlled substance and it's awful
1	Понял что сероквель можно использовать как рекреационный наркотик: выпил пару таблеток и спишь видишь сны
0	slutty fluoxetine
0	Кагоцел против кишечной инфекции. Осельтамивир(Тамифлю) против гриппа тоже
1	wish it was monday...seeing doctor tomorrow &amp; want to see if he has any suggestions for my withdrawal.
0	the peacock that calls out every morning really needs a lozenge
0	Что конкретно ты хочешь услышать? Точную цифру пострадавших и умерших через 10/20/30 лет? Никто тебе не скажет точно, но это сотни тысяч. У меня отец ликвидатор был в Хойникском районе, умер в 67, l-тироксин до конца жизни принимал
0	Почитайте состав ксанакса))))) его выписывают даже от бессонницы
1	put miralax in my coffee today so i could spend an easy min in the bathroom ducking the office but nothing is happening
0	hurts cymbalta can help
1	i might have gained lbs in weeks on zyprexa...haven't lost that weight yet, and it's been years now. call doc if it happens to you.
0	@nadbrovni @UCiddMOcICPkxT8 @dolceduce @rfoxk @DaCosmonaut пруф  qtp = кветиапин = действующее в-во сероквела
1	"df188 au diclofenac ?rt "": the doc gave me these painkillers that have wezad me a good one... """
0	Пульмикорт турбухалер – гормональное терапевтическое средство, выпускаемое в виде прибора для индивидуального пользования. Содержимое является порошком и используется для ингаляций многоразово. Средство находится в пластиковом флаконе, снабженном специал..
1	used ciclesonide earlier. now my nose is dripping.
0	lady asked what's difference between venlafaxine tabs &amp; m/r tabs. told her it's a lot of happiness in one go or a little throughout the day.
1	my mind races when i'm on a vyvanse
0	@55privet555 Ацекардол метопролол индапамид и прочее Они спасают реально
1	i hate to hear that. taking seroquel is like swallowing a sleeping pill when u wake up then trying to function normally
0	yay mom's giving me baclofen when i get home~ i'll probably still be gorked for my physics final but i kinda don't give a fuck.
1	time to get off paxil. it's really really been terrifying lately.
1	the drugs don't work!!! from fit to hobbling in a few days. off the pills but may need wks to recover &amp; be prone to ruptures
0	increasing mason's meds. he is currently on prozac, lamictal, and ability. hoping to see some improvement!
0	@YavsegdaKsysha Значит, вариантов немного. 1. Перенесенный бронхит, осложнившийся плевритом. 2. Эти два варианта связаны с аллергией и прможет Пульмикорт в ингаляциях: ларингит или астматический бронхит. Нужен хороший пульмонолог
1	А еще беспокоит нога. Если в пятницу я уже почти бегал, то в сб-вс снова стал ощущать легкую боль. Мама волнуется из-за эутирокса, говорит, что он может тоже вызывать такие проблемы с ногами
1	the dreams i have while on oxycodone are inane and way too real!
0	horcoff? give her a lozenge.
1	i took a depakote, zyprexa, tramadol, flexeril, naproxen, a gram, blunts..... and almost died.. i turned green
0	two effer a day.
1	i used to. i'm on humira now. i ended up developing a reaction to remicade.
1	Какие же от венлафаксина красивые блестящие глаза, который день умиляюсь.
0	goodbye from the schizo wing and stop pushing abilify and latuda i know you can't but go team usa
0	that part of it is not major ordeal, as i can personally attest to because i have no thyroid and have to take synthroid or generic versions
1	i think advair makes my skin dry
1	products will be any medical or hospital bills related to the injury caused by the product, my husband was permanently injured by avandia
1	i've tried every nsaid going diclofenac didn't ease much, the nerve meds gabapentin etc gave severe side effects xxx
0	мне выписали феназепам и флуоксетин
1	На прощанье доктор попугал меня ломками после привыкания к прозаку и сменой АД.
1	i lost weight in the past but it was much easier. like steps forward, one step back on the quetiapine.
1	Послезавтра защита дипломного проекта. Сдам я его конечно на пять, я же охуенная. (накачаюсь ксанаксом чтобы не умереть от паники публичного выступления)
0	from the inbox: has anyone taken the new drug saphris if so what are the side affects good or bad and does it cause weight gain?
1	understand why my specialists told me to but big bags of mints when taking gabapentin driest mouth every and drinks don't help it
1	*gets addicted to metformin (it gives u the poops)*
0	take adderall or vyvanse or strattera or ritalin or focalin or cocaine!!!! you'll stay awake!!
0	"on my way to pick up my $130 tamiflu prescription (seriously?) putting the ""f u"" in influenza."
1	do you know how badly i want a cigarette right now? but no. i manfully suffer through nicotine withdrawal—all for you
0	tonight's cal defense is sponsored by lunesta
1	fluoxetine, got me going crazy.
0	i need to take my night meds im way too hyper right now i need to chill the fuck out aka take seroquel and klonopin lol brb
1	subone so clutch, but that orange after taste instant death
0	Поставка лекарственных Будесонид + Формотерол #tender
1	sos i havent slept for hours im on adderall i cant scream
0	fluoxetine? i think so coz i've been tried on different anti ds. think i need to find that reduces appetite! if u know of &gt;
1	this quetiapine isn't working damnit!!!! does make me hungry at night though... *sigh*
1	girl my doc raised my dosage for metformin and i have been so sick all damn day! i feel your pain
0	hrt stuff (casodex and spiro) + avodart and minoxidil
0	Странный подход, у нас тоже раньше говорили отпаивать побольше и симпотамически лечить, при темп ибуфен, при кашле сироп от кашля, таблетки для рассасывания, капли в нос, а сейчас еще препараты назначают противовирусные европейские. Грипоносир рихте, номидес пропили.
0	Ну что за детский сад Я полгода на пароксетине провела и не спрашивала А как амик назначили, так сразу пошла проверять  Я шучу, я ебанутая, не делайте так   пожалусто
0	how is it almost five am?! i know i made the wrong decision tonight. choosing between flexeril and trazodone is hard.
0	@dummy_not_man Не пробовал пока, но после реально вонючего сальбутамола российского разлива чего то хорошего не жду
0	ditto that with keppra and vimpat
1	took months after taking brilinta to get my basal rate back to nearly perfect.definitely bad drug for
0	have you tried oseltamivir secondary contacts? we treat family eed to n.meningitis. influenza ebola both rna virus
1	the medicine januvia is the worst blood sugar medicine ever! the side effects are ridiculous!
1	hi i was taken enbrel for months but i had to stop it i was getting bad side effects
0	Нужен ксанакс, а Бой Или игра с самим с собою  Слава Кастору Трою Одеялом теплым тебя накрою Когда не пою, меня кроет Обожаю мясо с кровью
0	it's not really common, from what i was told. i always have weird side effects. but lamictal did help my mdd for a while.
1	От антибиотиков очень клонит в сон. Хуже кетилепта, блин.
0	subone hole. drake gets it.
1	this adderall have a nigga up
0	"sounds like becky needs some loperamide for her ""dia-hoo-haria"""
0	hearing stories about putting subone in eyes; being reminded i can still be surprised.
0	1. Это вакцина она стоит 1800 у нас. 2. Второе Спирива это дыхалка от приступов. Задыхается мама. она 2800 стоит. около 5 тыщ за все.
0	vimpat might make u nauseous
1	humira made me have a bad rash on my stomach and broke out with bad psoriasis on my leg. can't wait to start remicade
1	rivaroxaban diary day . am beginning to think all pains from pressure on that part of body are due to fluid retention.
0	#Pfizer доказала, что #Инфлектра полный #биосимиляр #Ремикейд. #инфликсимаб #Remicade #Inflectra #JnJ #болезнькрона
0	rawr, i'm hoping i don't get humira coz i hate needles. do u find it works for u?? how often do u need it?? xx
1	i've had ocd symptoms like that for a while but seems like the seroquel exacerbates things and now this. :\
0	even tho when i first tried vimpat i was pretty fucking miserable
0	aciphex and fioricet to the rescue
0	i'm surprisingly perky to say i'm three days off my prozac.
1	okay, can't take lunesta now and get up on time so please mellow me out and get sleepy ms. xanax. gotta be able to be fun and loud tomorrow!
0	Пьяные сибиряки танцуют под песню нужен ксанакс 10 часов асмр видео
0	our resp specialist nurses work alongside pns within surgery copd clinics on a monthly basis-fantastic results
0	fluoxetine is an ssri, right? it's just generic prozac and lord, it sounds like they need some
0	#Томск : Мне нужно купить флуоксетин без рецепта
0	rt“: i heard of tysabri. should work good on ms. but serious side effects as well ” that's why i'm terrified!
0	pregabalin nd most eensive drug for furness £850,000 pa. should consider trial gabapentin so we can spend ££ on chronic pain strategies
1	well, i'm now convinced humira &amp; enbrel were the culprits of my weight gain! other tnf will likely result in same. now what?
0	they must lace bacon with venlafaxine, withdrawal from thus is supposedly as bad as illicit 'hard' drugs. good cheese too!
0	albuterol tiene a vale on fire!
0	Емчи той и Ксанакса така
0	throw some vyvans in there and you got yourself a party
0	get a throat lozenge
0	hoping the enbrel has come in time to stop the need, but i fear not really.
1	ventolin down. haha. hyperventilation again :x
1	im delaying on taking my geodon so i can stay up late
1	humira why you burn my veins
0	who would have thought dimethyl fumarate would make $5 billion for tecfidera and biogen in . as a drug.
0	На аналогах прозака. а прозак от недаеба
0	$regn: eylea sales just missed by about $20m; company maintains guidance, says it was inventory. could hurt biotech sector.
1	i had infliximab yrs ago but had severe reaction after nd dose. now on humira &amp; doing great!
1	metformin gives me a bad tummy but im on it for the forseable future
1	someones said can happen while fighting infection which is quite possible,nearly finished some cipro&amp;bringing up foul gunk!
0	my baby lungs would be so done for if it wasn't for health insurance. month supply of advair retails for $358
0	Как хочется Янине пачку имодиума скормить! Может прекратится её словесный понос,как же задолбала трындычиха!
1	well hello am. thanks lunesta for not doing your one job
1	i've found that it's okay to stop dead with prozac but not fluoxetine - i got terrible paraesthesia; it felt as though i was
0	only realize i was on the wrong convo when i started typing the lyrica
1	all the things i have just make me sleepy as hell: cymbalta, klonopin, ambien. wait what if i take em all togethhssaagg
1	Когда первый месяц пьешь один венлафаксин, становится очень тяжело уснуть, иногда не спишь всю ночь. Днём постоянно зеваешь и залипаешь, а от тревожности мне ещё больше хотелось спрятаться под одеяло и лежать там. Тк я пила его только месяц, не ручаюсь, проходит ли это после
0	-generic drugs as effective as amgen's enbrel for arthritis- -: a blockbuster drug made b...
0	combination therapy with teriparetide in osteoposis - yes with denosumab or zol, no with alendronate. via ralston at
0	@IpanemaGirl3 да, водить противопоказано. особенно, если их в солидных дозах разово потреблять, от 300 мг прегабалина твои мозги покажутся тебе сгустком желе.
0	maybe if i take the strattera and neurontin right now i could get more sleep while i have the time.
1	@anubisorpheus нет, хотя по идее должна бы, просто после таблеток вроде атаракса и паксила, феназепам уже не так по мозгам бьет
1	От Паксила вроде сорок и набрал, и либидо на нем нулевое было, да
0	paris i know it's very hard trying to live with the loss of a parent. consult a prof and get paxil.
0	metformin reduces bg levels by inhibiting an enzyme involved in the production of sugar by the liver (nature : -6 and nejm :1547-8)
0	Ветеринар прописал ингаляции Фликсотидом 125 мгк 2 раза в сутки и еще прописал Вентолин 100 мгк на случай приступов.
0	hi louise must have a chat about baclofen. are you using it? have had some amazing success tho very early days.
1	my nigga dante addicted to that nicotine
1	lexapro gave me the worst mixed episodes. i have some instability with pristiq but i can manage it ok.
1	hot flashes won't be around forever; but weaning of paroxetine could be a nightmare
0	just took some meds this cough is killing me
1	god i'd like to go to sleep right now. but i'm still a little afraid of the visions, even though i stopped taking viibryd days ago.
1	the fda has killed more americans than al-qaeda, ,000 due to it's vioxx scam alone, plus ,000 heart attacks..!
0	Пресс-конференция Фрума:  - Вы все еще используете сальбутамол? - Это не ваше дело, это медицинская информация  #королевичелисеймеждутемпосветускачет
0	Это вам не лыжи,сальбутамол не поможет. Россия - Норвегия 5:1
0	нет у меня. во мне 6мг феназепама и 4мг ксанакса еще попутно
1	just had a marathon sleep past hrs on new dose of -hope my liver will be ok on it.woke with stressy tummy pains.
0	bisphosphonates (alendronate, etidronate, risedronate, iv zoledronate): empty stomach w water (esophageal erosion), gi, altered taste, onj
1	cipro destroyed my entire body, from head to toe. bedridden since . be very careful.
0	@jkseyes я не слышал о флуоксине.  только р флуоксетине
0	i really, really hate this lamictal.
0	was used bid in patients with neuropathic pain taking lyrica™ alone or with cymbalta. this addition provided more pain relief.
1	pre subone i could cum like times a day no joke but i'll trade a lifetime of orgasms to never touch heroin again
1	i havent eaten anything all day and im hungry but i dont feel like eating thanks adderall
1	all i have done today is sleep. and i still need to sleep more. this is a welcome change.
1	headaches suck i wanna curl up &amp; cry.
0	Зачем Ксанакс,когда есть Ибупрофен и Завиракс?
1	there's a point where you know when trazodone has kicked in. it's when you're a drunk, staggering, blurry-eyed, amnesic. yeah. i'm there now
1	wow...if only more doctors thought like you!! i lost my entire life to twelve cipro pills.
1	i've decided i'm really not happy with the pain lamotrigine is causing or the poor sleep. i am thinking of asking for a trial of prozac and
0	В твери маленькие мальчики банчат ксанаксом за 2к за табл ахахах шок
1	watch your eyesight with lamictal- i went from awesome vision, to wearing glasses full time for the yrs i was on it.
0	my nighttime med is trazodone and i cut back to a generic, otc for my acid but it is a sad night if i don't take it.
0	итак, итог сегодняшнего дня - не мешайте флуоксетин с бифреном, особенно в больших количествах
1	take paxil then. no anxiety just happiness. but you et withdraws if you forget to take it.
1	i was on muscle relaxant baclofen for two weeks, then months trying to rid myself of it. days in without and no sleep. :/
0	rt : more specific issue, baclofen causes brain stem toxicity unwary must be awa…
1	От лоперамида как раз мазать и перестает
0	survived the non-venlafaxine disaster with diazepam. home now, thank fuck, with the medication &amp; some zop imbibed. should be okish tomorrow.
1	nicotine is literally poison. but sometimes you gotta find out the hard way.
0	я так и не поняла что сегодня со мной было  но я жива и даже осилила тред на автопилоте   состояние чисто нажраться новопассита и эгилока, шлифануть винишком и пойти читать кречмера
0	вместо Лоперамида рекомендую Фтолазол, состав тот же а стоит дешевле.
1	thinking it might be the baclofen doing it.only on a low dose though.broken sleep is a nightmare.
1	i changed from rebif to tecfidera in november. i've done well so far. no flu like symptoms anymore, like after shot day!
1	ugh, maybe tamiflu isn't the greatest thing after all. it can cause insomnia and anxiety.
1	rimonabant is a generic acomplia for long-term weight loss. you will lose weight in a short time.
0	they ingest ambien, seroquel, lsd, adderall, oxycodone, cocaine, flexeril, percocet, psilocybin mushrooms and codeine. /3
1	albuterol be havin me nervous and pulse fast as hell
0	Кофеин состоит из углерода, водорода, азота и кислорода —так же, как и кокаин, талидомид, нейлон, тротил и героин :3
0	Надеюсь, что этот совет Вам не пригодится, но всё же. Метадон - прошлый век. Сейчас практически везде на Западе в программах заместительной терапии применяют субитекс (бупренорфин). Он по многим параметрам на порядок эффективнее; и побочные эффекты практически отсутствуют.
1	Эй, но ведь велаксин классный. Ну если не учитывать, что от него страшно тошнит и это худший синдром отмены, ну а так он няшечка
1	took a percocet for my tooth. feel like i'm about to die cause of the prozac thats already in my system. apparently you can't take both. fml
1	the fact i talked to for minutes last night and didn't remember at all is just proof lunesta really works
1	not sure whether tis buprenorphine or pregabalin causing itchy skin but i really need scratch mitts :-/
0	the painkiller vioxx kills people! (as many as aspirin!). big news stories that left out the most important part -
0	i think i just gave a little spaceman my darvocet by mistake. best nights sleep his parents will get in years.
1	quetiapine knocked me sidewards for a week then i suddenly woke up activated. then relapsed, upped dose, activated &amp; so on
1	ambien mg qhs, nortriptyline mg qhs, fluphenazine mg qhs, and viibryd mg daily and we're wondering why so somnolent? yeesh.
0	copane, avonex, and tecfidera = fail. i'm jc+ so no tysabri. now what?? i'm thinking stem cell transplant!?!
1	reducing the lamotrigine is grim. exhausted and grumpy. got another weeks of this yet. wondering if i'm doing the right thing?
1	4 day rivaroxaban diary. atrocious backache despite having taken paracetamol an hour ago. gone back to bed.
1	my husband gerald wunsch has neuropathy from velcade and is now on kyprolis in a maintenance therapy day ,2,15,16
0	paroxetine is the ssri of choice in breast feeding mothers. sertraline if you need an ssri post mi
0	i'm glad someone does. fluoxetine and lack of sleep is not a good mixture
0	"""oh shit!"" he exclaims after skipping over imodium on the shopping list."
0	this imodium commercial is far too sexy for a product for diarrhea
0	@sergonaumovich А помните как ЮВТ хотела выделить 1 ярд на тамифлю в ноябре 2009 г ?  Это было эпично. Ющенко ей не дал это сделать
