0	nuclear giant exelon launches front group to cover its assets via
0	i don't use biologics at the moment had a bad time on enbrel only use painkillers and diclofenic
0	уголь активированный, имодиум, от простуды(терафлю), я часто от кондиционера простываю.Парэо,от ожогов что-нить, антигистаминное(вдруг медуза ужалит).Еще тапки для дайвинга, в них удобно в море заходить и безопасно, что на ежика наступишь)
0	по моему лицу, конечно, видно, что человек всю ночь писал аттестацию и учил билеты, вместо того, чтобы просто положить тупую бошку на подушку, я еще четвертинку сероквеля кинула, чтоб спалось слаще, естественно, все нахуй проспала и опоздала на час
1	the day after my humira jab and as ever i'm mega tired. may have to go back to bed.
1	husband said i was a little 'high' tonight so encouraged me to take mg of olanzapine. now feel really really really sleepy, zzzz....
1	oof, sympathies. i had a raging cipro headache last week.
1	off to the doctors to talk over what's next, seeing as how pregabalin does nothing apart from make me dizzy
0	what's happening, people? (my whisky lunesta cocktail hasn't taken full effect)
0	delayed response. afluria covers h3n2v (assuming the v is just virus/viral signifier).
1	ewww took a saphris to fall asleep and now i just feel like i'm gonna throw up.
0	they found a small ulcer they gave me nexium for that they did biopsies
1	crestor side effects muscle cramps you're telling me
0	-timi : saxagliptin did not reduce cv death, nonfatal mi/stroke in at high cv risk - d bhatt
1	olanzapine is amazing srsly, the dreams are immense, no addiction, its gorgeous, like brave new world soma to me
0	i swear the only commercial on tv is the one about humira....
1	Но вот побочки у прегабалина пздц было написано
1	the effer may have been pushing me toward hypomania, so we are trying just an ssri, then see if a mood stabilizer is needed.
1	oy.. i'm allergic to paxil. makes me physically puke didn't understand why. i see a psych. i'm on mg of zoloft.
0	gotta thank the lord for the weed and the nicotine, i can't sleep close my eyes and see wicked things
0	th place goes to glamithkline's ($gsk) asthma standby ventolin hfa, with 4 million us prescriptions
0	no i think probably tramadol or co-cod /500 stopping would need face-face pregabalin would be letter/phone contact
0	“: cymbalta can help” lmao i'm not dealing with you today no ma'am
1	однако спасибо метформину -4 кг йухуууу уже можно спокойно жрать на нг
1	Годные таблетки (венлаксор). У меня вначале от них было сердцебиение, расширенные зрачки и головокружение, но через три месяца они начали работать по назначению. Не бросай, если что, слишком рано. It takes time.
0	use % dose of januvia if crcl &lt; or scr &gt; (men)/&gt; (women)
0	ventolin moments
1	i found it worked better for me than quetiapine because it didn't make me as drowsy.
0	Так что если увидите меня слишком спокойным,не удивляйтесь я просто буду под ксанаксом
1	vyvanse got me up like zombies.. xan's put me down, them bitches call me romney.. the way i steady clown
1	i agree that the after sting is much worse from than
1	where are y'all. good grief! i didn't even get one reply... discrimination! guess my parents don't matter. vioxx killed mom.
0	degassing some mobile phase for use in the baclofen assay
0	Всё что я могу сейчас, это ныть, всех ненавидеть и смотреть в одну единственную точку. Муж в это время ездит по аптекам в поисках Паксила
1	the day after humira used to be a great one, full of energy, low pain. after a month, it is now a fatigue filled achy day.
0	finally my subone kickin in
1	Вот русский флуоксетин хороший, ядрёный, крепкий, выпьешь таблетку, ходишь припизднутый и ебись оно всё в рот, сразу видно русские люди делали.  Не то что бездуховный австрийский, аккуратненький такой, очищенный, чтобы тонкую психику толерантного европейца не повредить, тьфу.
0	it's short-term pain while i recover from ear surgery. nothing i need cymbalta for.
0	В борьбе с депрессией нельзя прибегать ко всякой химии типа ксанакса, потому что природа наградила человека естественной защитой — водкой.
1	rt : does paxil withdrawal take! extremely emotional switched to wellbutrin. wanna crawl in a hole.
1	will still be on the geodon, but will also be taking a low-dose alprazolam as needed for the sudden anxiety attacks ive been getting
0	tamiflu for morbidity/mortality:no benefit. nnt for symptoms (fever):30;nnh (vomiting) ! - newman
0	. the makers of took the data of two of women with surges out of the calculations for the chart they have on the label
0	gonna take a piece of seroquel so i can take a nap lol
1	my metformin is giving me such bad back pain i cry
1	ciprofloxacin: how do you eect to sleep when your stomach is a cement mixer?
0	and olanzapine smd about is also approaching a large effect size? interesting as people say antipsychotics not v effective
1	i'm not taking my meds tonight. i think latuda makes me hallucinate more than normal. i can't deal with it
1	"prozac is the bartering stage. tell them it's not working. do not say ""friends say duloxetine is like being on e hours a day""."
0	Ебанарот, 15 лет не вспоминал про сальбутамол, и вот теперь снова я буду на нем сидеть
0	bummer; you should become a spokesman for zostavax -- shingles vaccine.
1	challenge: try to take a nap while on adderall *hint: you can't!!
1	я: /задыхаюсь/ я: /узнаю цену пульмикорта, ибо беродуал не помогает уже/ я: /задыхаюсь еще больше/
1	"""no taste for you"" -vyvanse"
0	Возьму на заметку.У меня сейчас один котёнок,тоже часто поносит,хоть и едят одинаковую еду.Я лечу лоперамидом-насыпаю немного на кусочек хлебного мякиша и делаю шарик
0	. this may be the imodium talkin but i swear i ain't shittin ya !
1	didnt take my vyvanse and remembered what food is
0	“: no adderall tn i gotta study for this stupid accounting test tomorrow.” feeling this so hard
1	day of tecfidera for my ms. so far, just very slight gi side effects.
0	i wonder when i make out with a girl do i taste like nicotine? haha
1	i have put on weight (thanks ms and ). always look on the bright side: time for a t-shirt spree!
1	is my memory really bad due to mg seroquel and mg cymbalta or the bipolar itself? i'm not remembering conversations
0	is amazing spider-man going to be just one big boniva ad starring sally field?
1	withdrawal has reached a peak, lost vision and almost crashed my car from a brain zap. thanks a zillion
0	the seroquel pretty much does the same thing. also, forgot ect
1	rt : it appears that my twitter addiction may have just been a side effect of my nicotine lozenge addiction.
0	Я щас сдохну Несите сальбутамол
1	anyone on pristiq withdrawals?
1	i don't want to take my humira at all the pain is always unbearable and i don't wanna
0	burnt mushy the hustler pee aranesp may sweet unseemly star trek constipation two, three...soda, shells burp prime rib medium well
1	. oh. yeah, what kindke said: almost ~100% of metformin users report diarrhea, nausea, vomiting... probably dysbiosis
0	watching documentaries until the smallest hours with a lot of temazepam in your system does not make for a productive saturday.
0	enbrel monday, and dusty is off today. he's sleeping in, so i did the shot alone. got oberon rumbling in my ear. ready to start his book!
0	"in the odyssey pcsk9 study, investigators report that a majority of ""statin-intolerant ""patients can tolerate atorvastatin mg."
0	don't worry about it. that's why hope (however pointless) is critical to our survival. rt : i'm gonna need some cymbalta lol
1	fine whine sweet basic bone bad breath bad diarrhea a horse ebooks fart yogurt turd fever full. of what? januvia
1	i haaaated trazodone. don't be afraid to ask doc for something else if side effects continue. gave me migraines.
1	Круги под глазами больше, чем сиськи. Спасибо (нет) флуоксетину за -4 кг за месяц, лучше чем спиды, 10/10, блядь.
0	oooh a xarelto commercial. then a sprint commercial right afterwards. its not even a race on
0	Излечение оппозиционеров проводится с помощью таких лекарства, как Аддерал и Ксанакс.
1	Я так натриггерилась,что мечтаю о новом рецепте на рекситин,чтобы меня не ебашило
0	rt : wake up put on the same hoodie and sweatpants lay on couch with phone lay on bed with phone fall asleep repeat paxil®
0	Журналист: на схемах с «Тамифлю» Тимошенко «наварила» минимум 19 миллионов долларов
0	latuda is the only way
1	oh god never do a ventolin right before bed
1	i am way too hyper to go home and do nothing tonight damn prozac &gt;.&lt;
0	the emails in current litigation against pradaxa tell a different story
0	how to use paxil for premature ejaculation licensed &amp; approved ...: how to use paxil for premature ejaculation :: online retailer of ...
0	billy viox at larosas
0	канешна, на прошлые игры было завезено всего 3000 доз сальбутамола
0	щас сотенку триттико под пиво и по домам
0	Сальбутомол это ещё ладно. Препарат будесонид+формотерол, которым активно лечат астму, это вообще чудо науки. Если здоровый человек использует подобные бронхорасширяющие препараты, то он имеет вдвое больший потенциал по выносливости!
0	Ты герой! Я взяла Назарел, посмотрим. Надеюсь, повезёт
0	at time of tysabri approval, few other options for treating multiple scelorosis &amp; none as effective.
0	сорок кошек, сорок ножек, сорок ящиков морковки и флуоксетина
1	so anyway last night.. my new medication (venlafaxine/effer) made me feel the most depressed ever, and i overreacted about everything
0	тАК ПОАККУРАТНЕЕ С КСАНАКСОМ Я ЩАС ПРИРИЛЕЙЧУ СЮДА ЕБАНОГО КИРКА ОРАЙЛИ ЕБАТЬ ЕГО ЗА НОГУ
0	"""smokin' loud sippin' lean..thee nigs square nicotine ..irene n a zip o lean. loud made me cough i need medascene"""
1	oh i get it ambien + seroquel now i'm floatin
1	Здравствуйте!скажите пожалуйста может ли прием эутирокса быть причиной головокружения?
0	forest to buy u.s. marketing rights to merck's saphris
0	"grunenthal ignore the ""quantity"" of people they disabled with thalidomide and the poor ""quality"" of their lives"
0	-how to get more followers? need to spread the word-only cipro listed-lev. and ave bring more to you?thought
0	carbamazepine ; phenytoin ; lamotrigine ; valporic acid
0	dick wolf george strait rosary diarrhea gummy new york city overseas spiriva writing. a defiant, vendor strength privy rob hubbard
1	Проебала четыре приема велафакса, и теперь у меня отваливается голова
0	@Wanessa_say Доработать на обезболивающих. Канефрон по 2 капсулы 3 раза/день. Ципрофлоксацин или цыпринол.👈 лучше всего! Массаж спины. Выгревание (то уже на море можно). Секс (как можно больше)
0	absolutely fucking wired in. never had more studying before in my life
1	my creativity was blocked by lithium and prozac and wellbutrin and paxil and zoloft and effer and lexapro and cymbalta and abilify-
0	it happens to me to. sucks!! i got some lunesta from my dr. and it helps.
1	really, i'll ask my doctor about switching. lunesta makes me oversleep and
1	who knew gabapentin got you off your face. i'm completely off my nut!!! so calm.
1	personally i prefer staying up until i get hallucinations, to taking seroquel to get to sleep, but only because it's more fun for me
1	diclofenac gives me a serious heart burn.
0	toprol xl is an extended release metoprolol (beta-blocker) that can lower blood pressure and heart rate
1	при приеме сиофора влияеет ли на потенцию
0	thankfully st john's wort, pregabalin, and memantine are seemingly rebooting our brain to be functional. a lot of us are coming back.
0	enbrel is like a really mean grandma that you hate, but you have to be nice to her so she'll leave you an inheritance
1	tendons still achillin me, some levaquin humor..
0	please take a throat lozenge. my ears hurt.
1	- whilst i was maxed on tegretol, neurontin &amp; lyrica for pain management, my memory and decision-making ability were all shot
0	apixaban is only new oral anticoag for afib that meets superiority in both efficacy (cva) and safety (major bleed) outcomes.
0	nexium is my hero
0	$biib $eln - rate of pml continues to increase, while monthly tysabri gross patient adds were down to in may(jpm)
1	also my kidneys have been swollen ever since i've been on viibryd.. but its also been super hot out..
0	the xarelto commercial during the today show is the highlight of my morning.
1	&amp; i'm not taking that trazodone ever again shit had me sleep for like hours
0	she has da nuvaring now
0	oxycodone got me right
0	полтора часа назад я зашла в инст, чтобы посмотреть акаунт Glossier  очнулась на ривердэйле и шэйне на ксанаксе
0	Ещё и царапина загноилась. Ципролет, что ли, начать.
0	i stick my boyfriend fluticasone propionate up my nose every morning
0	i stared at my lunesta for a moment and then called it my precious in a gollum voice before taking it... i might be weird. maybe.
0	questions about your prescription? visit our discussion board!
0	some new stuff called saphris for bi- polar
0	Я химик и в некоторой степени медик. И понимаю, о чём говорю, когда глазные капли с ципрофлоксацином в ветаптеке продают дороже в два раза, чем такие же для человеков.
0	thank you. wish i had gotten tamiflu for all of us. the kids are better. just dh and i now. ty. hope u and yours are healthy!
1	the comedown on adderall is so fucking annoying
1	years of the health care system that started out as a untreated infection due to work, to insomnia, to levaquin causing afib to cns issues
1	it turns out that i can still ride a bike in spite of my ataxia (side effect of lamotrigine) it has been at least years.
1	lunesta throws my taste buds way off. like water tastes so so bad
1	it's very tough. i understand, &amp; you have my full sympathy. how did you find cymbalta withdrawals?
0	sporadically chugging on my blue ventolin inhaler during footy isn't the best look, so instead i've been given this.
0	w/the synthroid in the morning i’m supposed to wait least min (preferably hour) before eating/drinking, esp caffeine. :/
0	analysts are looking for decreased profit for exelon when the company reports its results for the second quarter on thursday, july ,
0	yes sad rt : my toradol &amp; vioxx jokes aren't as funny anymore after listening to richard dent &amp; wiley i'm ..
0	saw piece u did on constellation exelon merger. do u know anyone in media that covers that company? have nugget that is topical.
1	i do not like how the gabapentin makes me so sleepy ! i wish it would not do that to me. ..grrrr
1	geodon was also *very very very* hard to get on and off of. i feel asleep at my desk for weeks lol
0	$eln had no influence on tysabri and market changing and only one part of biib portfolio so $eln wanted to diversify
0	liraglutide exerts positive short term effects on glycaemic control in t1d patients.
0	yeah i have like mcgs rescue and symbicort which is like two drugs put together for my asthma. i hope that you'll be okay
0	В шестидесятых люди принимали кислоту, чтобы сделать мир странным. А сегодня мир стал странным, и люди принимают прозак, чтобы сделать его нормальным.
0	bacharier: is the pt on high dose ics? (&gt;=500 mcg fluticasone equivalent + additional controller)
0	walking around the north side with a cooler full of humira syringes
1	rt : i cannot be in the sun!
0	если бы я мог вернуться в день, когда мы познакомились, я, вероятно, просто остался бы в постели. ты просыпаешься каждый день и заставляешь меня чувствовать себя ни на что не способным, дизайнерские туфли, таблетки ксанакса дополняют твою косметичку.
0	wonder where my subone will go tonight better not go further then my damn room and car fuckn bullshit. on another note happy birthday bro
1	things which are the spawn of satin: mosquitoes, bananas, facebook, paxil withdrawal symptoms.
0	thank god for trazodone
0	Министерство здравоохранения расширяет перечень льготных лекарств  Министерство здравоохранения расширяет перечень льготных лекарств. В него включено 39 новых лекарств отечественного и зарубежного производства, в том числе антикоагулянты — ривароксабан и.. https://t.co/YTapGtO9hs
0	"ah nicotine lozenges got me off smoking. it broke the ""cig in hand"" habit, that's the worst part i found."
0	@cutthumbtere191 Он брызнул в рот порцию вентолина.
0	i had cipralex and got side effects it made me worse!! so they gave me fluoxetine and it really helped its quite popular xxx
0	fda padac votes -3 to approve spiriva respimat for copd
1	gabapentin didn't hit me til i laid down now my head's all trippy and i'm afraid to sit up.
0	thin line actually. antara kurang ajar &amp; sincere. dari tone ckp dia. we need to really understand.
1	Акку-Чек-немецкий глюкометр,Метформин известен с 40х годов,очень широко применялся,потом отменили из-за лактоацидоза(может вызвать),а теперь вновь препарат первой линии при лечении СД.
0	Обычные парни дарят девушкам цветы. Я - набор целебных трав и сальбутамол.
1	i knew one day enbrel would b the death of me
0	yes, was given oxygen and albuterol and was released.
1	metformin in my system makes me wanna puke.
0	В полночь ты понимаешь, что флудрокортизон,флунизолид,флутиказон,флуметазон и флуоцинолон совсем разные вещи,а утром их надо уметь различать
0	sucessful treatment of wet amd with eylea anti-vegf injections, a proven alternative to lucentis
1	trazodone was evil. turned you all flat
0	you burp with calvin coolidge. you step on imodium ad. you stay at the vin diesel resort. good night.
1	sorry for jumping in. trying to get up for work after night seroquel is a nightmare!
0	see, i knew vyvanse was doing me good.
1	cymbalta switch is part of what made me flip. but any snri with family hx of mania puts you at risk.
1	developing add in my s thanks to the memory/attention-killing lamictal i've been on since my early teens.
0	Ну тогда только прозака въебать и вперёд горбатиться. В пятницу забухать. Колесо жизни. Можно к психотерапевту сходить если деньги есть.
0	i was aware of the disabilities caused by the drug thalidomide obviously but i didn't know the horrendous back story...
1	2 day rivaroxaban diary. still residual aches and pains; only had paracetamol today.
0	can you give januvia with victoza?
1	я с флуоксетина вообще с катушек слетела и это был пипоц
1	you forgot the immodium for when the cipro kills all the good bacteria.
0	155. «Я потерял девушку (наоборот)». 156.  «Уже не выстоять и он/она дверь показывает». 157. «А ты любишь мое/свое тело». 158. «Ты иголку в стоге сена нашла». 159. «Врубайся в его ритм». 160. «Разговариваем с продуктами; инвалид / инвалидка; Талидомид». 161. «Проявлю».
0	it was horrible they removed mine yesterday so happy im going to try the nuvaring i guess
0	Нексиум просто пиздец. Зачем я пью эту гадость для желудка,если потом заедаю его жвачкой
1	И качество проверили бы тоже. Невозможно, меняют коробки, внутри фальсификат, от которого плохо, что это. Энам, Ципролет, Анаприлин, все поддельное, людей просто травят.
1	last night video chatted me while i was in a lunesta haze. i couldn't see or hear her, but knew she was there. weird
0	Ципролет. Спасибо, что ты есть.
1	@Alexxxjaster Эутирокс давал мне нормальные анализы  какое-то время,  но оставались симптомы. Потом приходилось повышать. Постепенно с 25 у меня доза выросла до 100. При этом самочувствие ухудшалось.
0	@chemical_madman окей, согласна увеличить срок принятия оксикодона в фанфосе, или найти другое обезболивающее, вызывающее ломку?
0	oxycodone is a gift from god
0	exelon $exc q3 adj.eps usd 8 vs. e. usd 2
0	мне сказали, что надо пить 200 сероквеля, иначе мне пизда. выбираю пизду себе, чем своему кошельку.
0	"Нет,у норвежцев свои высшие силы и имя им ""Сальбутамол"""
0	yes. coumadin for blood, keppra &amp; lyrica for seizures. atenelol for heart rt : you taking coumadin/warfarin?
0	cynthia sitcov, ms patient + fda advisory panel member, patient testimony on tysabri benefits were key to remarket
1	Вот хочу с вами поделиться. Я в том году сидела на диетах. Могла спокойно отсидеть два месяца голода, но как мне быть теперь? Из-за бисака и флуоксетина я посадила мочевой и желудок.Все бы ничего, я могла так же сидеть на голоде но нет.
1	ah yes, i'm starting to think my paroxetine turns panic attacks into fat.
0	i hate nightmares!
0	@koko_byy ВОЗ говорит, что в 2009 году работало:  Для лечения пандемического гриппа существует два утвержденных антивирусных препарата. Это ингибиторы нейраминидазы осельтамивир и занамивир.  Глобально же, кажется, эффективных противовирусных препаратов пока не изобрели или не проверили.
1	my body was almost descimated with crestor prescribed by doctor. unfortunately u cant trust all doctors.try red omega from drug store(cvs)
1	@carolinamoskvi Конвалис, в побочных эффектах головокружение, заторможенность, потеря ориентации
0	not true. clinical data had approval of viibryd ah on a friday. that was nda though.
0	Я скуплю весь велафакс в городе, ахаха!
