1	so far so good. i was on remicade for years then had a bad reaction. just started humira
1	found out that diclofenac i took today is q painkiller u get for cancer and post operations. holy shit. nae wunner i was tuned to the moon
1	Раньше фликсоназе, потом пару лет помогал лоратадин обычный, в этом году лоратадин не работает
1	uhh my gabapentin dose went up today and i don't even know what planet i'm on. i hope i adjust to this quickly ...
0	i need a damn lunesta or somthing
0	the humira nurse line was no help. she read off the info sheet that yes these can be side effects, said call my doc or go to er&gt;
0	Ситуация: Под вебинар грызу пустырник, ксанакс, глицин и запиваю энергетиком
1	Венлаксор закончился вчера утром, я сутки без лекарств, и меня уже трясёт, рычу на всех, как в самый худший ПМС в жизни.  Это что, я до венлы всегда такая была? 🤭🙈🙈🙈
0	утром начала грозовой перевал, сейчас смотрю нацию прозака. в химках сегодня депрессивно.
0	i'm convinced that the crestor commercial is the absolute stupidest commercial ever made on the face of the earth.
1	i switched my advair for cymbacort doesn't burn my mouth
1	dear lord how did i just now wake up? thank you trazodone for ruining my life.
0	nothing currently registered in eu/us for rivarox or apixaban wrt valves.
0	Психиатр выписал флуоксетин. В интернете очень много инфы про потерю либидо. Аноны, я смогу ебать тянов если буду есть это?
1	coming off mg venlafaxine over days was a better idea in discussion. my brain feels like its actually vibrating!
1	nicotine headache!
0	rt : in china, an etanercept was approved yrs before enbrel &amp; holds % of ra biologics mkt ...
1	ventolin makes me so weak holy shit
1	i take quetiapine and it's supposed to just relax me i end up falling asleep within hours. my brain's always scattered haha
0	i feel that. my friend who got off heroin via subone had a similar eerience.
0	rt : i am the throat lozenge gwede mantashe refused.
0	@generaIanna @AlenaSvetoch У вас Д2? ИМХо с  метформина  реально слезть. Если хотите конечно.  2-х разовое или 3-хразовое без перекусов питание это основа для тех кто хочется  реверсировать ИР или Д2 без метформина.
1	feeling a bit light-headed after ventolin but i'm breathing like i'm supposed to for the first time in like years..feels great
0	nexium judge not giving defendants directed verdict now, but clearly leaning in their direction.
0	check this site out for great sildenafil deals
0	linagliptin for patients aged years with type2 diabetes inadequately controlled with common antidiabetes treatments
0	Впрочем, флуоксетин должен был поднять её уровень. Так что может и норм
0	like umm healthnet covers onglyza for my sister why don't you guys????
0	some people need to get on latuda !
1	У меня такие странные мышечные ощущения от паксила кстати бывают. Может у феназепама тоже бывают такие побочки
1	so my body was goin threw withdrawl? lol didnt kno paxil was that strong lol
1	i couldn't take lamictal week into it i got the rash.a rush trip to the er.6 months till rash was gone.
0	i wanna go to sleep. too late to take seroquel.
0	haven't been taking my flovent so i may or may not have an asthma attack oops
1	Препарат снимает спазм легких, который свойственен для астмы. Вы сколько не бегайте, устанете, но бронхоспазма у вас не будет. Вы тоже можете попробовать вентолин после бега - ничего не изменится.
1	Сероквель я бы подумал тоже и возможно пересмотрел с врачом - от неё часто хочется есть больше чем надо, что вернёт к проблемам с ЖКТ, и тд, хотя если чисто как снотворное то хороший современный нейролептик.
1	latuda w/fooda will make you snooza
0	tysabri is by far the most effective but dangerous dmt on the market. ....... i took that risk and its halted my disease !
0	you are delusional! you should seek help! risperdal or zyprexa would do the job!
0	“: depression hurts.” cymbalta can help!
1	the oxycodone finally hitting me. literally didn't work for the first days..but now i feel it. really makes u light headed
1	reading about all the risk and side effects from the nuvaring kinda makes me nervous.. as if i don't worry enough without searching google..
0	ciprofloxacin has its intercourse intrusive more sectors extra something like herbal, crackpot supplements, thyr:
0	i need a cipro refill. i'm pretty sure i got tonsillitis...again!
1	not going to take my latuda til tonight. that stuff's gon' make me pass the hell out within minutes, &amp; i wanna watch me some !
1	меня и так тошнит постоянно то от алкоголя то от прозака но когда я ко всему ещё и заболела ситуация стала вообще критической
0	my thyroid is a-okay. i have sacroiliitis, and am being put on humira, if they give it to me for free.
1	off venlafaxine which was pure hell for me, i can't switch these meds anymore, tired of feeling like shit all day.
0	Поэтому путь к микрофону им прокладывают ксанаксом и хлебными крошками
0	Пойдёт.Ципролет строго по часам! Обязательным курсом! Простите,что напоминаю,просто некоторые к этому относятся не внимательно,опасно это.
0	good to hear things are ok. check out exelon jobs. let me if you apply for anything. exelon owns bg&amp;e.
0	when the oxycodone kicks in i see why there addicting now tbh.
1	side effects of 'paxil rose' include slash rash and some izzy-ness upon standing.
0	just noticed how ridiculous the halls throat lozenge wrappers are.
0	будут продаваться с предупреждением о возможной инвалидизации в случае применения ципрофлоксацин;  левофлоксацин. https://t.co/Vblc0UDEKc
0	выходила из дома сегодня в течение дня 3 раза. т р и. чувствую себя как эллиот под аддералом
0	@VRSoloviev Владимир добрый день! Вы можете еще раз сказать Ваш рецепт против гриппа. Тамифлю,парацетамол и витамин С /порошок/ как пить? Спасибо большое.
0	Заоблачное сияние тьмы, менталитетом Введенный тариф: вновь парить, Я задыхаюсь от боли, твори, вентолин Паритет нашей дружбы стал пылью.
0	latuda has to be the worse name choice for a prescription drug
0	Удар по безопасности государства )) срочно открыть аптеку на первом этаже , имодиум со скидкой
1	oh yuck. we all have our least favorite body fluid. mine is aerosolized blood. nosebleed on xarelto -eeeew
1	anyone on enbrel get a red circular rash around their injection site? i've been on it for a year or so.
0	when the doc gives you an injection of antibiotics, and a prescription for cipro, you know you should be on your way.
1	victorymy drug choice!! (tysabri) but also found i am jc virus +ve and now panicking. any1 else on tysabri n jvc+ve?
0	latuda will cure your manic depressive disorder, but can reduce white blood cells.......... which can be fatal.... 🆗🆒
0	i ask my doctor for a prescription for cipro when traveling. i haven't needed to use it, but it's a piece of mind!
1	please tell me that wasn't quetiapine! that stuff is sooo sedating...
0	as much as you induce-gulp down other occupy lozenge loaded differently stomach?
1	i took a nexium why do i feel the burnies
1	take first pristiq tablet for weeks. immediately feel sick.
0	lol i'm gona need some cymbalta next year...
0	Мне тупо лень дышать турбухалером, пить таблетки и мерить давление
0	sting. an am£azing sword. glows blue in the presence of orcs. and reminds you to take pregabalin with a little black dot.
0	hey nurses and physicians. i've had g of miralax and mg of bisacodyl... why won't i poop?.
1	i started enbrel to try and help my ra which had gotten very bad. it dramatically lowers the immune system..
0	on new med, pristiq. its working ok so far...i miss u all! xx
1	... used to be on them ...worst was the psychotic episode when starting but one of my favs
0	seroquel was a life saver for me, sorry to hear it didn;t work for you.
0	have a cuppa while i wait for the sildenafil to kick in.
1	i'm having to pee way too much this drive.. drinking too much water. fuck you mg vyvanse and your ability to dehydrate the fuck out of me.
1	vyvanse makes me think too much
1	my ex was on geodon and she had a seizure in the latrine at ait. i would just fall asleep at metro stops, restaurants
0	geodon is an atypical antipsychotic - keep an eye out for sedation, falls, abnormal movements, orthostasis
0	Сиофор® 850  Начинают с суточной дозы — 1 табл. Сиофора 850, затем ее увеличивают с интервалами примерно в 1 нед до средней суточной дозы — 2 табл.   АААААА почему мне прописали сразу 2 таблетки это странно простите но я тоже врач и вы больше не вызываете у меня доверия
0	? is that a new medicine of some kind? like amoxicillin? or ciprofloxacin?
0	and after ten days of paxil i am times more assertive, side effects are wearing off im feeling positive
0	rt : [drug applications] fda issues complete response letter for xarelto (rivaroxaban) to reduce the risk of stent...
1	- take a baby aspirin w/the tecfidera or when you eerience side effects like flushing. -4 oz of applesauce w/pill also helps.
1	or maybe that's the prozac ugh i need a nap always
0	@juliamayko @and_Possum Не, Папе пора курс прозака. Он не в себе(( Очередные детсадовские игры. Этот удалю, этот приоткрою(( Херней страдает
0	lol at the victoza commercial made up entirely of side effects
1	my mood swings are getting worse and lamotrigine isn't helping at all.…
0	intake of so much nicotine, can make u a dead machine!
1	tired after the tysabri infusion? i am...
0	rt : everyone on my tl needs cymbalta.
1	i tried that going cold turkey on venlafaxine and depakote is not a good idea i dreamt colours and lost my fucking mind aghh!
1	Смотрела недавно видос одной девушки, которая говорила о флуоксетине Мол, да, сначала помогало, а потом ей стало ПОХУЙ КОНКРЕТНО НА ВСЕ Что бы ни происходило. Абсолютно.на.все.
0	dad is on cipro right now lol and keflex...
1	i feel like a drug addict taking seroquel every night.. but oh well, great sleep beats no sleep. except the shitty feeling when you wake up
0	canagliflozin demonstrates better glycemic control and body weight reduction versus sitagliptin in a weeks clinical study
1	@moon_out @Zverovski рексетин курсом ебошить надо и он рецептурный, перед его приёмом надо к психиатру сходить. да, и он больше эйфорических ощущений принесёт, а не успокоения, обратный же захват серотонина, вся хурма.
1	@sanyacharon Привет,  котенок,  я человек с тем же диагнозом, уже полтора месяца принимаю пароксетин и пока не вижу эффекта (твой тред вызвал надежду)  Как думаешь, ТДР давит на восприятие?  У меня страх,  что я не люблю своего человека,  потому что не испытываю того,  что было до депрессии
1	tell you okes what: when your dr. says only take seroquel at night, only take it at night. zombiness galore.
1	it's called lamotrigine, i'm pretty sure the mix of them both is making me sick. i don't think bipolar &amp; add mix very well..
1	found them. starting back up on effer. vomits shall ensue!
0	Следующий на очереди — лонгрид про метформин, практичски «элексир бессмертия 21 века». У меня есть PubMed, и я не побоюсь пустить его в ход.
0	doesn't mean worldwide thalidomide was rejected in timely manner.
0	acid reflux is the worst. especially at night. nexium works for hours.
1	deciding against taking adderall today because i think i want subway later.
0	no, no, i tried felbatol in the summer along with tegratol, then i tried vimpat and got onto zoloft near the end of the summer...but was i
0	viagra sildenafil blood pressure
1	does cipro make anyone's else's brain turn to mush or am i actually just going crazy?
1	i’m sort of nauseous. don’t know if it’s a side effect of the viibryd or i need to eat more or what. unpleasant.
0	"congressman peter king is well informed on the perils of ricin attacks....""cipro isn't going to help you"". ok pete...."
0	пульмикорт в дозировке 0.5 развести 2мл лекарства на 2мл физраствора. Через небулайзер. Спасение при отдышке!
1	whoah so dizzing. damn tamazapam - shld probably wap back to quetiapine if this keeps up! but it makes me feel so ick!
0	all the effort and passion in the world is nt enough. paxil patients r suffering from a giant hole ripped in their soul.
0	i take venlafaxine. happy to discuss in dm.
0	"rt : she whispers throatily ""bring me a lozenge...a penis lozenge."" *sore throat inspired erotic tweet"
0	доктор хаус: абстинентный синдром без викодина и оксикодона эллиот алдерсон: абстинентный синдром без морфина и аддерола я: абстинентный синдром без кофе
1	i hope so too. remicade didn't work for me but humira is doing great.
0	this happened to my in laws. was on januvia and byetta for no reason. paying close to k out of pocket per year.
1	bloody zombie i also take venlafaxine thats for cronic depression bipolar is a difficult illness to deal with, both for the
0	great start to top gim talk by dr shadowitz. first up: apixaban prevents vte/death after unprovoked vte, no increase bleeds
1	"i think taking advair literally made me shrink an inch because i've been '9"" for years and the last year i was measured as '8"" twice wtf"
1	i know. i just realised with everything else - i haven't taken the sodding quetiapine yet!! wondered why i wasn't drowsy doh!
1	i'm on enbrel (1 year) but my as is getting worse and my psa is x worse than months ago. eekk! im only , diagnosed yr
0	hey juan morra, familiarize yourself with the exubera bong - looks like smoking morra juana. $mnkd
1	i take pristiq and i have headache do you think of it?
1	my hands &amp; legs are holding a hate campaign against me. i can see us falling out if they don't sort themselves out
1	spiriva adcom: studies in copd had specific protocol language for sudden deaths/ acute cv conditions and excluded unstable pts.
1	lol viibryd made me puke first day taking it
0	in ciprofloxacin i trust
0	me too, when a greedy lawsuit took vioxx away it took the st med that helped my pain
1	medication side-affects have hit me hard today: i keep on randomly jolting or rocking, it is so bad i am finding it hard to type!
1	are you depressed? are you anxious? do you like headaches and diarrhea? if you answered yes to the last one, then viibryd is right for you!
1	throbbing headache from not having my pills. pills left i need to save. this sucks
0	"Антибактериальный ""Ципрофлоксацин"" что это за средство? Мне кажеться, что его надо добавлять к антибиотику ""Цефтриаксон"", я добавляла таблетки (раз в сутки) ""Доксициклина"", но особого улучшения не было."
0	i hope the have their imodium ad because they're about to get mad bum.
1	i'm sorry to hear that. i had a side effect from humira that negated all tnf blockers so no enbrel for me either.
0	сальбутамол аэрозоль или эуфиллин таблетки, если удушье мучит. а если ты тупо неуверена в себе - дуй в народ и знакомься там.
1	i was prescribed levaquin w/ prednisone x in mos. permanent nerve &amp;tendon damage. there are hundreds of thousands of us.
0	from cogencis: japan's takeda sues ranbaxy labs for breach of uloric patent in us
0	"""i'm , compose my own beats, &amp; lyrically dope enough to ass rape the dude who made nicotine"""
0	итак, новости. таблетки снова начали помогать и вообще проблема того что я лежала три дня не в прозаке
1	this tamiflu is making me feel worse than i already feel and i don't think the z pack is helping
1	taking advair on camera doesn't confirm you have asthma, don't play w thse drugs they can cause pancreatitis evr!
0	2009 году Бьорген получила от Международной федерации лыжного спорта (FIS) разрешение на использование препаратов от астмы, которые содержат в себе запрещенные вещества (в частности - сальбутамол).
1	i can't secretly try and come off my olanzapine as my cpn and psychiatrist will notice the weight loss!
0	На завтрак предпочитаю чай с парой кубиков флуоксетина внутривенно.
0	someone broke into our apartment and stole tons of money and my adderall
0	it will be at least b. exubera was like i believe and it was a bad product.
0	Мне тут бюллетень предлагает вернуть смысл жизни Прости, я больше не пью пароксетин
1	"can also get ""extrapyramidal symptoms"" ie tremor from olanzapine."
1	антибиотик цифран мерзкий на вкус, хожу уже который день как говна поела и ничем этот привкус не убрать
0	replacement for fluoxetine anyone? need a cheap drug to treat social anxiety, depression, bipolar disorder and bpd while i'm out of nhs? lol
1	my vision is blurred rn from tbis oxycodone
1	this prolonged release metformin isn't working so well.
1	the only bad thing about vyvanse is the awful headache you get when it's starting to wear off
1	synthroid is causing freq afi. what is my alternative???
1	hey gurrrl, it might just be the januvia talking but i have severe abdominal pain that may be severe pancreatitis and lead to death.
1	i have no idea what loritidine is - but advair and albuterol make my heart rate soar and hands all jittery - it sucks
1	plus jenifer helped me with my sister jennifer who died maybe from lyrica you guys are the best
0	best. tried concerta, strattera, adderall, and finally, vyvanse
0	сейчас я случайно наткнулась на статью про аддерал и вспомнила о том разговоре. прошло ДВА ГОДА а я до сих пор солюсь &gt;:(
1	lamictal withdrawal update: starving!
0	sildenafil citrate on women
0	rollin up to babys house poppin a shit ton of imodium
1	coz olanzapine increases hunger strains u all day dosile unless u get up when ur accilies still wud n coffee am fog frost
1	Только без прозака. От него немного самовыпилиться хочется.
0	needs imodium
1	/swiftly taken off that for vimpat. vimpat made seizures less well controlled but less side effects. on that i had speech/
1	it was! supposed to take synthroid but it doesn't help &amp; i'm vit d deficient. so that has a lot to do with it also i think
1	thank you! i hope i don't have an allergic reaction like saphris and zyprex. choking is no fun.
0	Федеральная антимонопольная служба (ФАС) выявила завышение цены на препарат «Нексиум» более чем в 10 раз.
1	thank god it is finally get cooler in london. i have been melting all day! i wonder if my medication reduces my tolerance to heat?
0	ranbaxy falls on buzz of losing nexium exclusivity period: as per analysts nexium sales in the exclusivity period can be to the tune ...
0	«Мангистаумунайгаз» объявляет закупку: L-тироксин / L-тироксин #tender
0	for ms, if jc virus positive, is it worth trying to change from tysabri to campath? thanks!
1	it wasn't an easy victory though. felt like chemo with the cipro. as for the heart, i meant for study purposes.
0	@bloodyemaria @FoxLovingBoxes Обменяю рецепт на Ксанакс, на Галоперидол)
1	how do guys ejaculate on paxil??
0	i straight feel like i took a whole bottle of adderall
0	anti-cytokine agents infliximab and etanercept act by interfering with activity of pro-inflammatory cytokine-tnf-alpha and useful in ra
0	get some prozac “: that situation should've been handled differently. i've grown and i'm continuing to grow. glad ...
0	Пока на месяц прописали золофт и сероквель
1	i'm in so much pain now... tendonitis, headaches, cognitive issues... i feel violated.
0	"in paula deen's defense, victoza's side effects include ""sudden, uncontrollable racism."""
0	Еду в поликлинику за рецептом на Ксанакс.
1	i guess viibryd has a short half life, bc i feel like hell.
0	fucking hate humira shots why can't i take a pill
0	Я умру, если выпила винишка, хоть принимаю антибиотики (ципрофлоксацин)?
0	it's time for a penny cartoon. i just went to luau bbq and melted some imodium ad.
1	rt : just wondering where the side effect of hating the world is stated on vyvanse advertisements?
1	i will but the flow vent and advair helps so much they make you so shaky.
1	Принимая, например, прозак очень сложно заснуть. Пять месяцев почти провел на снотворных. Потом почему-то отпустило
0	blocked nose? take the vicks lozenge. helps to clear your airways
0	Я люблю паксил но без атаракса я все же не могу засыпать, не говорю об этом психиатру, чтоб он не переназначил основные ады)))  Пиздец я ужасный пациент
1	я триттико пью, он нетипичный и повышает либидо хихи :D тоже СИОЗС больше не выписывают
0	"these same people don't even know what, who or where cipro is. the don't have a business bank account. but u ""own a company"" right? right."
0	Еду в трамвае, чувствую себя аки  бэд герл, слушаю пинкфлойд, на деле 20 мг таблеточка прозака
1	... gabapentin can cause you to get very hungry. just be prepared. amitriptyline...just ease slowly and use a low dose.
1	trying to do a french manicure after several puffs of ventolin is proving challenging to say the least :-\
0	[ fuck now i want some cinnamon toast crunch but i just took synthroid lays down and whines loudly ]
0	novo, based in bagsvaerd, eects to complete the two remaining late-stage trials for victoza used as an obesity medicine by mid-2013
1	&amp; i'm about to be sick af tomorrow because i ran out of paxil
1	Судмедэксперт почти не ест. Гэвин сам не страдает переизбытком аппетита, в основном из-за флуоксетина, но систематически берет кофе и какую-нибудь булочку в кафетерии. Ричард берет только чай. Обед, как Рид узнал из сплетен стажерок, тот тоже не носил. И жил на чае с 8 до 20.
1	not getting any better here so dragging myself to gp. i'd rather be mad than comatose! hope ur doing ok
1	lamictal nap ft. cups of caffeinated coffee
0	i still need to study seretide and ventolin nebules all over again remedial on monday! ruby ruby ruby!
